message,Y
obermann added that the mobile industry in general was still,1
hereas minidisc  flash mp3  portable cd players etc. are rea,1
15%. some technical websites report that a majority of their,1
led in years to come. if apple gets its way then a lot of pe,1
ations in the us managed to view the site with no problems.,1
however  by failing to announce any details of the next gene,1
o shows  called podcasts. but 2005 will also see more compet,1
record of restricting what is published in the media that is,1
ss.  this is despite the fact that the number of people read,1
n pronunciation. however  online versions of the sims  in wh,1
if those watching are not familiar with the layout of the ma,1
tions institute (etsi) formally adopted digital video broadc,1
hearing on a permanent injunction.,1
ientating. super mario 64 ds is a faithful re-creation of th,1
would not see anywhere else. familiarity with the net also h,1
working tool!  the sinclair executive was the world s first,1
t is also increasing efforts to squash software piracy in ch,1
hanged information about you and your relationships. this in,1
tles and had an immediate impact on critics and consumers.,1
ss the whole industry and if that s done effectively we will,1
is predicted that there will be almost 2.5 million  entertai,1
camera phones of top artists.  the exhibition  fonetography,1
tudies peer-to-peer networks  said exeem was the next evolut,1
t ll be two or three pounds per month   said mr wasenius.  b,1
ed  high-definition tv  cable set-top box  digital video rec,1
rs is passed  use of new innovations tends to take off. dr b,1
ibrium in europe.   emi currently offers its entire 200 000,1
obermann added that the mobile industry in general was still,1
- about 98%. so if you have anything that allows more space,1
ld be used to back up data on the phone. o2 also offers a fr,1
is still a clumsy tool  often failing to come up with exactl,1
bled browsers into the marketplace is an overly-zealous step,1
a common tool for political campaigns.  this is hardly surpr,1
ttentive to design   said ms milanesi.   people are after so,1
ower on handsets means that physics on mobile games is getti,1
ot computers  rose from 2 000 to 30 000 per day. thanks to t,1
he said that european decisions on what to do with uwb allie,1
ges to terms of a deal being negotiated. the research reveal,1
involve mobiles. millions of gadgets are now logged in the d,1
return in response to queries. often people had to look at a,1
of the new consoles.  we want to increase that level of imme,1
msky  that mainstream media has lost the traditional role of,1
camera phones of top artists.  the exhibition  fonetography,1
the community training sessions  attended by an equal number,1
like photos  free software  licensed music and any other dig,1
g the technology in its next generation of playstations. mr,1
number of users is passed  use of new innovations tends to t,1
n using it a number of different ways - from sport broadcast,1
in may. the sheer cost of traditional prints means that some,1
for playing games. furthermore  the adoption of mobile phone,1
he corporate world. heineken is doing its own podcast now  a,1
forum design award 2005.,1
nderstanding of how it all works.  it s cheap  you can speci,1
touches more people than you might care to believe.,1
physical in their bookshelves.,1
hough a block was in place. phone companies are probably qui,1
but also bundle with it a hi-tech  efficient power supply,1
but only after months of uncertainty and millions of dollars,1
arly 1980s blessed the original noteboook pc - the tandy 100,1
developed. no competition.  i d also put apple s newton and,1
physical in their bookshelves.,1
e a following with clans  player rankings and even new downl,1
ployed 268 people. after the latest round of cuts there are,1
lly trying to fool your ears into thinking sound is coming f,1
internet explorer was used by about 95% of web surfers. that,1
e previous three months. despite the good news about growth,1
ongs to pararallying  the world s only rally school for disa,1
terest but the new development may prompt changes to freevie,1
er the net for free. suddenly  with the help of the website,1
is bound to please  if not surprise  many individuals and us,1
hesaid. the mac mini could find a role in homes that need a,1
the software more useful than it would be to a scientist who,1
f up to 30 miles. kent is likely to be the site of the uk s,1
be modified.  in addition  the user can choose to disable th,1
eloped over the months as a character in her own right  acco,1
of 2006.,1
in the first two days it was on sale in europe the 87 000 ds,1
ne box office blockbuster movie in the united states   said,1
ilable technologies  although it had to upgrade them to be a,1
but the impact spread into her personal life too. she did no,1
o the mix. it is an emerging new breed of competition for sa,1
ns them.  in january 2003 the slammer worm knocked out 13 00,1
powerful computers.  in the future  all forms of digital con,1
e in japan on 2 december. nintendo has a 95% share of the ha,1
03  the market was worth 10.6m euros (£7.36m). digital musi,1
also changed. this is likely to be in response to spammers w,1
led 25 people. during the crackdown following the blaze auth,1
has to think carefully about what the market is going to be,1
ns on mobiles and for the majority of people out there who d,1
a digital camera.  the software includes tools for restoring,1
consoles like the sony psp and the nintendo ds  since they a,1
tribute them to agencies and people who might be able to hel,1
trust  said the new technique was the next logical step for,1
ngram said it was important to  separate hype from reality .,1
tor at mac format magazine. he added:  in essence  it s a la,1
s heavy and fog is common laser links can struggle to mainta,1
earch suggested that broadband was challenging television vi,1
people. it is also of concern to them because advertisements,1
. he tried university in the us  and ended up back in hollan,1
it cards and false identification information and documents,1
e providers in the uk now and an often bewildering array of,1
.  we put in 25 laptops three years ago   only one has been,1
rs to less than 40%. bt is hoping its latest offer can persu,1
ail addresses to send itself to.,1
ing station. likewise  any voter who refuses to be inked wil,1
lty  top gear and antiques roadshow. the bbc is trialling a,1
duals and companies can avoid the hassle and stress this can,1
even used speech to give instructions and play music. howeve,1
as napster already offers a cheaper service for downloading,1
than 50% of the 22.8 million uk net users regularly accessin,1
recent reports from china  the authorities have tightened co,1
ore than 50% of the 22.8 million uk net users regularly acce,1
o gave people a simple  single way to regain some control ov,1
the horse power for tasks such as high-end video editing or,1
aloguing the huge amounts of information that people increas,1
g on and make decisions based on that   explained dr bowden.,1
s which ms stefani has helped design and which are heavily i,1
man for net provider pipex  said that when ddos attacks were,1
path. the expected fiendish puzzles are all present and corr,1
also changed. this is likely to be in response to spammers w,1
ty suffered after security scares. up to 200 million passpor,1
first port of call for users when they go onto the web. the,1
mr weiss said:  old media always tries to stop new media.  w,1
a rival in ibm  which argues that its capacity on-demand ser,1
siness methods is permitted.  this means that the us-based a,1
of more than $50m which included the $46m that microsoft is,1
rned that spam e-mails contained viruses or programs that at,1
onen  who heads f-secure s anti-virus team.,1
bile phone sales passed 167 million in the third quarter of,1
versions of cabir are know to exist  one of which was inside,1
esday. the gadget explosion signalled the strongest growth y,1
adband services   said mr stening.  it takes a big leap for,1
programs also need to be tailored so that they can be instal,1
ted or saved to cd  floppy disk  memory stick or flash card.,1
forms hijack net browser settings to force people to view pa,1
r games. halo  the sims  driver  need for speed  fifa footba,1
ipped to make up one of the most important markets in the ne,1
ign up for those being pushed by apple and microsoft. confus,1
ainment industry paper variety. tnt aims to reach 35% of fra,1
ort took an in-depth look at romania where reconditioned mob,1
the basis for a secure authentication system which could hav,1
mer electronic items  safe   said roger cumming  director of,1
a rival in ibm  which argues that its capacity on-demand ser,1
ihan  editor of the computerandvideogames.com magazine.  it,1
bodies  carrying bodies   mr gupta says of morquendi.  i can,1
cument in we were forecasting that the total market would be,1
services like tivo to go let people transfer pre-recorded tv,1
that date. it currently has 7.4 million subscribers  while t,1
s the british library catalogue. the service has been rolled,1
and that it would never canvass support in this way. she sai,1
the form of the material used in fibre optic cables. this im,1
as interactive tv  casual gaming is shaping up to be big bus,1
er the net for free. suddenly  with the help of the website,1
ng the most out of audio  video and images but it would not,1
et the new id cards since their countries have already ratif,1
n the us and australia  sign language relay services have al,1
eft or faster recovery of stolen items. the tags are current,1
rosoft s plans to make its own security programs.,1
an mp3 player  movie player and camera  could be a must-have,1
ign up for those being pushed by apple and microsoft. confus,1
november  helped to buoy the sales figures.  gamers are look,1
nterested public is not the same as the public interest . ju,1
main has now been handed back to paypal but it sets a worryi,1
cument in we were forecasting that the total market would be,1
may see no reason to distribute content to people who will n,1
e majority of online shoppers. similarly  with art  browsing,1
much of this online shopping is likely to be done during wor,1
for the first time and rss is the ideal way to keep track of,1
d players to buy the different players and displays required,1
fficiently   said mr voigt. respond supplies maps to aid gro,1
two components   said steve kleynhans  an analyst with meta,1
rotocol. when computers communicate with the net  a unique i,1
auma won best film. elsewhere  fashionista and clothes desig,1
ollowing a decision to license all companies which wanted to,1
od.  harris added:  everybody thought that apple was happy t,1
ey rather than the technology. no longer do virus writers pr,1
has been made there s little that can be done.  gavin patter,1
7% of the consumer electronics market is made up of female b,1
firm clearswift said this tactic of creating thousands of mi,1
eld since june 2002. it is dedicated to climate modelling an,1
he same information via other routes. a small number  17%  s,1
enagers get a new mobile every 11 months  adults every 18 mo,1
are a little predictable and tend to drag the general polish,1
ly  mobile phone sales passed 167 million in the third quart,1
innovative features  like add-ons or extensions to the progr,1
s oversee each shooting session and can stop the gun being f,1
for the first time and rss is the ideal way to keep track of,1
turned off.  the months of surveillance revealed that the di,1
astically   said ms madden.  they are using the internet to,1
ly witnessing a series of pre-set moments of action  is a pe,1
bizarre inability to jump  the even more bizarre glaring gra,1
nded to shy away from innovation. only 11% regarded themselv,1
nventions must go back to the eu for re-consideration.,1
improved over the last year but the real barrier remains psy,1
ger.  the tv at the moment is a relatively dumb box which re,1
sions  those likely to respond to these kind of adverts will,1
credit card details so that they can pay without having to r,1
crosoft also made some announcements in the portable media a,1
r pollard. arbor network s technology works by building up a,1
ittle point in buying what is quite an expensive bit of tech,1
evices  where technology is worn  or even fuses with the bod,1
at its virus cleaning program would not stop machines being,1
rned that spam e-mails contained viruses or programs that at,1
milar idea to voip services  like skype. both use broadband,1
n weiner  a research director at analyst firm gartner and so,1
.  we put in 25 laptops three years ago   only one has been,1
o announced it was installing high-speed wi-fi on certain tr,1
virgin emanating from their first cd player   asked the maga,1
said it had no need to update the browser. typically new ver,1
to motivate them where appeals to the wider public interest,1
sis. readers of the boingboing weblog have found that viewer,1
7% of the consumer electronics market is made up of female b,1
ent laws are inefficient and it would serve to even up a pla,1
last six years  the uk market for games grew by 100% and was,1
e out in the summer. it will have 5gb of memory on board.  d,1
e providers in the uk now and an often bewildering array of,1
y are protected against the latest threats.,1
me are written from a particular political slant and others,1
e titles for the console. for gamers this emphasis on ease o,1
s because the sims does not rely solely on words to get info,1
one is harbouring 28 separate spyware programs. currently us,1
etworks that let a person s gadgets quickly and easily swap,1
ut 2005. the event is being billed as the cpl world tour and,1
services like tivo to go let people transfer pre-recorded tv,1
d the lawsuit was groundless and the two men would defend th,1
king a call there. nokia said these findings had implication,1
of air from an era when the xbox was not even a twinkle in b,1
s  according to a spokesman.  computer specialist at the iae,1
ndo says sales have exceeded expectations  without giving de,1
hina partly because of fears people have about getting in to,1
r first cd player   asked the magazine. karl elsener s knife,1
last six years  the uk market for games grew by 100% and was,1
stalled the lifts. the first record for the world s fastest,1
erating system is heavily exploited by virus writers because,1
the synergies from them working as a team will be lost.   no,1
spite a series of stories warning firms about the dangers of,1
could be.  he added:  graphically it was superior to everyth,1
were being offered a subscription service.   we saw potentia,1
the software more useful than it would be to a scientist who,1
designs  each built by a different research group  use the s,1
at kiosks. image sensor technology inside cameras phones is,1
h suggested that broadband was challenging television viewin,1
apping pirated movies and music. the exeem software has been,1
esday. the gadget explosion signalled the strongest growth y,1
ular song  there is also the ability to interact immediately,1
dios which was behind the ambitous and widely acclaimed game,1
in car theft or faster recovery of stolen items. the tags ar,1
s which ms stefani has helped design and which are heavily i,1
te walking  talking people with believable clothing  skin an,1
they tried. although the two partially-paralysed people perf,1
yles. ericsson s research has shown that consumers divide in,1
ed for downloading   said mr babinet   we don t want people,1
o announced it was installing high-speed wi-fi on certain tr,1
er sent a multimedia message  or mms. that was 7% more than,1
d players to buy the different players and displays required,1
the survey said  thought if they lost their phones  it would,1
for a cosmetics firm racked up 12 500 interactions.  before,1
onen  who heads f-secure s anti-virus team.,1
the original search. these small ads helped google reach rev,1
the fake domain has now been handed back to paypal but it se,1
ncomes and college educations  the survey found. this was al,1
a powerful modelling tool to interact with actual situations,1
cember 2002  it sued a former contractor who allegedly put d,1
l be of scholarly use  as well as general interest  to peopl,1
ns on mobiles and for the majority of people out there who d,1
ns of downloads. the returns can be pretty good when you con,1
gelabs was starting to see some phishing attacks become very,1
those who fall victim to these attacks can find that their b,1
f the cept work has caused controversy as some think it over,1
is used before people publish any word document. a tool for,1
as an mp3 player  movie player and camera  could be a must-h,1
a fair bet that even fewer do so with the phone they carry a,1
s important.  those four sites are extremely profitable and,1
ital lifestyle. while short on detail  he painted a picture,1
hison argues blogs have become independent sources for image,1
at kiosks. image sensor technology inside cameras phones is,1
s can find the prices for local produce  as well as informat,1
mr weiss said:  old media always tries to stop new media.  w,1
usiness methods is permitted.  this means that the us-based,1
they will be able to play standard dvds too  which is good n,1
its and lifestyles. ericsson s research has shown that consu,1
t to the search query  but does not pinpoint when the search,1
s.  the more cameras using piero  the better the detail poss,1
lm council.  although a genuine variety of films is availabl,1
ld have arisen had the sales not been achieved.  mr rubin sa,1
one is harbouring 28 separate spyware programs. currently us,1
re for specific industries or organisations such as .museum,1
e it has been working with network vodafone.  we have focuse,1
surplus cash will be used to help keep the mozilla foundatio,1
l result in more disabled people becoming involved in all ar,1
ne against 20 emcees  tote king shows he is well aware of th,1
ll work with very old peripherals  such as display  keyboard,1
e portable media player. motorola has just announced a deal,1
ularly clear when they [employees] do cross the line.  he sp,1
ings that need fast and reliable connectivity. of course  br,1
latform  to let telcos to do exactly that  seamlessly. it ha,1
viruses and customers not being able to get cash out at all,1
th battery life if mobile music hopes to compete with digita,1
and dozens of companies demonstrated their latest products a,1
for the project  though. in an e-mail  dan lane calls it  an,1
a revolution in computing  graham barlow  editor of mac form,1
odder . doug kaye  a california-based podcaster  praises the,1
ink is very effective at getting under the cuticle of the th,1
services. leading china-watcher  and founder of the cga cons,1
t that the supreme court will hear this year.  it s about pr,1
average person has a library of 600 digital images estimates,1
onitor  mouse  keyboard and windows xp2  much more than the,1
what people are looking for is worth huge amounts of money.,1
ple will be doing with technologies and gadgets in the next,1
we have technology out there that allows us to detect attack,1
uld crack the code. it was all about underground notoriety.,1
h download services are very different from p2p networks  no,1
e in the summer instead. with more than 52% of us homes expe,1
e broadband net access. in july last year  the number of uk,1
file-sharing systems that let people get hold of pirated pop,1
said mr gerolami   but we re optimistic that it will revolut,1
each other  he added. the paper is part of the ippr s digita,1
sri lanka  blogger morquendi is recruiting others to help. o,1
l. more powerful smartphones like the xda ii  nokia 6600  so,1
ne against 20 emcees  tote king shows he is well aware of th,1
2005,1
file-sharing systems that let people get hold of pirated pop,1
for the playstation 2 has meant that prices for it are being,1
added value content   thinks mr dean  ultimately it could me,1
standards are open and can work with across networks is a bi,1
browsing sessions to point people at particular sites. in so,1
l and telephone companies should have nothing to do with the,1
ich will hold six times as much data as conventional dvds. w,1
ke chromium  lead  and cadmium - common in consumer electron,1
ined as its pc parent  the sense of being part of the action,1
bined with a story and presentation that just do not feel su,1
e all different types of content. as a result 40% of the sub,1
be you tomorrow   more directly  once software patents are g,1
mmes on their way to work. although microsoft s content dist,1
ames becoming more common because they will more easily be a,1
for wounds can now incorporate nanoparticles with biocidal p,1
s strategy is a  hybrid  approach  he explained  where over-,1
the only one that stands in the way of yahoo s domination,1
bout the soda stream. this gadget changed my pre-teen life.,1
her people my commitment to recycling is shallow at best. he,1
ich will hold six times as much data as conventional dvds. w,1
phere - which is doubling every five months - was powerful b,1
e increasing numbers of weblogs that detail the daily lives,1
pt parts of the game for their own lessons.  i m hoping now,1
l. more powerful smartphones like the xda ii  nokia 6600  so,1
an excellent keyboard  a modem. a pity tandy did not make it,1
hief scaling the landscape of the graphical world. video cli,1
abuse of what is effectively part of their personality   sai,1
s sold during the three months through to september featured,1
ms are likely to incorporate some kind of distributed reputa,1
e in the summer instead. with more than 52% of us homes expe,1
can interact with the radio station in a new way.  not only,1
ple will be doing with technologies and gadgets in the next,1
ays. by contrast  he said  camera phones were being used muc,1
cepted by the age group.   certainly  we have a problem with,1
added value content   thinks mr dean  ultimately it could me,1
th battery life if mobile music hopes to compete with digita,1
never play driving games - because i m rubbish at them. no m,1
oper virus for mobile phones was also seen in 2004.  in the,1
erage consumer  we can get things of a more filmic quality.,1
d blogosphere  has already exceeded five million  and is gro,1
s sold during the three months through to september featured,1
ommunications equipment and the cabin lights.  it was alread,1
h download services are very different from p2p networks  no,1
t to build these immersive environments   said mr doherty. c,1
ys and birthdays. by contrast  he said  camera phones were b,1
ble quality to those on sony s upcoming psp handheld console,1
the fault of phone companies  and at last they are doing som,1
nfringements or simply avoiding working in potentially compe,1
carried around and shown off.  all top 10 are electronic toy,1
iously biased lists on your site  it s obviously the mobile,1
ependent game makers  argonaut games  has been put up f,1
nvestigation is warning that a computer virus is being,1
er to being a ubiquitous  all-in-one media player  audi,1
ar to enjoy a gig by the latest darlings of the music p,1
orer has a serious rival in the long-awaited firefox 1.,1
the first batch of sony s new playstation portable (ps,1
in the uk are proving more popular than ever.  bt repor,1
taking the plunge into the world of blogging.  it is la,1
unched to encourage disabled people to get involved in,1
rded for watching tv as loyalty cards come to a screen,1
e us and you are likely to find plenty of spanish-langu,1
igital entertainment in the future could change  follow,1
med by apple fans  industry experts and pc users.  the,1
d software that turns colours into musical notes so tha,1
he next 12 months look like they are going to be a lot,1
s released a trial tool which is concerning some net us,1
ghting for her job after she was suspended over posting,1
ace more than 14 million power cables for its xbox cons,1
player  phone and gaming gadget goes on sale on saturd,1
(psp) will go on sale in japan on 12 december.  the lo,1
c photo in the world has been created by researchers in,1
roadband is a central part of daily life  at least for,1
about since the start of the web as we know it now.  bu,1
be more susceptible to computer viruses  a security fir,1
side sony s playstation 3 have been revealed.  sony  ib,1
mper sales of its xbox sci-fi shooter  halo 2.  the gam,1
than movies while on the move  says a report.  produced,1
arget spam-related websites appears to have been put on,1
12 575 net cafes in the closing months of 2004  the cou,1
attract web surfers with a search engine that reads ou,1
oying a boom time in sales  according to research from,1
ms are offering web storage for people with digital pho,1
nsoles will require more graphic artists and more money,1
ckard (hp)  saying its printer ink cartridges are secre,1
y was a valuable communication tool in the aftermath of,1
piracy over peer-to-peer networks have been handed down,1
ng online could be about to undergo a massive increase,1
will double the broadband speeds of most of its home a,1
desktop search fray  releasing a test version of its to,1
mid much fanfare by apple and great excitement by apple,1
firm has turned to lasers to help it overcome the prob,1
broadband has exploded over the past 12 months  with t,1
e trend of illegally downloading us shows from the net,1
al music players can hold anything up to 10 000 songs,1
g a briton  have been arrested after a global operation,1
