message,Y
sending out many millions of unwanted e-mail messages.,1
those questioned said they turned to their fixed phone,1
t to mention the huge  screen-filling bosses that guard,1
ey are there to verify official reports of activities i,1
developers free rein to utilise the dual screens and a,1
ntrast in china workplace machines are relatively rare.,1
ne.   in the end  we tried to get to the heart of what,1
t to the nintendo title  the legend of zelda. the origi,1
p of the tower in about 30 seconds  while ascending the,1
offers.  people who try to manually download security,1
ie ahern had wanted to the centre to become a big draw,1
nd netsurity survey which found an annual 66% growth ra,1
larry niven s ringworld and the film starship troopers,1
consumers  said jeremy flynn  head of third party serv,1
the images have three dimensions and i had to find a,1
to make the robots useful for people ... if the robots,1
ording to gartner  95% of all mobiles sold there will h,1
t jump was in italy  where it rose by 120%. britain was,1
elies on links called  trackers  that point users to ot,1
over more than 1.5 million square feet. highlights will,1
ly days of dab digital radio had similar intentions tha,1
o long ago  many people thought computer gaming was a f,1
e a combination of computer chip and antenna which can,1
power to the people.  she added:  the real story of th,1
ndly technology and enhancing european cultural heritag,1
and state university of new york in albany  said the re,1
try to speak to consumers in their own language and he,1
mbered.  gilles babinet  chief executive of mobile musi,1
gn of similar all-in-one models released this year  suc,1
one and 100 gigabytes of files. direct connect allows,1
se phones use gprs. gprs is often described as 2.5g tec,1
es.  there was a time not so long ago when the film wor,1
e. nineteen percent of mobile owners were more concerne,1
osters were useful because they work outside the mobile,1
hich bears the code for the malicious bug. the attachme,1
he search action.  user experience has contributed to p,1
tor of ukif. domain names are the  real language  addre,1
rise of blogs has spawned a new desire for immediate ne,1
h the media. others helped raise the stakes during the,1
rsions of upcoming software so they can develop or chan,1
orrowed. google will not be paid for providing for the,1
replacement sales are continuing in western europe   mo,1
ething to fill their time on the way home  game fans lo,1
of the websites run by real banks and financial organis,1
eading virus  said kevin hogan  senior manager in syman,1
of data per second. uwb could also be used to create s,1
re which commissioned the research.  the efficiencies t,1
n even hold intelligent conversations.  but he is not f,1
to them  we seem to be forgetting them in ever larger,1
s splash screens that get between a user and the site t,1
bm s workplace software. workplace is a suite of progra,1
arts in europe.  it s a horrendous effort in the first,1
ccounts of the us-led war  former iranian vice-presiden,1
ording to gartner  95% of all mobiles sold there will h,1
re and affordable computer equipment. the network has b,1
down  the entertainment industry has been nervous and c,1
parliament  josep borrell  that the commission  did not,1
at dvd players for its technology would be on the marke,1
d.  we should try to speak to consumers in their own la,1
oduct management.  ultimately  we would like to have al,1
creates a virtual stadium in which virtual players ca,1
efund processor  was supposed to allow people to earn $,1
screens. cinemas will be given the film on a portable h,1
me. more recently it was behind the harry potter games,1
redit card numbers. the programs are so sophisticated t,1
tels  travel firms  airlines  tourism offices and would,1
12 million e-mails in january. the type of spam curren,1
rator said it would ensure that staff made redundant wo,1
ve a big impact in the growing market of mobile gaming,1
hundreds of extras  or extensions  produced for it. the,1
y rainey started competing in motorsport in 1974 she wa,1
o record.  every country s got it s own cultural differ,1
the work of many currently running research projects th,1
rice. it will go on sale from 22 january.  for consumer,1
hs. the service revolves around a hybrid device that us,1
t dominance.  of course google should be allowed to dir,1
is no company anti-blogging policy. there is guidance w,1
al  but i do not think anne is alone.  according to ofc,1
could also send high-definition programmes straight to,1
network   mr thiemann told bbc news online.  but mr hi,1
on.  it is not a rip-off. we are doing something that g,1
estern europe has always been a market which is quite a,1
may disappear forever.  it s one thing taking pictures,1
ly swapped across the internet. mr wright said that ena,1
nd dan lane  a text message guru living in britain. the,1
addresses. for instance  said mr hogan  filtering out e,1
serve tv programmes  music  films and photos - partly d,1
ections in the uk also means that episodes can be downl,1
mputer storage was growing exponentially and high-speed,1
the millions.  chief supt deats went on to warn:  the i,1
per and the marketing overheads go away.,1
hat the ink is harmful  radioactive or even that the ul,1
video-on-demand is better than having a video-store in,1
t has a catalogue of around 60 000 songs.,1
ational investment.  as well as traditional broadcastin,1
nsible for the explosion in innovation that has occurre,1
control for six surround sound speakers. and a drinks h,1
o add a low cost second computer.  cost is the clear ad,1
llions that exist.   desktop search has become importan,1
away on holiday  and ask if it could make sure that th,1
oming out in the autumn in the us  the box is a network,1
virus or worm which reports its success and the net add,1
etal soundtrack that you will swiftly want to turn off.,1
the us. he claimed the australian government s decisio,1
nt ways. p2p nets can be used to share any kind of file,1
r. viruses written to make headlines by infecting milli,1
s a representative of a company and that employers have,1
downloaded the title rather than travel to the shops to,1
could help remove some of the uncertainty  he said  lif,1
inexpensive set-top boxes that are unable to support in,1
gle parent - keeping in touch with my daughter is impor,1
over the last decade have very much been about putting,1
kesman said the site and alerting service would stay in,1
enerally launched much later in europe than in other pa,1
etc.   ms mehta also says she wishes that governments,1
tv. but at the end of 2004  the european telecommunica,1
included a link to a website that supposedly let peopl,1
he close integration of the fibre optic cables that car,1
realarcade  as well as other games-on-demand services,1
o record.  every country s got it s own cultural differ,1
me. these included what mr gates called an  ecosystem o,1
ce available.  the relay service makes phone conversati,1
could help remove some of the uncertainty  he said  lif,1
le more under the hood [than xbox 2] .,1
istries  agrees.  a rush to introduce idn-disabled brow,1
f online shoppers was also changing  he said.  the sing,1
s a huge amount of compression that has to be applied,1
ut greatly impeded the transport capabilities and capac,1
computers. ibm said cell was  os neutral  and would sup,1
line) doubled in a year to 13 million  according to fig,1
y they defend themselves. now many scan machines that c,1
ve of music sites. how about isps informing all custome,1
ch them back on portable devices. he disappointed some,1
keep out the modern form of malicious mobile code.  mos,1
y half of all users say they would stop using search en,1
ling becomes  learned behaviour . europe is undoubtedly,1
led the statistical measurements from two million net u,1
g statutes did not cover net or remote hunting. he said,1
r displaying adverts from the search engine. some netwo,1
y for themselves through sales.  however 60% said they,1
but these wartime shooters often do seem to work bett,1
iculties of aiming weapons are compensated for. shootin,1
are finite capacities for data traffic on the second ge,1
d people rewrite cvs and learn skills to get new jobs,1
of cinematography and editing said john wyver  from tv,1
ilters can only be part of the solution to the menace o,1
t  but there is not enough opposition to guarantee thei,1
ite boxes  which windows-based devices do not offer  ce,1
that criminals were taking to it and we ve seen massiv,1
this tv can do   until hd is really adopted by broadcas,1
ity to manipulate and exploit materials at micro or mol,1
ownload programmes the bbc owns the rights to for up to,1
the web. if you are looking for a text book definition,1
per and the marketing overheads go away.,1
as that offered on gner trains  did not offer yet. mr,1
rtable way of listening to your own music on the move w,1
her browser stat gatherers say the figure is closer to,1
phones to antique handhelds  that will have to be recyc,1
have failed. by contrast netcraft s four monitoring st,1
ch them back on portable devices. he disappointed some,1
ther net functions to automatically distribute diy radi,1
st human rights issues in countries which have a track,1
d influence over topics that made it in to national pre,1
our approach is bruce lee  not brute force   he said.,1
s the lack of spoken language to help people brush up o,1
teams against each other and can be confusing to follow,1
tv. but at the end of 2004  the european telecommunica,1
spammers sending e-mail and freezes assets prior to a,1
t makes aiming more controlled it can be a little disor,1
is a source of many commercial messages chinese people,1
without it.  a laptop computer is not a gadget! it s a,1
feit versions of windows xp with legal ones for free. i,1
e  developed the iband  a bracelet which stored and exc,1
vember 15 2001 in the us  halo was one of the launch ti,1
other downloads.  the groundrules must be applied acro,1
veiled its trumpet-playing humanoid robot. by 2007  it,1
f the charity mencap  will feature snaps taken from the,1
researcher at the delft university of technology who s,1
ou enjoy the visual channel occasionally and interact i,1
oming out in the autumn in the us  the box is a network,1
be able to see it.  once this significant number of use,1
in north america it is fixed line while there is equil,1
as that offered on gner trains  did not offer yet. mr,1
s a huge amount of compression that has to be applied,1
nline. for non-smartphone users  a memory mate card cou,1
nd music on hard drives. for all these advances  search,1
omain registries  agrees.  a rush to introduce idn-disa,1
til this new breed of video gaming communication become,1
estern europe has always been a market which is quite a,1
as moving and strafing a real option. the processing p,1
d statistics which showed that the numbers of active  b,1
s.  it s like having a 3d mouse all the time   he said.,1
those tendering for contracts found out about the chan,1
atistics 50% of all muggings and snatch theft offences,1
very good job of describing the information that they,1
introduction of real-world physics to be a major part,1
xperts like the linguist and political analyst noam cho,1
f the charity mencap  will feature snaps taken from the,1
t; they feel it belongs to them   said mr saldarriaga.,1
nt ways. p2p nets can be used to share any kind of file,1
was planning. sony recently announced it would be usin,1
her end will be able to see it.  once this significant,1
he technology can be sold to third parties interested i,1
receive the digital screening technology will conclude,1
e better graphics and sound  and are thus more suitable,1
casting. already there is interest in podcasting from t,1
sic. the range of players recently won an international,1
ding the one you have  is a great way to improve your u,1
stributors.  it may seem like a victimless crime but it,1
and for now  people still like to show off something,1
ntly didn t work and he still has to pay for it  even t,1
es that not only want to provide neat  hi-tech devices,1
ged an eolas patent. that one was eventually thrown out,1
e electronic gadgets  thousands of journalists in the e,1
r is the seed around which the couch potato culture has,1
and for now  people still like to show off something,1
etooth if others are in range. online the game has quit,1
m going under. at the start of the year  the company em,1
s research director dr alastair sibbald.  we are basica,1
f ie. before july this year  according to websidestory,1
w broadband customers. this was a slight increase on th,1
accommodate a variety of disabilities. the vehicle bel,1
e bbc  revenue-generating activity will be of little in,1
player. there are no djs. it is just music streamed ov,1
formats to be open to all and work on any gadget. this,1
people expect it just to work now and really it should,1
even and he thinks that having a  colour memory  makes,1
up to 75 megabits per second and works over distances o,1
the autolink button  and web pages she views will never,1
ontained fictional stories because queen of the sky dev,1
d to released at the end of this year or the beginning,1
pool of fans of earlier nintendo handhelds to draw on.,1
2 is projected to bring in more revenue than any day o,1
d as a lunchtime bet.   the dutch team used already ava,1
ast link that lets her search quickly and effectively.,1
t  quadruple play   too  with mobile services added int,1
ue to viruses affecting the network of the bank that ow,1
e chip will also be used inside high-definition tvs and,1
ew year. its us launch was on sunday and it goes on sal,1
l grow to 836m euros (£581m) by 2009. at the end of 20,1
tuned . the numerical internet address of the site has,1
ntroduced in 2002 following a fire at one cafe that kil,1
ot of options like this springing up on the web and one,1
he end of the day  people have cameras and colour scree,1
d to a pc - whether sent via e-mail or transferred from,1
tudios should make games for mobile phones and handheld,1
automatically centralise text messages  and then redis,1
men are due to be sentenced on 29 april.,1
stanley  uk managing director of filtering firm cipher,1
which offer broadband speeds of up to 40mbps. but mr i,1
viruses   said mark sparrow  technical and reviews edi,1
t s hardly ever foggy   he said. in places where rain i,1
o in their spare time.  a study by analysts jupiter res,1
ed that channel schedules may become less important to,1
hosted illegal  pirate radio shows in the dutch capital,1
als were using the websites to traffic counterfeit cred,1
psp.,1
lp   he said. there is a vast choice of internet servic,1
ls together with his wife and gave the children laptops,1
are over the last year  down from half of broadband use,1
looded the search site with queries looking for new e-m,1
v light the voter will not be allowed to enter the poll,1
from the previous seven days such as eastenders  casua,1
evices in most cases   said mr palmer.  however  indivi,1
moving it arm as a pointer and its camera as an eye. it,1
this has outraged some digital music lovers  especially,1
adio.  according to analysts nielsen//netratings  more,1
hinese and foreign content providers.  but according to,1
or radio.  according to analysts nielsen//netratings  m,1
pread across several different devices. he said the nev,1
xibility of a pc and the machine s specifications lack,1
x1 technologies and x-friend all do the same job of cat,1
providing the ability of a system to watch what s goin,1
on-stage to promote her own range of hp digital camera,1
uch large attacks were mounted. maria capella  spokeswo,1
or you can only save at the fountains dotted along the,1
tuned . the numerical internet address of the site has,1
and stores basic personal information. but its populari,1
omputer as well   he said. search engines are often the,1
ering the furore around vcrs when they first came out,1
much the system will cost to develop but it already has,1
us  the patenting of computer programs and internet bu,1
med it had assets of less than $10m (£5.29m) but debts,1
imated to account for at least 60% of all e-mails sent.,1
. more than a third of respondents said they were conce,1
recommend this to all our clients too   said mikko hypp,1
a like video can be received on the phone. globally  mo,1
ore variants of the program being created. so far seven,1
g to figures released by ces organisers  the cea  on tu,1
ce on offer in the uk and 16 times faster than most bro,1
e  particuarly if they are new to broadband  he said.,1
ad been emailed to a third party  copied  printed  dele,1
all itself and subject users to unwanted adverts. other,1
ished franchises or direct sequels to previously popula,1
ers  said the report. according to in-stat/mdr  it is t,1
stiny on content control systems instead of having to s,1
mr gerolami added in remarks quoted by the us entert,1
the most up to date model. the forum for the future rep,1
to see if they could be used online. they could provide,1
ter systems  mobile phones and a range of related consu,1
much the system will cost to develop but it already has,1
rably with the us price of $149  according to john houl,1
.  he was running around  looking for friends  burying,1
very easy to forget that in 1983 when we put the bid do,1
o demands to be able to watch tv on the move. in the us,1
010 - it is predicting 10 million total subscribers by,1
tors wanted to be able to access their e-mail as well a,1
t spam e-mail to solicit donations was not dec s style,1
silicon is a much better amplifier of light pulses than,1
d take-up  portable players and mobile devices  as well,1
player. there are no djs. it is just music streamed ov,1
had a central role to play in how people would be maki,1
nd nigerian nationals would be the first seafarers to g,1
eople   said rnid technology director  guido gybels.  i,1
lt that the technology could mean a reduction in car th,1
security software maker sybari software as part of mic,1
ming console with gps and gprs  that also doubles up as,1
stiny on content control systems instead of having to s,1
rch 2002. hit games like halo 2  which was released in,1
on a website about apple have and will happen. but an i,1
s to prove a point rather than be malicious the fake do,1
very easy to forget that in 1983 when we put the bid do,1
run-up to the election on 2 november. he said the site,1
protected.,1
text-based searching is not necessarily appealing to th,1
presents  such as lingerie  for wives and girlfriends.,1
nks.  search engines are about discovering information,1
ke time though to persuade people who spent money on dv,1
people can read and understand easily and very  very e,1
ir way into systems.  any new technology like this has,1
ich means transmission control protocol  and internet p,1
the dead and the day today in the dvd category  and tr,1
stis. the watchdog brought in the action last october f,1
te of mac because they like what they have seen with ip,1
hing gangs  and spammers who are more interested in mon,1
lines because  under the current system  once the call,1
and desire for more devices that suit them. more than 5,1
earching for new addresses to send itself to. filtering,1
was listed in third place  losing the top spot it had h,1
ch sites half of those questioned said they could get t,1
computers that cause a problem for the environment. te,1
s2 and so there are a number of combat elements. these,1
re data like video can be received on the phone. global,1
free to adapt the software s core code to create other,1
they shot and a dvd recording of their session. handler,1
nks.  search engines are about discovering information,1
ome pcs sitting on broadband connections that are never,1
directly.  musicians are embracing the internet enthusi,1
e player along a studiously pre-determined path  forcib,1
gameplay just is not good enough. quite aside from the,1
eople it questioned said they were technophobes that te,1
latest rejection means that now the bill on computer i,1
dramatically and coverage in remote areas have vastly,1
illiams of bt  who will be nm2 s technical project mana,1
er the course of the last month.  without casting asper,1
the us you cannot build a system that stores customer,1
t more applications could be created for the device. mi,1
further back around the world to their source   said m,1
sets at the end of 2003. but those in europe may see l,1
on the move. however  this future of highly personal d,1
mantec  mcafee  trend micro and many others. it said th,1
. more than a third of respondents said they were conce,1
ves people more control  and more choice.  iptv is a si,1
following the success of google   he said. but for alle,1
ls together with his wife and gave the children laptops,1
is available - globally from 12 300 to 20 000.  it als,1
et the crystalline  hiss-free blast of madonna s like a,1
widely seen as a u-turn because  before now  microsoft,1
will find their profits hit  something which is likely,1
uses to organise itself are handed out on a regional ba,1
and desire for more devices that suit them. more than 5,1
fight patent legal action in court. supporters say curr,1
mes awards like this have grown in importance. over the,1
ration models  like the creative zen micro photo  is du,1
lp   he said. there is a vast choice of internet servic,1
attachments and to update their software to ensure the,1
act as news sites for particular groups or subjects  so,1
h as directx  to make it simple for game studios to mak,1
ents do not feel like they are studying at all. this wa,1
h the surreptitious software and that  on average  each,1
could also be used to create so-called personal area n,1
ue $1m painkiller contest that will take place througho,1
o demands to be able to watch tv on the move. in the us,1
to do so in texas. lawyers for the alleged spammers sai,1
ew on its position in the home and the  cosiness  of ma,1
favour of real innovation  metal slug 3 is a fresh gasp,1
vities or illicit technology transfers between countrie,1
on sale in the us in mid-november priced $150 and ninte,1
r instance  said mr makower  credit cards are rare in c,1
ee blast of madonna s like a virgin emenating from thei,1
mes awards like this have grown in importance. over the,1
facturer toshiba elevator and building systems which in,1
h-language versions of windows.  microsoft s windows op,1
will be quickly snapped up by other research labs  but,1
and the access point helping them go online. this is de,1
done before but everything in there was as good as it,1
ansparently   said mr flynn.  people did not know they,1
even and he thinks that having a  colour memory  makes,1
dc  researchers showed off bipedal designs. the three,1
people will not be interested in printing out pictures,1
their spare time.  a study by analysts jupiter researc,1
vulnerable to legal action aimed at stopping people sw,1
g to figures released by ces organisers  the cea  on tu,1
. as well as details on the track or artist of a partic,1
ccess.  he left bullfrog in 1997 to set up lionhead stu,1
if they felt that the technology could mean a reduction,1
on-stage to promote her own range of hp digital camera,1
e to run this combination of software processes to crea,1
ld get better at controlling the cursor the more times,1
ake possible does gradually drive new habits and lifest,1
are used just for storage and playback while pcs are us,1
is available - globally from 12 300 to 20 000.  it als,1
men are due to be sentenced on 29 april.,1
mms. it said that 36% of uk camera phone users had nev,1
ke time though to persuade people who spent money on dv,1
e these relationships falls apart.  one in three women,1
eople are using the posters but a previous campaign run,1
recommend this to all our clients too   said mikko hypp,1
down the right-hand side of a page and are related to,1
the idea was to prove a point rather than be malicious,1
to be young  well-educated  net-savvy males with good i,1
.  the ability of games to simulate reality makes them,1
ction against those who leak product information. in de,1
we hope that oxford s contribution to this project wil,1
he end of the day  people have cameras and colour scree,1
le when you realise that a good game can rack up millio,1
ducting business online   he said. mr sunner said messa,1
argets was growing at a rate of 30% or more per month.,1
esearch for this harmonisation programme. early sight o,1
icrosoft s website. microsoft recommends that the tool,1
gaming console with gps and gprs  that also doubles up,1
iven that few people back up the data on their pc it is,1
showed that close attention to design and user needs wa,1
ates said xbox 2 would be part of his vision of the dig,1
s victory and the responses from his supporters. mr nac,1
people will not be interested in printing out pictures,1
em  with its flagship huaral.org website. there  farmer,1
ering the furore around vcrs when they first came out,1
e us  the patenting of computer programs and internet b,1
dvd players start to come out. when players do come out,1
technologies make possible does gradually drive new hab,1
ct links to websites with movies or other clips relevan,1
c which can then render the information into 3d graphic,1
imated to account for at least 60% of all e-mails sent.,1
ngham  head of distribution and exhibition at the uk fi,1
s as well as the substantial employment claims that wou,1
