message,Y
ators and fans that make it easy to modify almost any part o,1
ol over what tv they watch. as a result  people may see broa,1
lessed the original noteboook pc - the tandy 100. the size o,1
).,1
e someone managed to climb to the top of halo   said errera,1
r will pay if they inadvertently signed up for a service.  t,1
cent figures  sony ericsson s profits tripled in the third-q,1
l tension between distribution and integrity   he said. mr p,1
talking about in the keynote. some have suggested the announ,1
are positive about the impact it could have on their listene,1
eynote speakers  who also included microsoft chief bill gate,1
ogue cameras   he said. digital cameras tend to be used on s,1
ne s billing system would make it easier for teenagers to em,1
be more expensive because of all the extra navigation that i,1
motorola s standard music application for its music phones.,1
and how to get playing.   too fast too furious (digital brid,1
l co-existing with each other and do not exist in an easy to,1
like being an artist and being given a bigger canvas and a s,1
overloaded with information. blog analysis firm technorati e,1
cent figures  sony ericsson s profits tripled in the third-q,1
ere it was necessary to build a mini-hydraulic dam in order,1
2004  with 200 million tracks bought online in the us and eu,1
more photo-real capability  the current technology is limiti,1
erns for analogue cameras   he said. digital cameras tend to,1
rson development team. mr batter predicted that by 2006  mob,1
the mac mini is almost disposable.,1
ll shortly be giving out a free application that can stop yo,1
o large players. the new directive will limit innovation by,1
lculator that played a simple game and made tinny noises was,1
on.  the first mobile pc was voted best gadget by readers of,1
or sale.  the london-based company behind the harry potter g,1
spread via e-mails that purport to be from the fbi.  the e-m,1
o is becoming ever more important. but how good can that sou,1
ress.  now you could also be at a live gig on your mobile  v,1
0 web browser  which has just been released.  few people get,1
p) games console  which went on sale in japan on sunday.  th,1
ts that more people signed up for broadband in the last thre,1
unching a test service to allow people to publish blogs  or,1
all aspects of motorsport  which is now increasingly possibl,1
near you.  any household hooked up to sky could soon be usin,1
age music. but what you will not find is much spanish-langua,1
ing the launch of an ambitious european project.  in nice la,1
release of the tiny  low-cost machine is seen as a good move,1
t he can read weather maps.  victor wong  a graduate student,1
of fun.  the relentless pace of development in the hi-tech w,1
ers because it directs people to pre-selected commercial web,1
s on her blog  or online diary.  queen of the sky  otherwise,1
oles due to safety concerns.  the company said the move was,1
ay.  priced at £229  the handheld device is debuting in the,1
ng-awaited handheld game playing gadget will cost about 19 8,1
the netherlands.  the finished image is 2.5 billion pixels i,1
some  argues technology analyst bill thompson.  one of the n,1
t any early attempts to do it - the uk s home choice started,1
m has warned.  the warning is being issued because many bank,1
m and toshiba have released limited data about the so-called,1
e has sold more than five million copies worldwide since it,1
by jupiter research the analysis of the portable media playe,1
hold.  earlier this week the company released a screensaver,1
ntry s government said.  according to the official news agen,1
t results.  called speegle  it has the look and feel of a no,1
technology analysts gartner.  more than 674 million mobiles,1
to collections.  digital cameras were the hot gadget of chri,1
an industry conference has been told.  sony  microsoft and n,1
tly programmed to expire on a certain date.  the unnamed wom,1
the tsunami disaster in asia.  the messages can get through,1
in the us.  new yorker william trowbridge and texan michael,1
say experts.  anti-spam group spamhaus is warning about a no,1
nd business customers.  the increased speeds will come at no,1
ol to find documents  e-mails and other files on a pc hard d,1
watchers last month. but does the latest macintosh justify t,1
lems of setting up voice and data networks in the country.,1
he web eating into tv viewing habits  research suggests.  ju,1
according to research.  new episodes of 24  desperate housew,1
which is a lot of space to fill.  but more and more ipod own,1
against a website allegedly involved in identity fraud.  tho,1
l figures.  the number of people and business connected to b,1
and video.  the add-on for the ds means people can download,1
th their internet service.  they are fed up with slow speeds,1
unching a test service to allow people to publish blogs  or,1
g a laptop pc that will go on sale for less than $100 (£53),1
in december.  the christmas give-away entitles customers to,1
llion machines  according to a report by analysts forrester,1
to spread across the net.  the santy worm first appeared on,1
using invisible ink and ultraviolet readers in the country s,1
between satellite and cable tv heats up.  movies from sony p,1
st of the weirdest computer mishaps.  although computer malf,1
can mix better with humans.  by playing games  like pass-the,1
an be a costly business.  the cost of paying even as little,1
gests.  a quarter of broadband users in britain regularly up,1
filling the two top spots  analysts have predicted.  japan,1
ing networks.  the court will decide whether producers of fi,1
suggests.  a quarter of broadband users in britain regularly,1
50 000 new gadgets and technologies launched during the four,1
does it compare to pcs that cost about the same amount  dot.,1
.  by the end of 2004 microsoft aims to launch search softwa,1
teraction with hi-tech gadgets.  imagine a surveillance syst,1
es  according to carly fiorina  chief of technology giant he,1
ists are targeting net-based betting firms and threatening t,1
ashing prince of persia is back in warrior within  and in a,1
hold.  earlier this week the company released a screensaver,1
ing software to give people more control over personal infor,1
ink or die  have been convicted at the old bailey. bbc news,1
er files on their pcs.  the firm is following in the footste,1
ted by commercial media firms  says a panel of industry expe,1
requiring huge computing power to rent it by the hour.  sun,1
ommission (ec) despite requests by meps.  the law is proving,1
the man behind optinrealbig.com and billions of junk mail me,1
put on hold due to a last minute intervention from poland.,1
of unsolicited e-mail messages to aol subscribers.  it is th,1
ails and are being lured into buying goods  a report suggest,1
well as surf the net.  wireless provider broadreach and net,1
christmas card.  the zafi.d virus translates the christmas g,1
es showing that 26 billion texts were sent in total in 2004.,1
faster than similar bugs.  the new strains of the cabir mobi,1
r the annual consumer electronics show (ces).  the fair show,1
it service has been launched by internet service provider uk,1
against malicious net attacks  according to a two-year study,1
t also be used as legally binding evidence of wrong-doing ha,1
ng the takeover of anti-spyware firm giant  microsoft said i,1
s spent more than £1.34bn in 2004  almost 7% more than they,1
n india  says a report.  the indian mobile gaming market is,1
y to stop people pirating digital music and video.  the firm,1
v (dtt) service.  initially  more than a third of the popula,1
efits too.  research has found that in some developing natio,1
ld trust  says the institute of public policy research (ippr,1
curity problems is being launched by the uk government.  the,1
requiring huge computing power to rent it by the hour.  sun,1
ompany has announced.  the portable games machine  which fea,1
super-fast services.  some lucky britons can already take ad,1
nternet - in the form of web logs or blogs.  bloggers have b,1
in s first mobile phone call was made across the vodafone ne,1
ill replace portable media players  say two reports.  despit,1
challenge sky plus.  sky plus is the market leader in the fi,1
gside the extensive information available in its famous read,1
half of tsunami victims.  the site looks plausible because i,1
at the speed of light.  scientists at intel have overcome a,1
y experts.  easy-to-play titles that do not require too much,1
age music. but what you will not find is much spanish-langua,1
astonishing 90%.  the figures  from e-mail management firm e,1
gadgets are working together more to help people manage mult,1
unlikely setting for tests of biometric technology.  as holi,1
be having their phone conversations relayed using webcams or,1
vey says.  more than half of 2 000 people surveyed said they,1
xes for flaws in windows programs.  in its monthly security,1
y as experts predict a gadget shortage this christmas.  with,1
y to stop people pirating digital music and video.  the firm,1
#NAME?,1
released products.  the bid to unmask the employees leaking,1
open a back door for scammers  a trade body has warned.  the,1
in s first mobile phone call was made across the vodafone ne,1
resident george w bush.  the blocking of browsers sited outs,1
well as surf the net.  wireless provider broadreach and net,1
is game.  the cellery worm installs a playable version of th,1
useful gateway to painting.  artgarden  developed by bt s re,1
s predict that british people will spend £4bn buying gifts,1
rom web journals or blogs.  the bloglines site has become hu,1
preparing for the next revolution in home entertainment - hi,1
the sudanese region of darfur are getting a helping hand fro,1
r than current pc chips  its designers have said.  sony  ibm,1
l with its growth in the last 10 years  but it is just the s,1
ta awards.  the national theatre s stagework website picked,1
anti-spyware software.  the spyware tool was only released b,1
dial-up net users thousands.  from may  dial-up net users wi,1
res both simple and strange.  more than 277 million enquirie,1
he mac mini.  chief executive steve jobs showed off the new,1
bidder on website ebay.  andrew fisher  from omaha  nebraska,1
are undergoing a subtle change.  the shift is happening as t,1
ing  scams  according to premium phone line regulator icstis,1
ld s largest gadget show  in las vegas  have been told.  the,1
by a us-based digital music distributor.  new owner yeahroni,1
es.  a windows virus called bofra is turning infected machin,1
e blue gene/l machine.  it is being assembled for the lawren,1
report into search habits.  the report by the us pew researc,1
ment when buying and disposing of the latest hi-tech product,1
new xbox console.  its sharp graphics and novel gameplay  wi,1
figures showing that 26 billion texts were sent in total in,1
below 90%  say web analysts.  net traffic monitor  onestat.c,1
b users use a remote-controlled rifle to shoot down deer  an,1
rom web journals or blogs.  the bloglines site has become hu,1
d pump out spam and viruses.  the huge number was revealed b,1
of ultimate gizmos compiled by stuff magazine.  it beats the,1
e music  a survey has found.  the study by us researchers  p,1
ves fans of wartime battle titles spoilt for choice.  the ac,1
bond revival flick of 1995  but also the classic shoot-em-up,1
ely popular. consumers swapping old phones for slinkier  din,1
be patented.  politicians unanimously rejected the bill and,1
says a study.  around 23 million britons will miss out on a,1
console.  film studio lions gate entertainment has announced,1
ushier moments of star wars to leave you with a bare bones a,1
study has found.  according to a survey conducted by securit,1
rogrammer and technology analyst bill thompson.  if it gets,1
ear in 2005  according to industry experts.  last year saw t,1
ks automatically.  the system creates digital fingerprints o,1
ion to transform the quality of what is on our screens.  it,1
y then phones will be printed directly on to wrists  or othe,1
virus-fighting program will be updated monthly and is a prec,1
ails and are being lured into buying goods  a report suggest,1
s a telecoms company  bt is moving to a content distribution,1
me.  for many  yahoo remains synonymous with the internet -,1
g a laptop pc that will go on sale for less than $100 (£53),1
by a us-based digital music distributor.  new owner yeahroni,1
h also has built-in wi-fi - high-speed wireless net access.,1
magazine mobile pc.  the 1991 laptop was chosen because it w,1
revamp has been prompted by microsoft s growing concern with,1
inks it s about time.  my first car ran on four star petrol,1
an.  the motion-sensitive phone - officially titled the v603,1
rseas users for  security reasons .  the blocking began earl,1
ld s largest gadget show  in las vegas  have been told.  the,1
ersial new european union rules which govern computer-based,1
he golden joystick awards.  it was the only title to win twi,1
digital music players.  its latest challenges to the growing,1
th their internet service.  they are fed up with slow speeds,1
irus firms are issuing high-level warnings about the new ver,1
e is no news of a europe debut.  the handheld console will g,1
anti-spyware software.  the spyware tool was only released b,1
mprisoned iranian bloggers.  the month-old committee to prot,1
er.  merriam-webster said  blog  headed the list of most loo,1
s of the xbox s performance and what gaming will be like wit,1
cational  says research.  a us researcher has suggested that,1
spread via e-mails that purport to be from the fbi.  the e-m,1
me pcs could face hefty fines in california.  from 1 january,1
said it would list standards for the technology later this y,1
ountry s top teams.  the four-kings clan is staging a pop id,1
ill replace portable media players  say two reports.  despit,1
s top five spammers.  it is seeking millions of dollars in d,1
handset maker nokia shows that more and more people are usin,1
mers molly-coddled with slick visuals and fancy trimmings.,1
dated that they are hampering the work of inspectors.  a spo,1
devices offering a range of gaming and other features such a,1
ee years  says a report.  china s net users number 100m but,1
magazine mobile pc.  the 1991 laptop was chosen because it w,1
he golden joystick awards.  it was the only title to win twi,1
sed as the planet s fastest.  the lifts take only 30 seconds,1
ws operating system by restricting their access to security,1
earch centre  which was started by the irish government and,1
rvey of wi-fi networks in london  frankfurt  new york and sa,1
days later. why is the game among the most anticipated of al,1
cut off from all uk phone networks.  the rules allow offende,1
t he can read weather maps.  victor wong  a graduate student,1
ew  to challenge honda s asimo and sony s qrio robots.  hita,1
04 than last year  says a report from analysts gartner.  glo,1
web eating into tv viewing habits  research suggests.  just,1
opment of a system that could be harder to shut down.  one s,1
r the annual consumer electronics show (ces).  the fair show,1
n astonishing  but the ability to communicate on the go is n,1
honours list.  the head of surrey s lionhead studios was gra,1
ps  a survey says.  more than half of 2 000 people surveyed,1
es  according to carly fiorina  chief of technology giant he,1
er-generated images that bring the site to life.  a european,1
ep closer.  four people  two of them partly paralysed wheelc,1
re handsets  research suggests.  instead  phone firms keen t,1
while sony ericsson has unveiled its phone walkman and motor,1
h also has built-in wi-fi - high-speed wireless net access.,1
in the us.  new yorker william trowbridge and texan michael,1
s using them to go online.  figures from industry monitor  t,1
preparing for the next revolution in home entertainment - hi,1
rned that losing their phone would mean they lose their frie,1
ason.  when interrogated with a mobile phone  the posters pa,1
christmas card.  the zafi.d virus translates the christmas g,1
search engine  rather than type in a web address.  some may,1
lic could open a back door for scammers  a trade body has wa,1
according to new research.  the survey  conducted by the pew,1
rena in 2004.  the us presidential election provided a showc,1
mputer giant has sued three men for releasing preview versio,1
digitised by google.  scanned pages from books in the public,1
technology analysts gartner.  more than 674 million mobiles,1
d-up follows but you can skip straight to the reviews by cli,1
details have boomed in 2004  say security experts.  the numb,1
e windows pcs.  the count of known viruses broke the 100 000,1
rnment s wireless watchdog is seeking help on the best way t,1
t security firm workshare.  up to 75% of all business docume,1
arly as experts predict a gadget shortage this christmas.  w,1
more likely to lose them.  in london alone over the past six,1
ad only just launched  most websites were text-based and ama,1
o linux software.  the cash injection will be used to help i,1
new machines mean for games firms and consumers  we may not,1
nd that number is set to grow.  these online diaries come in,1
04 than last year  says a report from analysts gartner.  glo,1
ing a helping hand for poor farmers in peru.  the pilot sche,1
ted by commercial media firms  says a panel of industry expe,1
ommission (ec) despite requests by meps.  the law is proving,1
according to its backers.  blu-ray  backed by 100 firms incl,1
re handsets  research suggests.  instead  phone firms keen t,1
or tv programmes.  the service  google video beta  searches,1
h on saturday. but what does it do and how does it work   pi,1
of unsolicited e-mail messages to aol subscribers.  it is th,1
xt 18 months.  the uk film council has awarded a contract wo,1
week ago  has bought back most of the company.  the veteran,1
me pcs could face hefty fines in california.  from 1 january,1
domains have been given preliminary approval by the net s ad,1
astonishing 90%.  the figures  from e-mail management firm e,1
idge.  argonaut called in administrators david rubin & partn,1
works as a 3d encoder for sound - helping the brain understa,1
firefox has been downloaded almost eight million times and h,1
ling  (llu)  in which bt rivals install their hardware in ex,1
the cars have electronic throttles  electronic brakes  elect,1
y boxes and sky is hoping to increase this to 10 million by,1
illan calls its  infant stage . but the production values ar,1
ifficult and challenging area for the commission will be to,1
said mr ross. ian fogg  broadband and personal technology an,1
music software has not yet been made available commercially,1
will steal a lot of market share from 3g and will be a clear,1
sers and later dropped by microsoft after concerns over trad,1
why not include them on my blog for fun.  i never meant it a,1
w months. the psp is due to go on sale in the us later this,1
would not be able to load such a large image  so we had to d,1
not check the weather because the only place she knows to lo,1
rs.  key to the appeal of sending tv programmes down the sam,1
ed banks were put out of action for hours following an infec,1
since the launch of the creative nomad jukebox in mid-2000.,1
ssion groups have said that it set a dangerous precedent and,1
people in a crackdown on net porn. at the same time it intro,1
he site uses a technology dubbed panavox  which takes web te,1
obile owners to upgrade on its own. the majority of camera p,1
favourite photographs before ordering prints. mr hawkins add,1
games. the founder of california s maxis studio surprised th,1
ect.  he can message the server  so the server can send out,1
of this trick would mean e-mail meltdown. but kevin hogan  s,1
on 17 february. mr ingram said there would be a roll out acr,1
low price of the machine has also encouraged the more techni,1
iod for set up is a few hours   he said. by contrast  he sai,1
n particular the uk  france and spain  said the report. it s,1
n you want. the increased popularity of personal digital vid,1
tinkering with this new thing called the internet.  at a cer,1
d buy the information and tools they needed to commit such c,1
onnection then there s every chance you re being ripped off,1
n mobile phones but conceded this was ambitious.  nokia make,1
a potentially regime changing presidential election in the a,1
on-demand which will also see the launch of a personal video,1
a robot as a companion for the human being  you can think of,1
ers. mr myers is not convinced a rental model will work for,1
month. the popularity of fast net access is growing  partly,1
ound to be  unfriendly   according to reports. the sarft sai,1
se raises a question of critical importance at the border be,1
per month. the popularity of fast net access is growing  par,1
pected to go on sale before the summer and will cost about $,1
and owners.     an entry-level machine designed for basic ho,1
se of the tiger operating system. due to follow are net gian,1
se devices  such as a virtual human  could make it much easi,1
alisation and lifestyle is a big theme at this year s ces  w,1
and pluck out the traffic destined for target sites.  it s a,1
niques in some wonderfully imaginative ways. slicing foes do,1
ssion groups have said that it set a dangerous precedent and,1
ng it in january 2005. although the flaw was fixed  microsof,1
hting against extradition to the us.  us customs claimed mr,1
tionality of such services. alexander linden  vice president,1
itself was not an illegal technology  the film studios turne,1
e. this  they fear  could hurt small software developers bec,1
no mistake  we do expect to prevail.  for its part optinreal,1
ce the potential financial damage and nuisance from phishing,1
orldwide by the end of 2005.,1
and siemens.,1
th wholesale shipments of consumer technologies expected to,1
orea  video-on-demand over the net is cheaper than renting a,1
chnical language  he added. the nature of the security threa,1
use. increasingly organisations that handle sensitive data,1
a. microsoft s announcement about spyware comes after it bou,1
also proved their worth in 2004. games linked to shrek  the,1
poorer telecoms infrastructure. despite this  the penetratio,1
ways the different drm systems are akin to the different phy,1
tes reaching over 80% of homes. digital terrestrial set-top,1
people to get mobile phones.  but the relatively low wages i,1
rvices   said mr davies.  but what has not been explored is,1
use anti-virus software  firewalls  and software updates to,1
e been stronger. everyone wanted to see the eight-player mar,1
journalist and being a human being.   others blogs are helpi,1
perators in the uk until 1993 when one2one (now t-mobile) wa,1
s  where clips are downloaded  are offered by several europe,1
eives around 3 000 visitors each day and serves around 500 0,1
f the e-mail addresses supplied on the site work and the rea,1
laser light passed through it  some colliding photons rip el,1
ultiplayer titles  they agreed.  we are at a time where we a,1
illan calls its  infant stage . but the production values ar,1
me halo 2  released in november  which pushed xbox console s,1
ights the importance of access to shore facilities and shore,1
unications sector is effectively discriminating against an a,1
e midlands  in the uk. mr vetham said the majority of people,1
tting gadgets from husbands and boyfriends as well as buying,1
ways the different drm systems are akin to the different phy,1
echnologies that make them more central as entertainment and,1
ered journalists  too. the electronic frontier foundation  w,1
faked   said mr dyer.   it is important to alert users that,1
perators in the uk until 1993 when one2one (now t-mobile) wa,1
y blocking non-us visitors also means that americans oversea,1
e collection is to introduce people to things they wouldn t,1
r shopping via their work computer. worst offenders will be,1
eeping changes to bloglines  said mr lanzone.  our intent is,1
of it  there is such a remarkable difference.  i have heard,1
.  a map is a working document   explains herbert hansen of,1
ch generally is several levels down the chain from there.,1
the evolution of the net s architecture and the way this inf,1
n decided to split them into separate games and interactive,1
harging a premium rate rather than by credit card bt said it,1
to capitalise on the mass market success it s had with the i,1
at cisco  because the defences against such attacks are so c,1
e looking at the moment at whether we can improve this.  but,1
y just the ability to do it   said stephen baker  a consumer,1
rver that downloads viral code to target machines. shutting,1
ed 500 000 times. the cray-1 was capable of 80 megaflops (80,1
uestioned  68%  said they thought that the results they were,1
obile  according to a deloitte report. schemes in the us  li,1
ractive game for younger platform fans.  blinx 2 is out on x,1
use worldwide by the end of 2005.,1
we certainly respect that some customers will choose alterna,1
ut in the woods or distant hunters who cannot afford a trip,1
eeping changes to bloglines  said mr lanzone.  our intent is,1
nwanted adverts to pc users or as launch platforms for virus,1
ear cut as those of the record industry.  through the record,1
plotting by various means of misdirection. this pair of game,1
weeks  with the likes of halo 2 and half life 2 triumphing i,1
eople s reluctance to start sending them  said mr jain.  the,1
