message,Y
games maker fights for survival one of britain s largest ind,1
security warning over  fbi virus  the us federal bureau of i,1
mobile audio enters new dimension as mobile phones move clos,1
mobile gig aims to rock 3g forget about going to a crowded b,1
firefox browser takes on microsoft microsoft s internet expl,1
gamers snap up new sony psp gamers have bought almost all of,1
broadband in the uk growing fast high-speed net connections,1
microsoft gets the blogging bug software giant microsoft is,1
tech helps disabled speed demons an organisation has been la,1
loyalty cards idea for tv addicts viewers could soon be rewa,1
web radio takes spanish rap global spin the radio dial in th,1
europe backs digital tv lifestyle how people receive their d,1
apple mac mini gets warm welcome the mac mini has been welco,1
blind student  hears in colour  a blind student has develope,1
the future in your pocket if you are a geek or gadget fan  t,1
google s toolbar sparks concern search engine firm google ha,1
blogger grounded by her airline a us airline attendant is fi,1
xbox power cable  fire fear  microsoft has said it will repl,1
gizmondo gadget hits the shelves the gizmondo combined media,1
portable playstation ready to go sony s playstation portable,1
how to make a gigapixel picture the largest digital panorami,1
learning to love broadband we are reaching the point where b,1
tv s future down the phone line internet tv has been talked,1
concerns over windows atms cash machine networks could soon,1
first look at playstation 3 chip some details of the chip in,1
halo 2 sells five million copies microsoft is celebrating bu,1
consumers  snub portable video  consumers want music rather,1
freeze on anti-spam campaign a campaign by lycos europe to t,1
china net cafe culture crackdown chinese authorities closed,1
speech takes on search engines a scottish firm is looking to,1
looks and music to drive mobiles mobile phones are still enj,1
web photo storage market hots up an increasing number of fir,1
new consoles promise big problems making games for future co,1
us woman sues over cartridges a us woman is suing hewlett pa,1
text messages aid disaster recovery text messaging technolog,1
us peer-to-peer pirates convicted the first convictions for,1
warnings about junk mail deluge the amount of spam circulati,1
bt boosts its broadband packages british telecom has said it,1
microsoft takes on desktop search microsoft has entered the,1
mac mini heralds mini revolution the mac mini was launched a,1
lasers help bridge network gaps an indian telecommunications,1
broadband challenges tv viewing the number of europeans with,1
uk net users leading tv downloads british tv viewers lead th,1
podcasts mark rise of diy radio an apple ipod or other digit,1
dozens held over id fraud site twenty-eight people  includin,1
broadband steams ahead in the us more and more americans are,1
nintendo adds media playing to ds nintendo is releasing an a,1
britons fed up with net service a survey conducted by pc pro,1
microsoft gets the blogging bug software giant microsoft is,1
digital guru floats sub-$100 pc nicholas negroponte  chairma,1
bt offers free net phone calls bt is offering customers free,1
pc ownership to  double by 2010  the number of personal comp,1
santy worm makes unwelcome visit thousands of website bullet,1
ink helps drive democracy in asia the kyrgyz republic  a sma,1
cable offers video-on-demand cable firms ntl and telewest ha,1
how to smash a home computer an executive who froze his brok,1
robots learn  robotiquette  rules robots are learning lesson,1
napster offers rented music to go music downloading  for tho,1
broadband fuels online change fast web access is encouraging,1
china  ripe  for media explosion asia is set to drive global,1
court mulls file-sharing future judges at the us supreme cou,1
broadband fuels online expression fast web access is encoura,1
gadgets galore on show at fair the 2005 consumer electronics,1
rivals of the £400 apple... the mac mini is the cheapest ap,1
search wars hit desktop pcs another front in the on-going ba,1
putting a face to  big brother  literally putting a face on,1
more power to the people says hp the digital revolution is f,1
rings of steel combat net attacks gambling is hugely popular,1
gritty return for prince of persia still basking in the rela,1
freeze on anti-spam campaign a campaign by lycos europe to t,1
microsoft plans  safer id  system microsoft is planning to m,1
the pirates with no profit motive two men who were part of a,1
yahoo moves into desktop search internet giant yahoo has lau,1
peer-to-peer nets  here to stay  peer-to-peer (p2p) networks,1
sun offers processing by the hour sun microsystems has launc,1
no re-draft  for eu patent law a proposed european law on so,1
anti-spam laws bite spammer hard the net s self-declared spa,1
eu software patent law delayed controversial new eu rules fo,1
us duo in first spam conviction a brother and sister in the,1
spam e-mails tempt net shoppers computer users across the wo,1
hotspot users gain free net calls people using wireless net,1
virus poses as christmas e-mail security firms are warning a,1
text message record smashed uk mobile owners continue to bre,1
fast moving phone viruses appear security firms are warning,1
doors open at biggest gadget fair thousands of technology lo,1
uk broadband gets speed injection broadband s rapid rise con,1
more women turn to net security older people and women are i,1
software watching while you work software that can not only,1
microsoft sets sights on spyware windows users could soon be,1
gangsters dominate gaming chart video games on consoles and,1
mobile gaming takes off in india gaming on the move is one o,1
format wars could  confuse users  technology firms sony  phi,1
france starts digital terrestrial france has become the last,1
finding new homes for old phones re-using old mobile phones,1
online commons to spark debate online communities set up by,1
uk gets official virus alert site a rapid alerting service t,1
sun offers processing by the hour sun microsystems has launc,1
nintendo handheld given euro date nintendo s new handheld co,1
slow start to speedy net services faster broadband in the uk,1
web logs aid disaster recovery some of the most vivid descri,1
mobiles rack up 20 years of use mobile phones in the uk are,1
mobiles  not media players yet  mobiles are not yet ready to,1
telewest to challenge sky plus cable firm telewest is to off,1
british library gets wireless net visitors to the british li,1
warning over tsunami aid website net users are being told to,1
intel unveils laser breakthrough intel has unveiled research,1
casual gaming to  take off  games aimed at  casual players,1
web radio takes spanish rap global spin the radio dial in th,1
junk e-mails on relentless rise spam traffic is up by 40%  p,1
gates opens biggest gadget fair bill gates has opened the co,1
seamen sail into biometric future the luxury cruise liner cr,1
video phone help for deaf people deaf people who prefer to c,1
concern over rfid tags consumers are very concerned about th,1
microsoft releases bumper patches microsoft has warned pc us,1
gadget show heralds mp3 season partners of those who love th,1
format wars could  confuse users  technology firms sony  phi,1
xbox 2 may be unveiled in summer details of the next generat,1
apple makes blogs reveal sources apple has won its legal fig,1
domain system scam fear a system to make it easier to create,1
mobiles rack up 20 years of use mobile phones in the uk are,1
bush website blocked outside us surfers outside the us have,1
hotspot users gain free net calls people using wireless net,1
windows worm travels with tetris users are being warned abou,1
smart search lets art fans browse if you don t know art but,1
internet boom for gift shopping cyberspace is becoming a ver,1
ask jeeves joins web log market ask jeeves has bought the bl,1
what high-definition will do to dvds first it was the humble,1
satellite mapping aids darfur relief aid workers trying to h,1
playstation 3 processor unveiled the cell processor  which w,1
rolling out next generation s net the body that oversees how,1
bbc leads interactive bafta wins the bbc and the national th,1
microsoft seeking spyware trojan microsoft is investigating,1
bt program to beat dialler scams bt is introducing two initi,1
bbc web search aids odd queries the bbc s online search engi,1
apple unveils low-cost  mac mini  apple has unveiled a new,1
man auctions ad space on forehead a 20-year-old us man is se,1
rich pickings for hi-tech thieves viruses  trojans and other,1
call for action on internet scam phone companies are not doi,1
gadget market  to grow in 2005  the explosion in consumer te,1
commodore finds new lease of life the once-famous commodore,1
toxic web links help virus spread virus writers have begun u,1
us top of supercomputing charts the us has pushed japan off,1
savvy searchers fail to spot ads internet search engine user,1
gadget growth fuels eco concerns technology firms and gadget,1
blinx sequel purrs nicely the original blinx was intended to,1
text message record smashed again uk mobile owners continue,1
new browser wins over net surfers the proportion of surfers,1
remote control rifle range debuts soon you could go hunting,1
ask jeeves joins web log market ask jeeves has bought the bl,1
have hackers recruited your pc  more than one million comput,1
sony psp tipped as a  must-have  sony s playstation portable,1
musicians  upbeat  about the net musicians are embracing the,1
big war games battle it out the arrival of new titles in the,1
bond game fails to shake or stir for gaming fans  the word g,1
mobile multimedia slow to catch on there is no doubt that mo,1
eu software patent law faces axe the european parliament has,1
millions to miss out on the net by 2025  40% of the uk s pop,1
more movies head to sony s psp movies open water and saw are,1
viewers to be able to shape tv imagine editing titanic down,1
bad e-mail habits sustains spam the  bad behaviour  of e-mai,1
be careful how you code a new european directive could put s,1
media gadgets get moving pocket-sized devices that let peopl,1
net fingerprints combat attacks eighty large net service fir,1
gamers could drive high-definition tv  films  and games have,1
when technology gets personal in 2020  whipping out your mob,1
microsoft debuts security tools microsoft is releasing tools,1
spam e-mails tempt net shoppers computer users across the wo,1
broadband set to revolutionise tv bt is starting its push in,1
can yahoo dominate next decade  yahoo has reached the grand,1
digital guru floats sub-$100 pc nicholas negroponte  chairma,1
commodore finds new lease of life the once-famous commodore,1
t-mobile bets on  pocket office  t-mobile has launched its l,1
apple laptop is  greatest gadget  the apple powerbook 100 ha,1
security scares spark browser fix microsoft is working on a,1
how to make a greener computer the hi-tech industry is start,1
moving mobile improves golf swing a mobile phone that recogn,1
attack prompts bush site block the official re-election site,1
gadget market  to grow in 2005  the explosion in consumer te,1
reboot ordered for eu patent law a european parliament commi,1
ultimate game  award for doom 3 sci-fi shooter doom 3 has bl,1
apple ipod family expands market apple has expanded its ipod,1
britons fed up with net service a survey conducted by pc pro,1
joke e-mail virus tricks users a virus that disguises itself,1
sony psp console hits us in march us gamers will be able to,1
microsoft seeking spyware trojan microsoft is investigating,1
global blogger action day called the global web blog communi,1
blog  picked as word of the year the term  blog  has been ch,1
game makers get xbox 2 sneak peek microsoft has given game m,1
games help you  learn and play   god games  in which players,1
security warning over  fbi virus  the us federal bureau of i,1
california sets fines for spyware the makers of computer pro,1
ultra fast wi-fi nears completion ultra high speed wi-fi con,1
players sought for $1m prize uk gamers are getting a chance,1
mobiles  not media players yet  mobiles are not yet ready to,1
us state acts to stop  spammers  us state texas has filed a,1
home phones face unclear future the fixed line phone in your,1
2d metal slug offers retro fun like some drill sergeant from,1
nuclear body seeks new tech the computer systems used to mon,1
nintendo ds aims to touch gamers the mobile gaming industry,1
china  to overtake us net use  the chinese net-using populat,1
apple laptop is  greatest gadget  the apple powerbook 100 ha,1
ultimate game  award for doom 3 sci-fi shooter doom 3 has bl,1
fast lifts rise into record books two high-speed lifts at th,1
microsoft makes anti-piracy move microsoft says it is clampi,1
dublin hi-tech labs to shut down dublin s hi-tech research l,1
warnings on woeful wi-fi security companies are getting wors,1
halo fans  hope for sequel xbox video game halo 2 has been r,1
tough rules for ringtone sellers firms that flout rules on h,1
blind student  hears in colour  a blind student has develope,1
hitachi unveils  fastest robot  japanese electronics firm hi,1
camera phones are  must-haves  four times more mobiles with,1
broadband takes on tv viewing the number of europeans with b,1
file-swappers ready new network legal attacks on websites th,1
doors open at biggest gadget fair thousands of technology lo,1
mobiles get set for visual radio the growth in the mobile ph,1
honour for uk games maker leading british computer games mak,1
consumer concern over rfid tags consumers are very concerned,1
more power to the people says hp the digital revolution is f,1
pompeii gets digital make-over the old-fashioned audio tour,1
brainwave  cap controls computer a team of us researchers ha,1
lifestyle  governs mobile choice  faster  better or funkier,1
mobile music challenges  ipod age  nokia and microsoft have,1
t-mobile bets on  pocket office  t-mobile has launched its l,1
us peer-to-peer pirates convicted the first convictions for,1
half of uk s mobiles  go online  multimedia mobile phones ar,1
what high-definition will do to dvds first it was the humble,1
friends fear  with lost mobiles people are becoming so depen,1
hi-tech posters guide commuters interactive posters are help,1
virus poses as christmas e-mail security firms are warning a,1
the year search became personal the odds are that when you f,1
domain system opens door to scams a system to make it easier,1
blog reading explodes in america americans are becoming avid,1
online games play with politics after bubbling under for som,1
apple sues  tiger  file sharers apple has taken more legal a,1
google to scan famous libraries the libraries of five of the,1
looks and music to drive mobiles mobile phones are still enj,1
mobile games come of age the bbc news website takes a look a,1
cyber criminals step up the pace so-called phishing attacks,1
cyber crime booms in 2004 the last 12 months have seen a dra,1
souped-up wi-fi is on the horizon super high-speed wireless,1
warning over windows word files writing a microsoft word doc,1
gadget show heralds mp3 christmas partners of those who love,1
cabs collect mountain of mobiles gadgets are cheaper  smalle,1
a decade of good website design the web looks very different,1
ibm puts cash behind linux push ibm is spending $100m (£52m,1
what s next for next-gen consoles  the next generation of vi,1
blogs take on the mainstream web logs or blogs are everywher,1
camera phones are  must-haves  four times more mobiles with,1
wi-fi web reaches farmers in peru a network of community com,1
peer-to-peer nets  here to stay  peer-to-peer (p2p) networks,1
no re-draft  for eu patent law a proposed european law on so,1
games win for blu-ray dvd format the next-generation dvd for,1
lifestyle  governs mobile choice  faster  better or funkier,1
google launches tv search service the net search giant googl,1
piero gives rugby perspective bbc sport unveils its new anal,1
us duo in first spam conviction a brother and sister in the,1
uk pioneers digital film network the world s first digital c,1
argonaut founder rebuilds empire jez san  the man behind the,1
california sets fines for spyware the makers of computer pro,1
progress on new internet domains by early 2005 the net could,1
junk e-mails on relentless rise spam traffic is up by 40%  p,1
orth london  with 17 at its morpheme offices in kentish town,1
ain bits of information which we are effectively synthesisin,1
e ie using population dropped to 94.7% and by the end of oct,1
lator ofcom show that bt faces increasing competition  and d,1
we use the latest technology supplied by an italian company,1
freeview boxes do not have a slot which would allow viewers,1
uality  rap.  the web might be just the right medium for spa,1
holder of rights to content are normally considered over and,1
nister  he said.  for browsing the web  e-mail and all kinds,1
in pitch i know the colour s getting redder and redder  and,1
5 and it could be the way that rural areas get high-speed ne,1
ew tool has been compared to the smart tags feature from mic,1
a digital camera she had inherited from her mother.  we ofte,1
mecube enjoyed. sony s psp was due to make its european debu,1
f fan anticipation of the  halo 2 flu  on 9 november.,1
to rewrite almost all the tools   me den hartog told the bbc,1
because she could not find out which films were showing at t,1
ording to technology analysts  tdg research  there will be 2,1
f those operated by the canadian imperial bank of commerce.,1
nd network   said ken kutaragi  chief operating officer of s,1
around five million of the ds by march 2005.,1
jupiter . apple s ipod was launched in october 2001  but the,1
sites back to the lycos screensaver site. the campaign has c,1
that all of them get permits to operate. in august 2004 chin,1
n readers available to them which will do the job these tech,1
a to a phone is not critical.  nor would the rush to produce,1
ing images. photos can then be uploaded to sites such as ofo,1
s.  one developer bucking the trend towards big art teams is,1
the field spotted a need for water purification tablets  and,1
aid. the amount of spam in circulation was still growing  sa,1
ose connections consistently received speeds of 40mbps. cust,1
yboard.  the software bundle that comes with the mini makes,1
ake far less time to set up and get working  said mr sridhar,1
ey were spending less time watching tv. the threat to tv was,1
. the industry has coined the term  time-shifting  to descri,1
next seven years in new york where he worked at mtv hosting,1
s and birth certificates. the websites shared tips on how to,1
urther in coming months mr danton advises everyone to shop a,1
tv a telephone and a games machine  not just a textbook.  mr,1
on. it currently has 1.3 million broadband subscribers.,1
ming even greater significance because of two large factors,1
ce to watch programmes already broadcast on their pc. for te,1
many years to build a robot which would make full use of the,1
is a result of record labels charging more for the to-go ser,1
igh speed they spend twice as long online than people on dia,1
joint ventures. it has limited most foreign companies to onl,1
ghts watchdog  is also defending streamcast networks  the co,1
at high speed they spend twice as long online than people on,1
ards at ces  one as a girl s best friend award and another f,1
he reach of everyone   an apple spokesman said.  it will bri,1
ple has also debuted a similar search system for its compute,1
ing to cope with an increasing number of hi-tech gadgets.  e,1
cameras  which are due to go on sale in the us by the summer,1
y four to five days. the defences being put in place constan,1
and there is more of it than before. the game s developers h,1
sites back to the lycos screensaver site. the campaign has c,1
and malicious hackers after a flaw in the system was exploit,1
invincibility.  but one man still in legal limbo is british-,1
s for human rights groups  concerned about the implications,1
en they figure out how to make money and they always make a,1
ng  service  for example. critics are concerned that the dir,1
n a relentless distraction with which to contend   said stev,1
ustry and the media have helped to raise awareness of the is,1
artner. that was 26% more than the previous year. it is pred,1
late november. symbian s series 60 software is licenced by n,1
ronics rose by almost 11% between 2003 and 2004. that trend,1
id. countries such as south korea and france have found the,1
said mr goosens. security software should be easy to use  wi,1
the downloading of pornography  the use of racist or bullyin,1
malign  spyware watches everything that people do with their,1
as the original titles. despite this fondness for older game,1
2003  there were only 10 million mobile subscribers in india,1
of the alliance will sit alongside the content control syste,1
ites. the transmission area will initially include paris  li,1
eresting country because it has a really crap fixed line net,1
the moment they have been presented as a way for government,1
n centre (niscc).  the niscc  which is running the service,1
some innovative features  and nintendo has created quite a b,1
e was in when he was sending us reports  and doing the relie,1
sting half that.  now vodafone has 14m customers in the uk a,1
port on mobile tv broadcasting in europe suggests direct bro,1
omers.,1
ud and hewlett packard.  it will operate independently from,1
as soon as possible. all attempts by the bbc news website to,1
tructure of the silicon used to make computer chips. dr pani,1
for the coming year should be about attracting third-party d,1
uality  rap.  the web might be just the right medium for spa,1
es work together which will make the difference   he said. h,1
al terrorism whilst guaranteeing the welfare the one million,1
cost as a voice call.  by failing to provide and fund the vi,1
the uk - the tags allow the rapid inventory of bulk items. t,1
ow well it can do them   said mr irish. this christmas  gadg,1
of the alliance will sit alongside the content control syste,1
cause they will have much more processing and graphical powe,1
ggers were journalists or not did not apply because laws gov,1
roblem is well known in technical circles  the commercial wo,1
sting half that.  now vodafone has 14m customers in the uk a,1
so be a good way to ensure that the site stays working in th,1
object.  you don t arrive at tate britain and tell people wh,1
ity firm saint bernard software. the research reveals that u,1
help drive information and entries from blogs to the portals,1
e. mr dean is confident though:  i think if they see real hd,1
map is one you can hold in your hands  especially in remote,1
d be because you need the big vision to sell it.  then there,1
. the ietf is a large international community of network des,1
st-designed website. the awards have been running since 1997,1
.  there are legitimate companies who offer services such as,1
ving into a market dominated by low margin manufacturers lik,1
ess to rivals in the underground world of malware authors. n,1
id  we do look at customer s calling patterns and we do make,1
which combine a number of multimedia functions  were also in,1
ead quickly and avoid attempts to shut it down. in the past,1
percomputer  the cray-1  was installed at los alamos nationa,1
hey did not exist. the remaining 33% said they could not liv,1
al each year. yet  only 15% are actually recycled. this year,1
game s excellent graphics  easily the best-looking platform,1
ysts gartner. that was 26% more than the previous year. it i,1
ed so far in firefox than in ie. paul randle  microsoft wind,1
ng it should not be. mr underwood said that internet hunting,1
help drive information and entries from blogs to the portals,1
to tens of thousands of machines - are used for a variety of,1
es  learning about copyright.   perhaps surprisingly  opinio,1
el stilted rather than organic. the genius of something like,1
ply are not put together with much style or imagination. adm,1
or video message. the fact that multimedia services are not,1
are not engaging with the net. they don t have the motivatio,1
he machine to look at content like lego blocks that can be r,1
ther  but aside from the fact that these mails are bogus  cl,1
hold the patent on  one-click  online purchase. it is a smal,1
has agreed a content deal with personal video recorder compa,1
ots which computers or groups of users regularly talk to eac,1
mes or films to watch on them. satellite broadcaster bskyb i,1
is going to be increasingly part of clothing  jewellery  and,1
programs. on spyware freely available programs such as ad-aw,1
ustry and the media have helped to raise awareness of the is,1
nd voice  in packets of data instead of conventional means.,1
early years  the future of search is not going to be purely,1
tv a telephone and a games machine  not just a textbook.  mr,1
service  to provide commuters a fast net connection too. the,1
from 1891  is at number 20 in the list. gadgets which could,1
sions of the windows operating system. a new version of ie w,1
ut time. we have a long and depressing history of developing,1
rms of the george w bush domain name. ironically one of the,1
which combine a number of multimedia functions  were also in,1
he us.,1
recent report by analysts screen digest.,1
among young americans  according to recent research by the p,1
urther in coming months mr danton advises everyone to shop a,1
