salary scandal in cameroon cameroon says widespread corruption in its finance ministry has cost it 1bn cfa francs ($2m; £1m) a month,,,,,,,,,,,,,,,,,,,,,,,,,,,,,,,,,,,,,,,,,,,,,,,,,,,
mild winter drives us oil down 6% us oil prices have fallen by 6%  driven down by forecasts of a mild winter in the densely populated northeast,,,,,,,,,,,,,, oil prices have broken records in 2004  topping $50 a barrel at one point  driven up by a welter of worries about unrest in iraq and saudi arabia  rising demand and supply bottlenecks, london s international petroleum exchange remained closed for the christmas holiday,,,,,,,,,,,,,,,,,,,,,,,,,,,,,,,,,,,,
fiat mulls ferrari market listing ferrari could be listed on the stock market as part of an overhaul of fiat s carmaking operations  the financial times has reported,,,,,,,,,,,,,, maserati and ferrari sell about 10 000 cars between them and both companies broke even in 2003,  fiat  italy s largest private sector employer  did not comment on the reported changes, fiat recently negotiated an end to its alliance with general motors, the us firm agreed to pay $2bn to exit an agreement under which it could have been liable to buy fiat outright, analysts said the reported restructuring was evidence of the greater flexibility which fiat now had to develop the business,,,,,,,,,,,,,,,,,,,,,,,,,,,,,,,,,
trade gap narrows as exports rise the uk s trade gap narrowed in november  helped by a 7,,,,,,,,,,,,,,5bn, the cumulative deficit for the first eleven months of 2004 now stands at £36,3bn  £4,5bn higher than the same period in 2003,  november saw an improvement in export levels to both the european union and the rest of the world  the office for national statistics (ons) said, eu exports rose 2%  fuelled by an increase in sales of chemicals, non-eu exports shot up 7,5%  with growth seen across a range of manufacturing sectors including cars  consumer durables and chemicals, the export boost offset a 1% rise in imports, non-eu imports rose 3%  but the growth in goods entering the uk from the eu slowed to 0,5%,  the uk s deficit with the eu fell to £1,9bn from £2,1bn  while its non-eu shortfall dropped to £2,7bn from £2,9bn in october,  the country s surplus on trade-in-services remained steady at £1,5bn for the fifth month in a row, paul dales  uk economist for capital economics  said the figures represented an improvement on recent months, however  he stressed that the long-term prognosis for exports was still uncertain,  the figures are a lot better than expected but the trend still remains poor   he said,  there have been some very encouraging signs that the uk export recovery is starting to take hold, but there is a danger that this could be held back by the ongoing weakness of domestic demand on the continent,,,,,,,,,,,,,,,
japan turns to beer alternatives japanese brewers are increasingly making money from beer-flavoured drinks rather than beer itself  beer and spirits are heavily taxed in japan  driving breweries to search for alternatives,,,,,,,,,,,,,,,,,,,,,,,,,,,,,,,,,,,,,,,,,,,,,,,,,,,
ad sales boost time warner profit quarterly profits at us media giant timewarner jumped 76% to $1,,,,,,,,,,,,,, but its film division saw profits slump 27% to $284m  helped by box-office flops alexander and catwoman  a sharp contrast to year-earlier  when the third and final film in the lord of the rings trilogy boosted results, for the full-year  timewarner posted a profit of $3,36bn  up 27% from its 2003 performance  while revenues grew 6,4% to $42,09bn,  our financial performance was strong  meeting or exceeding all of our full-year objectives and greatly enhancing our flexibility   chairman and chief executive richard parsons said, for 2005  timewarner is projecting operating earnings growth of around 5%  and also expects higher revenue and wider profit margins,  timewarner is to restate its accounts as part of efforts to resolve an inquiry into aol by us market regulators, it has already offered to pay $300m to settle charges  in a deal that is under review by the sec, the company said it was unable to estimate the amount it needed to set aside for legal reserves  which it previously set at $500m, it intends to adjust the way it accounts for a deal with german music publisher bertelsmann s purchase of a stake in aol europe  which it had reported as advertising revenue, it will now book the sale of its stake in aol europe as a loss on the value of that stake,,,,,,,,,,,,,,,,,,,,,,,,,,
us data sparks inflation worries wholesale prices in the us rose at the fastest rate in more than six years in january  according to government data,,,,,,,,,,,,,,  but this michigan survey tells you that the consumer might be downshifting a little bit in terms of their confidence and their spending; this could be an indication of that,   consumer spending accounts for 66% of us economic activity and is viewed as a gauge of the health of the economy  which is why the michigan data is closely observed, however on friday  it was overshadowed by the core ppi core figure  which surged 2,7% during the past 12 months  the biggest year-on-year gain in nine years,  the concern is that traders might interpret this big jump in the core ppi as an impetus for the fed to be more aggressive than a measured move in moving rates   said paul cherney  chief market analyst at standard & poor s, but ian shepherdson  chief us economist at high frequency economics  said the ppi report was  much less alarming  than at first glance, one-time increases in alcohol and tobacco prices  which  are no indication of broad ppi pressure   were responsible for the increase  he said, prices for autos and trucks also jumped in january  but shepherdson said  it is a good bet these increases won t stick ,,,,,,,,,,,,,,,,,,,,,,,,,,,,,,
uk young top euro earnings league british children enjoy the highest average annual income in europe - more than double that of spanish or italian youngsters  a report suggests,,,,,,,,,,,,,,,,,,,,,,,,,,,,,,,,,,,,,,,,,,,,,,,,,,,
car giant hit by mercedes slump a slump in profitability at luxury car maker mercedes has prompted a big drop in profits at parent daimlerchrysler,,,,,,,,,,,,,,  while all these divisions are doing well the big worries continue to surround mercedes-benz   michael rabb  an analyst with bank sal oppenheim  told reuters,  in contrast  chrysler enjoyed a 5% annual increase in unit sales while revenues - calculated in us dollars - rose 10%, the us division - whose marques include dodge and jeep - transformed a full year operating loss of 506m euros in 2003 into a 1,4bn euros profit last year,  overall  daimlerchrysler saw worldwide vehicle sales rise 8% to 4,7 million in 2004 while total revenues added 4% to 142bn euros, chrysler s strong performance helped the world s fifth largest carmaker boost net income by 400m euros to 2,5bn euros,   the year 2004 shows that our strategy works well - even in such a challenging competitive environment   said jurgen schrempp  daimlerchrysler s chairman, daimlerchrysler took a 475m euro hit in costs stemming from a defects scandal at its joint venture  japanese subsidiary fuso, daimlerchrysler last week agreed a compensation package with partner mitsubishi motors which will see it buy out its stake in fuso, looking forward  daimerchrysler s profits are expected to be slightly higher in 2005, however  it is expecting  significant improvements  in profitability in 2006 as a result of a major investment in the mercedes product range,,,,,,,,,,,,,,,,,,,,,,,,,
us firm pulls out of iraq a us company has pulled out of a major contract to rebuild iraq s transport system after attacks on reconstruction efforts  pentagon officials have said,,,,,,,,,,,,,,,,,,,,,,,,,,,,,,,,,,,,,,,,,,,,,,,,,,,
bombardier chief to leave company shares in train and plane-making giant bombardier have fallen to a 10-year low following the departure of its chief executive and two members of the board,,,,,,,,,,,,,,20 canadian dollars,,,,,,,,,,,,,,,,,,,,,,,,,,,,,,,,,,,,,
hariri killing hits beirut shares shares in solidere  the lebanese company founded by assassinated former prime minister rafik hariri  fell 15% in renewed trading in beirut,,,,,,,,,,,,,, solidere posted profits of $12,5m in the first half of 2004  and its shares had been gaining in recent months,,,,,,,,,,,,,,,,,,,,,,,,,,,,,,,,,,,,
jobs growth still slow in the us the us created fewer jobs than expected in january  but a fall in jobseekers pushed the unemployment rate to its lowest level in three years,,,,,,,,,,,,,,  that means there are a limited number of new opportunities for workers,,,,,,,,,,,,,,,,,,,,,,,,,,,,,,,,,,,,,
high fuel costs hit us airlines two of the largest airlines in the us - american and southwest - have blamed record fuel prices for their disappointing quarterly results,,,,,,,,,,,,,,  the results came in below our already conservative estimate for the quarter   said ray neidl  an analyst at calyon securities, both american and southwest have been squeezed by cut-throat competition in the us airline industry  as a glut of available seats has led to fierce price reductions,,,,,,,,,,,,,,,,,,,,,,,,,,,,,,,,,,,,
lesotho textile workers lose jobs six foreign-owned textile factories have closed in lesotho  leaving 6 650 garment workers jobless  union officers told the ap news agency,,,,,,,,,,,,,, the assistance of a us law had given lesotho s textiles duty-free access to north american markets, the african growth and opportunity act (agoa)  gave sub-saharan countries preferential access to the us market for apparel and textile products as well as a wide range of other goods, a lesotho government news briefing is expected on wednesday,,,,,,,,,,,,,,,,,,,,,,,,,,,,,,,,,,,
post-christmas lull  in lending uk mortgage lending showed a  post-christmas lull  in january  indicating a slowing housing market  lenders have said,,,,,,,,,,,,,,,,,,,,,,,,,,,,,,,,,,,,,,,,,,,,,,,,,,,
us interest rate rise expected us interest rates are expected to rise for the fifth time since june following the us federal reserve s latest rate-setting meeting later on tuesday,,,,,,,,,,,,,,  while inflation has moved up  it hasn t moved up a lot,   if economic growth should subside,,, the fed would feel it has the flexibility to pause in its tightening,  but if economic growth picked up and caused core inflation to rise a little more quickly  i think the fed would be prepared to tighten more quickly as well,,,,,,,,,,,,,,,,,,,,,,,,,,,,,,,,
us trade deficit widens sharply the gap between us exports and imports has widened to more than $60bn (£31,,,,,,,,,,,,,,  the dollar s fall has been sudden  violent and appropriate given this number   said brian taylor of wells fargo in minneapolis,  recent exchange rate movements certainly haven t had any impact yet,  treasury secretary john snow put a brave face on the news  saying it was a sign of strong economic expansion,  the economy is growing at such a fast rate that it is generating lots of disposable income,,, some of which is used to buy goods from our trading partners,   although the white house officially still backs the us s traditional  strong dollar  policy  it has tacitly indicated that it would be happy if the slide continued, the dollar has fallen by 50% against the euro - as well as by 30% against the yen - in the past three years, the main catalyst  most economists accept  is the large budget deficit on the one hand  and the current account deficit - the difference between the flow of money in and out of the us - on the other, the trade deficit is a large part of the latter, in november  the fall in exports was largely due to a decline in sales of industrial supplies and materials such as chemicals  as well as of cars  consumer goods and food, one small bright spot for us policy-makers was a slight decline in the deficit with china  often blamed for job losses and other economic woes, although china s overall trade surplus is expanding  according to chinese government figures  the commerce department revealed the us s deficit with china was $19,6bn in november  down from $19,7bn the month before, but the deficit with japan was at its worst in more than four years,,,,,,,,,,,,,,,,,,,,,
ailing eurodisney vows turnaround eurodisney  the european home of mickey mouse and friends  has said it will sell 253m euros (£175m; $328m) of new shares as it looks to avoid insolvency,,,,,,,,,,,,,,,,,,,,,,,,,,,,,,,,,,,,,,,,,,,,,,,,,,,
house prices suffer festive fall uk house prices fell 0,,,,,,,,,,,,,,,,,,,,,,,,,,,,,,,,,,,,,,,,,,,,,,,,,,,
strong dollar  call halts slide the us dollar s slide against the euro and yen has halted after us treasury secretary john snow said a strong dollar was  in america s interest ,,,,,,,,,,,,,,  the eurozone is growing below its potential, when a major part of the global economy is below potential there are negative consequences,,, for the citizens of those economies,,, and for their trading partners   he said, mr snow s comments may have helped shore up the dollar on monday  but he was careful to qualify his statement,   our basic policy  of course  is to let open  competitive markets set the values   he explained,  markets are driven by fundamentals and towards fundamentals,  us officials have also said that other economies need to grow  so the us is not the main global growth engine, economists say that the fundamentals  or key indicators  of the us economy are looking far from rosy, domestic consumer demand is cooling  and heavy spending by president bush has pushed the budget deficit to a record $427bn (£230bn), the current account deficit  meanwhile  hit a record $166bn in the second quarter of 2004, for many analysts  a weaker dollar is here to stay,  no end is in sight   said carsten fritsch  a strategist at commerzbank ,  it is only a matter of time until the euro reaches $1,30,  some analysts maintain the us is secretly happy with a lower dollar which helps makes its exports cheaper in europe  thus boosting its economy,,,,,,,,,,,,,,,,,,
standard life concern at lse bid standard life is the latest shareholder in deutsche boerse to express concern at the german stock market operator s plans to buy the london stock exchange,,,,,,,,,,,,,, but the london exchange is also holding talks with deutsche boerse s rival euronext  which operates the amsterdam  brussels  lisbon and paris exchanges  as well as london-based international derivatives market liffe,,,,,,,,,,,,,,,,,,,,,,,,,,,,,,,,,,,,,
asia shares defy post-quake gloom indonesian  indian and hong kong stock markets reached record highs,,,,,,,,,,,,,,  our nation is in peril here   said ahmed shaheed  the chief government spokesman, he estimated the economic cost of the disaster at hundreds of millions of dollars, the maldives has gross domestic product of $660m,  it won t be surprising if the cost exceeds our gdp   he said,  in the last few years  we made great progress in our standard of living - the united nations recognised this, now we see this can disappear in a few days  a few minutes,  shaheed noted that investment in a single tourist resort - the economic mainstay - could run to $40m, between 10 and 12 of the 80-odd resorts have been severely damaged  and a similar number have suffered significant damage,  however  many experts  including the world bank  have pointed out that it is still difficult to assess the magnitude of the disaster and its likely economic impact, in part  this is because of its scale  and because delivering aid and recovering the dead remain priorities,  calculators will have to wait   said an imf official in a briefing on wednesday,  the financial and world community will be turning toward reconstruction efforts and at that point people will begin to have a sense of the financial impact,,,,,,,,,,,,,,,,,,,,,,,,,,
mci shareholder sues to stop bid a shareholder in us phone firm mci has taken legal action to halt a $6,,,,,,,,,,,,,, it is a long-distance and corporate phone firm  and would provide the buyer with access to a global telecommunications network and a large number of business-based subscribers, mci shares jumped on friday  hitting their highest level since april 2004 amid speculation that it would be the focus of a bidding war, a takeover of mci would be the fifth billion-dollar telecoms deal since october as companies look to cut costs and boost client bases, earlier this month  sbc communications agreed to buy its former parent and phone pioneer at&t for about $16bn,,,,,,,,,,,,,,,,,,,,,,,,,,,,,,,,,,
go-ahead for balkan oil pipeline albania  bulgaria and macedonia has given the go ahead for the construction of a $1,,,,,,,,,,,,,,,,,,,,,,,,,,,,,,,,,,,,,,,,,,,,,,,,,,,
japanese mogul arrested for fraud one of japan s best-known businessmen was arrested on thursday on charges of falsifying shareholder information and selling shares based on the false data,,,,,,,,,,,,,,  i felt enormous pressure when i dined with him and it was nothing but pain   tsutsumi told a weekly magazine in 1987,  he scolded me for pouring too much soy sauce or told me fruit was not for children, he didn t let me use the silk futon  saying it s a luxury,  there have been corporate governance issues at some other japanese companies too, last year  twelve managers from mitsubishi motors were charged with covering up safety defects in their vehicles and three executives from japan s troubled ufj bank were charged with concealing the extent of the bank s bad loans,,,,,,,,,,,,,,,,,,,,,,,,,,,,,,,,,
us bank  loses  customer details the bank of america has revealed it has lost computer tapes containing account details of more than one million customers who are us federal employees,,,,,,,,,,,,,,,,,,,,,,,,,,,,,,,,,,,,,,,,,,,,,,,,,,,
battered dollar hits another low the dollar has fallen to a new record low against the euro after data fuelled fresh concerns about the us economy,,,,,,,,,,,,,,8% rise in october, the official us policy is that it supports a strong dollar but many market observers believe it is happy to let the dollar fall because of the boost to its exporters,  the us government has faced pressure from exporter organisations which have publicly stated the currency still has further to fall from  abnormal and dangerous heights  set in 2002, the us says it will let market forces determine the dollar s strength rather than intervene directly, statements from president bush in recent weeks highlighting his aim to cut the twin us deficits have prompted slight upturns in the currency, but while some observers said the quiet trade on thursday had exacerbated small moves in the market  most agree the underlying trend remains downwards, the dollar has now fallen for a third consecutive year and analysts are forecasting a further  albeit less dramatic weakening  in 2005,  i can see it finishing the year around $1,35 and we can see that it s going to be a steady track upward for the euro/dollar in 2005  finishing the year around $1,40   said adrian hughes  currency strategist with hsbc in london,,,,,,,,,,,,,,,,,,,,,,,,,,,,
iraqi voters turn to economic issues beyond the desperate security situation in iraq lies an economy in tatters,,,,,,,,,,,,,,  an indication of this can be seen in the world of finance where  in contrast with the daily plight of ordinary people  19 private banks operate  only one of which is run in accordance with islamic banking principles, hopes are high for the future of finance  so foreign banks have been buying into the sector, national bank of kuwait has bought a majority stake in credit bank of iraq  the jordanian investment bank export & finance bank has bought 49% of national bank of iraq,  foreign firms also hope to cash in on the reconstruction effort, bechtel s efforts to rebuild schools and restore power have attracted controversy as well as boosting its bottom line while halliburton has enjoyed a wealth of military contracts, but the involvement of foreign firms in the health and banking sectors and beyond sits uneasily with many iraqis who are accustomed to the state taking responsibility for functions that are essential to making society work  observes ms alexander,  it is seen as a selling off of iraq s assets and bringing in multinationals at the expense of iraqi businesses and iraqi workers   she says, consequently  the transitional government has been forced to backtrack in recent months over its proposal to allow 100% foreign ownership of iraqi assets  she explains, in the west  it is easy to forget that the otherwise brutal baathist regime used to look after the majority of iraq s citizens rather well in terms of job creation  social security and healthcare, opinion polls suggest that  people still want the state to take a leading role in providing these things   ms alexander says,  yet in some areas of the economy  investment from abroad is still warmly welcomed  insists mr hadi  an iraqi who left the country three decades ago,  i think the private sector will evolve incredibly fast   mr hadi says,  iraq s vast natural resources can support any magnitude of economic growth,   many foreign companies say they are keen to get in on the act  yet few are actually entering the country in any meaningful way, but there are exceptions, mr hadi s blackwatch is just one of many small operators preparing for a much bigger future, blackwatch s baghdad-based affiliate falcon group has dozens of people working for it across the country in kirkuk and baghdad  and its engineers and geo-scientists work with the iraqi oil ministry to hammer out technology transfer issues  mr hadi points out,  these guys are trying to work, the iraqi business people will do business at all times,  life goes on in iraq  the people take responsibility  they want to live normal lives,,,,,,,,,,,,,,,,,,
india-pakistan peace boosts trade calmer relations between india and pakistan are paying economic dividends  with new figures showing bilateral trade up threefold in the summer,,,,,,,,,,,,,, higher oil prices  the level of tax collections  and an unfavourable monsoon season affecting the farm sector had hurt the economy in april-september  it said,,,,,,,,,,,,,,,,,,,,,,,,,,,,,,,,,,,,,
gm issues 2005 profits warning general motors has warned that it expects earnings this year be lower than in 2004,,,,,,,,,,,,,, its vehicle businesses have gained market share in three out of four regions in 2004  achieving record profitability in asia pacific and returning to profit in latin america  the middle east and africa, the car maker has diversified into financial services  and is extending the reach of general motors acceptance corp (gmac)  which has said it may enter the home loans market, gmac has been a strong contributor to profits in 2004 but gm said it will do less well this year  delivering net income of $2,5bn,  attaining earnings of $10 a share remains gm s goal   the company said  adding it believes it can achieve this in 2007,,,,,,,,,,,,,,,,,,,,,,,,,,,,,,,,,
asian banks halt dollar s slide the dollar regained some lost ground against most major currencies on wednesday after south korea and japan denied they were planning a sell-off,,,,76 yen at 0950 gmt  0,,,,,,,,,, it issued a statement that  the bank of korea will not change the portfolio of currencies in its reserves due to short term market factors , japan  too  steadied nerves, a senior japanese finance ministry official told reuters  we have no plans to change the composition of currency holdings in the foreign reserves  and we are not thinking about expanding our euro holdings , japan has $850bn in foreign exchange reserves, at the start of the year  the us currency  which had lost 7% against the euro in the final three months of 2004 and had fallen to record lows  staged something of a recovery, analysts  however  pointed to the dollar s inability recently to extend that rally despite positive economic and corporate data  and highlighted the fact that many of the us s economic problems had not disappeared, the focus has been on the country s massive trade and budget deficits  and analysts have predicted more dollar weakness to come,,,,,,,,,,,,,,,,,,,,,,,,,,,,,,,
christmas shoppers flock to tills shops all over the uk reported strong sales on the last saturday before christmas with some claiming record-breaking numbers of festive shoppers,,,,,,,,,,,,,,  every week footfall has been showing strong growth and at the weekends it has been going mad,  regent street association director annie walker said on saturday:  the stores were heaving today and a lot of people are going to be doing last minute shopping as many people finished work on friday and can go in the week,   she said reports of a slump in pre-christmas sales were related to the growing popularity of internet sales,  i do think this has had a lot to do with reports of lower sales figures   she said,  internet shopping has gone up enormously and not all stores have websites,,,,,,,,,,,,,,,,,,,,,,,,,,,,,,,,,
beijingers fume over parking fees choking traffic jams in beijing are prompting officials to look at reorganising car parking charges,,,,,,,,,,,,,,,,,,,,,,,,,,,,,,,,,,,,,,,,,,,,,,,,,,,
