worldcom boss  left books alone  former worldcom boss bernie ebbers  who is accused of overseeing an $11bn (£5,,,,,,,,,,,,,, worldcom s problems mounted  however  as competition increased and the telecoms boom petered out, when the firm finally collapsed  shareholders lost about $180bn and 20 000 workers lost their jobs, mr ebbers  trial is expected to last two months and if found guilty the former ceo faces a substantial jail sentence, he has firmly declared his innocence,,,,,,,,,,,,,,,,,,,,,,,,,,,,,,,,,,
s korean credit card firm rescued south korea s largest credit card firm has averted liquidation following a one trillion won ($960m; £499m) bail-out,,,,,,,,,,,,,,,,,,,,,,,,,,,,,,,,,,,,,,,,,,,,,,,,,,,
japanese banking battle at an end japan s sumitomo mitsui financial has withdrawn its takeover offer for rival bank ufj holdings  enabling the latter to merge with mitsubishi tokyo,,,,,,,,,,,,,, the two are set to merge their venture capital operations and there has been speculation that this could lead to a full-blown merger, japanese banks are increasingly seeking alliances to boost profits,,,,,,,,,,,,,,,,,,,,,,,,,,,,,,,,,,,,
insurance bosses plead guilty another three us insurance executives have pleaded guilty to fraud charges stemming from an ongoing investigation into industry malpractice,,,,,,,,,,,,,,,,,,,,,,,,,,,,,,,,,,,,,,,,,,,,,,,,,,,
german growth goes into reverse germany s economy shrank 0,,,,,,,,,,,,,, the ecb s mandate is to fight rising prices by boosting interest rates - and that could further threaten germany s hopes of recovery,,,,,,,,,,,,,,,,,,,,,,,,,,,,,,,,,,,,,
stock market eyes japan recovery japanese shares have ended the year at their highest level since 13 july amidst hopes of an economic recovery during 2005,,,,,,,,,,,,,,,,,,,,,,,,,,,,,,,,,,,,,,,,,,,,,,,,,,,
standard life cuts policy bonuses standard life  europe s largest mutual life insurer  has cut bonuses for with-profit policyholders,,,,,,,,,,,,,,  john gill  managing director of the insurer s life and pensions division  said that a strong stock market recovery in the past two years had only  partly compensated for losses during 2001 and 2002 , in addition  low interest rates meant that  long-term investment returns are well below historic levels   mr gill added, however  mr gill maintained that with-profits continued to perform well over the long term,  our payouts continue to stand up well against other types of long-term investments over similar periods   he said, standard life has an estimated 2,4 million with-profits policyholders, last year  the company announced that it was looking to float on the stock market in 2006,,,,,,,,,,,,,,,,,,,,,,,,,,,,,,,
pernod takeover talk lifts domecq shares in uk drinks and food firm allied domecq have risen on speculation that it could be the target of a takeover by france s pernod ricard,,,,,,,,,,,,,, pernod is home to brands including chivas regal scotch whisky  havana club rum and jacob s creek wine, allied domecq s big names include malibu rum  courvoisier brandy  stolichnaya vodka and ballantine s whisky - as well as snack food chains such as dunkin  donuts and baskin-robbins ice cream, the wsj said that the two were ripe for consolidation  having each dealt with problematic parts of their portfolio, pernod has reduced the debt it took on to fund the seagram purchase to just 1,8bn euros  while allied has improved the performance of its fast-food chains,,,,,,,,,,,,,,,,,,,,,,,,,,,,,,,,,
telegraph newspapers axe 90 jobs the daily and sunday telegraph newspapers are axing 90 journalist jobs - 17% of their editorial staff,,,,,,,,,,,,,, the telegraph group was bought by the barclay twins - frederick and david - last year  having previously been owned by lord conrad black s hollinger international, the brothers are currently mulling the sale of another of their businesses  retailer littlewoods,  telegraph executive murdoch maclennan said the two newspapers would add eight colour pages in the coming months,   journalists are the lifeblood of any newspaper  and maintaining the quality of the daily telegraph and the sunday telegraph for our readers is vital   he said,  however  action to improve our production capability and secure our titles against the competition is also vital,  many newspapers are investing in new printing machinery that enables them to print more colour pages  or in some cases  have colour on every page, they are hoping that by boosting colour it will make their publications more attractive to advertisers and readers alike, in recent months news corp s news international unit  which publishes the sun and the news of the world  the guardian media group  trinity mirror and the daily mail & general trust have all announced substantial investments in new printing plants,,,,,,,,,,,,,,,,,,,,,,,,,,,,,,
court rejects $280bn tobacco case a us government claim accusing the country s biggest tobacco companies of covering up the effects of smoking has been thrown out by an appeal court,,,,,,,,,,,,,,,,,,,,,,,,,,,,,,,,,,,,,,,,,,,,,,,,,,,
india power shares jump on debut shares in india s largest power producer  national thermal power corp (ntpc) have risen 13% on their stock market debut,,,,,,,,,,,,,,,,,,,,,,,,,,,,,,,,,,,,,,,,,,,,,,,,,,,
indonesia  declines debt freeze  indonesia no longer needs the debt freeze offered by the paris club group of creditors  economics minister aburizal bakrie has reportedly said,,,,,,,,,,,,,, the paris club decision to find out more details such as how much of our debt will be subject to a moratorium, that s how far we are at this stage   said mr siregar,  the 19 member countries of the paris club are owed about $5bn this year in debt repayments by nations affected by the indian ocean tsunami, indonesia  sri lanka and the seychelles accepted the paris club offer  which was criticised by some aid groups as being too little, thailand and india have however declined the offer  with thailand prefering to keep up with its payments while india said it would prefer to rely on its own resources rather than on international aid, putting off payments may lower a country s rating among financial organisations  making it more expensive and more difficult for them to borrow money in the future  analysts said, separately  the indonesian government has said it will announce monthly how much it has received in foreign donations and how it has spent the money, welfare minister alwi shihab told ap news agency that this announcement should allay suspicion of official corruption in relief operations,,,,,,,,,,,,,,,,,,,,,,,,,,,,,,
call to save manufacturing jobs the trades union congress (tuc) is calling on the government to stem job losses in manufacturing firms by reviewing the help it gives companies,,,,,,,,,,,,,,,,,,,,,,,,,,,,,,,,,,,,,,,,,,,,,,,,,,,
khodorkovsky ally denies charges a close associate of former yukos boss mikhail khodorkovsky has told a court that fraud charges levelled against him are  false ,,,,,,,,,,,,,,,,,,,,,,,,,,,,,,,,,,,,,,,,,,,,,,,,,,,
chinese dam firm  defies beijing  the china three gorges project corp is refusing to obey a government order to stop construction of one of its giant dams  the chinese state press has said,,,,,,,,,,,,,, it is a sister project to the main three gorges dam downstream where more than half a million people have had to be relocated  drawing criticism from environmental groups and overseas human rights activists,,,,,,,,,,,,,,,,,,,,,,,,,,,,,,,,,,,,,
bank set to leave rates on hold uk interest rates are set to remain on hold at 4,,,,,,,,,,,,,,,,,,,,,,,,,,,,,,,,,,,,,,,,,,,,,,,,,,,
us trade gap hits record in 2004 the gap between us exports and imports hit an all-time high of $671,,,,,,,,,,,,,, some economists say this may allow an upward revision of us economic growth in the fourth quarter, but others point out that the deficit has reached such astronomical proportions that foreigners many choose not to hold as many dollar-denominated assets  which may in turn harm growth, for all of 2004  us exports rose 12,3% to $1,15 trillion  but imports rose even faster by 16,3% to a new record of $1,76 trillion, foreign oil exports surged by 35,7% to a record $180,7bn  reflecting the rally in global oil prices and increasing domestic demand, imports were not affected by the dollar s weakness last year,  we expect the deficit to continue to widen in 2005 even if the dollar gets back to its downward trend   said economist marie-pierre ripert at ixis,,,,,,,,,,,,,,,,,,,,,,,,,,
safety alert as gm recalls cars the world s biggest carmaker general motors (gm) is recalling nearly 200 000 vehicles in the us on safety grounds  according to federal regulators,,,,,,,,,,,,,,,,,,,,,,,,,,,,,,,,,,,,,,,,,,,,,,,,,,,
profits slide at india s dr reddy profits at indian drugmaker dr reddy s fell 93% as research costs rose and sales flagged,,,,,,,,,,,,,, dr reddy s indian competitors are gathering strength although they too face heavy competitive pressures,,,,,,,,,,,,,,,,,,,,,,,,,,,,,,,,,,,,,
us crude prices surge above $53 us crude prices have soared to fresh four-month highs above $53 in the us as refinery problems propelled petrol prices to an all-time high,,,,,,,,,,,,,, oil prices are roughly 45% higher than a year ago and have risen sharply in recent weeks due to a combination of colder weather  the declining value of the dollar and fears that opec could rein in production to head off a seasonal drop in demand, instability in iraq and underlying fears about terrorism have also played a part in the rally,,,,,,,,,,,,,,,,,,,,,,,,,,,,,,,,,,,,
dollar hovers around record lows the us dollar hovered close to record lows against the euro on friday as concern grows about the size of the us budget deficit,,,,,,,,,,,,,, at the same time  german chancellor gerhard schroeder and italian prime minister silvio berlusconi voiced concerns about the strength of the euro, mr berlusconi said the euro s strength was  absolutely worrying  for italian exports, mr schroeder said in a newspaper article that stability in foreign exchange markets required a correction of global economic imbalances, investors will now look towards february s meeting of finance ministers from the g7 industrialised nations in london for clues as to whether central banks will combine forces to stem the dollar s decline,,,,,,,,,,,,,,,,,,,,,,,,,,,,,,,,,,
rich grab half colombia poor fund half of the money put aside by the colombian government to help the country s poor is benefiting people who do not need it  a study has found,,,,,,,,,,,,,,3%  he said,,,,,,,,,,,,,,,,,,,,,,,,,,,,,,,,,,,,,
german business confidence slides german business confidence fell in february knocking hopes of a speedy recovery in europe s largest economy,,,,,,,,,,,,,, latest indications are that growth is still proving elusive and ifo president hans-werner sinn said any improvement in german domestic demand was sluggish, exports had kept things going during the first half of 2004  but demand for exports was then hit as the value of the euro hit record levels making german products less competitive overseas, on top of that  the unemployment rate has been stuck at close to 10% and manufacturing firms  including daimlerchrysler  siemens and volkswagen  have been negotiating with unions over cost cutting measures, analysts said that the ifo figures and germany s continuing problems may delay an interest rate rise by the european central bank, eurozone interest rates are at 2%  but comments from senior officials have recently focused on the threat of inflation  prompting fears that interest rates may rise,,,,,,,,,,,,,,,,,,,,,,,,,,,,,,,,,
gm  ford cut output as sales fall us car firms general motors (gm) and ford have been forced to cut production in the face of falling car sales,,,,,,,,,,,,,, chrysler  the us unit of germany s daimlerchrysler  was the only detroit based automaker to boast an increase in market share during the month - with sales rising 8%,  but america s loss was its foreign rivals  gain as they continued to nibble away at the us market, while japan s top car maker toyota and nissan saw sales accelerate  even the smaller suzuki motor corp snapped up a more business with sales improving 17,6% on a year ago, in 2003  the firm launched an ambitious plan to triple us sales by 2007 as it seeks to become a bigger player in the asian assault on the us market, korea s hyundai was another big gainer  turning in a 19% surge in february sales, toyota put its rise in sales down to strong results for its redesigned avalon sedan and a 120% surge in sales of its gas-electric prius hybrid mid-size sedan as petrol-price conscious consumers looked to vehicles that were cheaper to run,  as gas prices continue their upward march  fuel efficiency catches the public eye   jim press  vice president and chief operating officer of toyota s us sales arm  said in a statement,,,,,,,,,,,,,,,,,,,,,,,,,,,,,,
orange colour clash set for court a row over the colour orange could hit the courts after mobile phone giant orange launched action against a new mobile venture from easyjet s founder,,,,,,,,,,,,,,,,,,,,,,,,,,,,,,,,,,,,,,,,,,,,,,,,,,,
economy  strong  in election year uk businesses are set to prosper during the next few months - but this could trigger more interest rate rises  according to a report,,,,,,,,,,,,,,0 in january from 108,0 in october last year,  the uk is looking strong going into the general election  but businesses need to prepare themselves for a jolt ahead as the bank of england reacts to growth and inflationary pressures   said peter hemington  partner at bdo stoy hayward,  growth will probably slow by the end of 2005 and it is likely that we will see higher interest rates or a sharp drop in demand for products and services,,,,,,,,,,,,,,,,,,,,,,,,,,,,,,,,,,
australia rates at four year high australia is raising its benchmark interest rate to its highest level in four years despite signs of a slowdown in the country s economy,,,,,,,,,,,,,,  at 2,6%  inflation remains within the bank s 2-3% target range, however  exports declined in the second half of 2004  fuelling a rise in the country s current account deficit - the difference in the value of imports compared to exports - to a record australian dollar 29,4bn, the australian government said the economy remained strong with unemployment at a near 30 year low,  the economy has been strong and it is properly moderating but it doesn t look to me like it s slowing in any unreasonable way   said treasurer peter costello, stock markets had factored in the likelihood of a rate rise but analysts still expressed concern about the strength of the economy,  that 1,5% annual growth rate is the lowest we have seen since the post-election slump we saw back in 2000-1   said michael blythe  chief economist at the commonwealth bank of australia,  this suggests the economy really did slow very sharply in the second half of 2004,,,,,,,,,,,,,,,,,,,,,,,,,,,,
chinese exports rise 25% in 2004 exports from china leapt during 2004 over the previous year as the country continued to show breakneck growth,,,,,,,,,,,,,, china s exporting success has made the trade deficit of the united states soar even further and made trade with china a sensitive political issue in washington, the peg keeping the yuan around 8,30 to the dollar is often blamed by us lawmakers for job losses at home, a us report issued on tuesday on behalf of a congressionally-mandated panel said almost 1,5 million posts disappeared between 1989 and 2003, the pace accelerated in the final three years of the period  said the report for the us-china economic and security review commission  moving out of labour-intensive industries and into more hi-tech sectors, the us s overall trade deficit with china was $124bn in 2003  and is expected to rise to about $150bn for 2004,,,,,,,,,,,,,,,,,,,,,,,,,,,,,,,
arsenal  may seek full share listing  arsenal vice-chairman david dein has said the club may consider seeking a full listing for its shares on the london stock exchange,,,,,,,,,,,,,, but we must constantly improve if we want to remain as the world s leading league competition,  we must monitor the quality of the product and ensure attendances do not decline  and we must balance that with the quantity of exposure on tv too,  i think we have practically reached saturation point,,, sometimes i think less is more,   the club is funding its move to ashburton grove through a number of sources  including debt from banks  from money it already has and will receive in coming years from sponsors  and from the sale of surplus property  including its highbury stadium, it is also looking to create new revenue streams from overseas markets  including asia,  we have two executives travelling round japan and china at the moment building relationships with organisations and clubs  and we know our supporters clubs are growing there too  as they are around the world,  we have got a very good product  so it is very important we go and look at these markets  and make sure we are on the case,,,,,,,,,,,,,,,,,,,,,,,,,,,,
deutsche boerse set to  woo  lse bosses of deutsche boerse and the london stock exchange are to meet amid talk that a takeover bid for the lse will be raised to £1,,,,,,,,,,,,,, in a statement on thursday  euronext said any offer was likely to be solely in cash  but added that:  there can be no assurances at this stage that any offer will be made,  a deal with either bidder would create the biggest stock market operator in europe and the second biggest in the world after the new york stock exchange,  according to the ft  in its latest meeting deutsche boerse will adopt a charm offensive to woo the london exchange, the newspaper said the german suitor will offer to manage a combined cash and equities market out of london and let ms furse take the helm, other reports this week said the deutsche boerse might even consider selling its luxembourg-based clearstream unit - the clearing house that processes securities transactions, its ownership of clearstream was seen as the main stumbling block to a london-frankfurt merger, lse shareholders feared a deutsche boerse takeover would force them to use clearstream  making it difficult for them to negotiate for lower transaction fees,,,,,,,,,,,,,,,,,,,,,,,,,,,,,,,
the  ticking budget  facing the us the budget proposals laid out by the administration of us president george w bush are highly controversial,,,,,,,,,,,,,, the dollar is already sinking, before too long  credit markets are likely to react  and interest rates will creep upwards, that will be the shock,  interest-sensitive industries will feel pain immediately - sectors such as housing  automobiles  other consumer durables  agriculture  and small business, some will recall the news footage of angry farmers driving their heavy equipment around the us capitol in the late 1970s, there will be no need for constitutional amendments to balance the budget, the public outcry will force congress to act, whether it will act wisely is another matter, how did this happen   by definition  the deficit means too little revenue and too much spending - but this neutral description doesn t adequately capture the current situation, federal revenues are at 1950s levels  while spending remains where it has been in recent decades - much higher, in addition  the united states has two significant military missions, the bush administration s chosen remedy is the least feasible one, reducing domestic spending  or eliminating  waste  fraud and abuse  is toothless because this slice of the budget is too small to solve the problem, indeed  if congress were rash enough to balance the budget in this way  there would hardly be any such spending left, law enforcement  space exploration  environmental clean-up  economic development  the small business administration  housing  veterans  benefits  aid to state and local governments would all but disappear, it s fantasy to think these routine government functions could be slashed, the biggest spending growth areas are defence (including homeland security)  and health care for the elderly and the poor, to some extent  increases in these areas are inevitable, the us population is aging  and the nation does face genuine threats in the world, but serious savings can only be found where the big money is, savings in health care spending that do not come at the expense of health can only be achieved with wholesale reform of the entire system  public and private, brute force budget cuts or spending caps would ill-serve the nation s elderly and indigent,  on the revenue side  the lion s share of revenue lost to tax cuts enacted since 2000 will have to be replaced,  some rearranging could hold many people harmless and focus most of the pain on those with relatively high incomes, finally  blind allegiance to a balanced budget will have to be abandoned, there is no good reason to fixate on it  anyway, moderate deficits and slowly rising federal debt can be sustained indefinitely, borrowing for investments in education and infrastructure that pay off in future years makes sense, the sooner we face that reality  the sooner workable reforms can be pursued, first on the list should be tax reform to raise revenue  simplify the tax code  and restore some fairness eroded by the bush tax cuts, second should be a dispassionate re-evaluation of the huge increase in defence spending over the past three years  much of it unrelated to afghanistan  iraq  or terrorism, third must be the start of a serious debate on large-scale health care reform, one thing is certain - destroying the budget in order to save it is not going to equip the us economy and government for the challenges of this new century,,,,,
french suitor holds lse meeting european stock market euronext has met with the london stock exchange (lse) amid speculation that it may be ready to launch a cash bid,,,,,,,,,,,,,, german politicians are also said to be angry over the market operator s promise to move its headquarters to london if a bid were successful,  meanwhile  lse shareholders fear that deutsche boerse s control over its clearstream unit - the clearing house that processes securities transactions - would create a monopoly situation, this would weaken the position of shareholders when negotiating lower transaction fees for share dealings, lse and euronext do not have control over their clearing and settlement operations  a situation which critics say is more transparent and competitive, the german group s ownership of clearstream has been seen as the main stumbling block to a london-frankfurt merger, commentators believe deutsche boerse  which has now formally asked german authorities to approve its plan to buy the lse  may offer to sell clearstream to gain shareholder approval, euronext  so far  has given little away as to what sweeteners it will offer the lse - europe s biggest equity market - into a deal,,,,,,,,,,,,,,,,,,,,,,,,,,,,,,,
card fraudsters  targeting web  new safeguards on credit and debit card payments in shops has led fraudsters to focus on internet and phone payments  an anti-fraud agency has said,,,,,,,,,,,,,, nearly two thirds - 65% - of the 1 000 people interviewed said they had used chip and pin to make payments, of these  83% were happy with the experience  though nearly a quarter said they struggled to remember their pin number, however  only 34% said they had received replacement cards with the necessary  chip  technology from all their card providers, furthermore  16% said that none of their cards had been replaced  while 30% said only some had, uk shoppers spent £5,3bn on plastic cards in 2003  the last full year for which figures are available from the association of payment clearing services (apacs), altogether  card scams on uk-issued cards totalled £402,4m in 2003, card-not-present fraud rose an annual 6% to £116,4m  making it the biggest category even then, within this  internet fraud totalled £43m  apacs  figures show,,,,,,,,,,,,,,,,,,,,,,,,,,,
profits stall at china s lenovo profits at chinese computer firm lenovo have stood still amid slowing demand at home and stiffening competition,,,,,,,,,,,,,, there have been rumours that the deal could be in trouble because us government agencies fear it could offer china opportunities for industrial espionage, the reports of the possibility of an investigation into the risk sent lenovo s shares up 6% in late january,,,,,,,,,,,,,,,,,,,,,,,,,,,,,,,,,,,,
eu-us seeking deal on air dispute the eu and us have agreed to begin talks on ending subsidies given to aircraft makers  eu trade commissioner peter mandelson has announced,,,,,,,,,,,,,, so far  airbus has delivered 40 a300s to ups, airbus overtook boeing as the world s largest manufacturer of commercial airliners in 2003,,,,,,,,,,,,,,,,,,,,,,,,,,,,,,,,,,,,
consumer spending lifts us growth us economic growth accelerated in the third quarter  helped by strong consumer spending  official figures have shown,,,,,,,,,,,,,,6% in the second  as evidence that his policies are generating solid growth, consumer spending accounts for about two thirds of all economic activity in the us,  the weaker than expected growth figure makes it less likely that the us federal reserve will raise interest rates next month  economists said,  the economy regained some traction in the third quarter  but the growth is not robust   ag edwards  thayer,  i think that means the fed can take its time raising rates, we ll probably see one more rate hike before the end of the year,  in an effort to pre-empt rising inflation  the federal reserve has pushed through three quarter-point rate rises since june this year  taking borrowing costs to 1,75%, on the financial markets  the dollar fell slightly against the euro and the yen  while the dow jones index of leading us shares was little changed,,,,,,,,,,,,,,,,,,,,,,,,,,,,,
