1108,blair stresses prosperity goals tony blair says his party s next manifesto will be  unremittingly new labour  and aimed at producing  personal prosperity for all .  the prime minister is trying to draw a line under speculation over the state of his relationship with gordon brown with the speech in chatham  kent. he is saying that prosperity means both individual wealth and ensuring  radically improved  public services. he is also claiming labour is more ideologically united than ever. mr brown is currently touring africa after a week of facing questions about reports of his splits with downing street.  with the election widely predicted for may  angry labour mps this week warned mr blair and mr brown about the dangers of disunity. now mr blair is trying to put the focus on the substance of labour s platform for a third term in government. labour made low inflation  unemployment and mortgage rates the centrepiece of a new poster campaign this week.  and on thursday mr blair is saying:  i want to talk about the central purpose ofnew labour - which is to increase personal prosperity and well-being  not justfor a few but for all.  by prosperity i mean both the income and wealth of individuals and theirfamilies  and the opportunity and security available to them through radicallyimproved public services and a reformed welfare state.   the tories are trying to capitalise on the apparent feud at the top of government. on wednesday they unveiled a poster which pictured the prime minister and mr brown under the words  how can they fight crime when they are fighting each other   michael howard and frontbencher john redwood on thursday launched new plans to abolish hundreds of quangos. they say government is spending too much and lower taxes are needed to make britain more competitive.  the liberal democrats have also claimed infighting its obstructing good government. the latest speculation about relations between new labour s two most powerful figures came after the publication of a new book  brown s britain by robert preston. in it he alleges that mr blair told mr brown in 2003 he would step down as prime minister before the coming general election. the book claims the premier went back on his pledge after support from cabinet allies and suspicion that mr brown was manoeuvring against him. mr peston s book claimed that mr brown told mr blair:  there is nothing you could ever say to me now that i could ever believe.  on wednesday mr blair directly denied mr brown made that quote  and before he left for africa on tuesday the chancellor told reporters:  of course i trust the prime minister.,politics
1112,eu referendum question unveiled the question to be asked in the referendum on the eu constitution has been unveiled by the government.  it will be:  should the united kingdom approve the treaty establishing a constitution for the european union   the constitution will be incorporated into uk law if there is a yes vote in the referendum  expected in 2006. critics say the constitution is a further step towards a federal europe  but advocates say it ensures effective operation of the enlarged 25-state eu.  if we reject this treaty  britain will be isolated and weak in europe   said foreign secretary jack straw  who along with the rest of the cabinet  will back a  yes  vote.  patriots by definition wanted the uk to be prosperous at home and strong and influential abroad  mr straw said.  our role as a leading member of the eu is a crucial part of securing that.   conservative shadow foreign secretary michael ancram said the referendum question  seems straightforward . but he accused the government of trying to confuse the issue by putting the eu referendum question in the same bill as the ratification of the constitution  when they should be treated as  two separate issues . despite this  underhand trick   the referendum bill stood  no chance of becoming law before the election   he added.  this is tony blair s cheap gesture to the pro-constitution lobby while he runs scared of a debate on europe he knows he cannot win.  neil o brien  director of anti-constitution group vote no  said:  the reality is that the government doesn t want to discuss the eu constitution ahead of the election because they know it is extremely unpopular with voters and with business.   the uk independence party said:  if the government believes that a no vote would mean that we should leave the european union  they should just ask us if we want to leave the eu. then we can be out of it and better off much sooner.   liberal democrat leader charles kennedy  who backs the constitution  said he expected the referendum would come in the first half of next year. he told bbc radio 4 s today programme:  the sooner we get on with this  the better.  he said the question sounded  very neutral  and  balanced   adding it would enable the argument  to be enjoined fairly and squarely on both sides . green mep caroline lucas welcomed tony blair s  courage in keeping his word  on holding a referendum. but she added:  this treaty is a flawed document that will make the eu less accountable  less sustainable  and less just.   mr blair signed the constitution at a ceremony in rome in november  but had already made it clear the issue would be put to voters in a referendum. that promise came after sustained pressure from opposition parties. jack straw  who argues the constitution reflected a  british vision for europe  and gives  national governments a stronger grip   has said the referendum could be held in spring 2006. but in an interview with the financial times  mr blair refused to be pinned down to that date  saying britain would hold a poll  some time in 2006 but when  i don t know . the paper said the prime minister  claimed ignorance  of when other countries were planning to hold their referendums.,politics
1121,blair congratulates bush on win tony blair has said he looks forward to continuing his strong relationship with george bush and working with him during his second term as president.  mr bush s re-election came at a crucial time for a world that was  fractured  divided and uncertain   mr blair said. it had to be brought together  he added  saying action was needed on poverty  the middle east and the conditions on which terrorists prey. mr blair said states had to work with the us to fight global terrorism.  but there was a need to recognise it would not be defeated by  military might alone but also by demonstrating the strength of our common values  he added. solving the conflict in the middle east was the world s single most  pressing political challenge  of the present day  mr blair warned. the prime minister also urged europe and the us to  build anew their alliance .   all of us in positions of leadership  not just president bush  have a responsibility to rise to this challenge. it is urgent that we do so.  mr blair also paid tribute to democrat john kerry s campaign  saying he had helped make the presidential election  a true celebration of american democracy . the election of the us president was significant for the world but particularly so for britain because of its special relationship  he added. earlier tory leader michael howard sent mr bush his  warmest congratulations   saying:  we look to the president to be a unifying force for those all over the world who share our determination to defend freedom.  liberal democrat leader charles kennedy welcomed the fact there had been a quick conclusion to the election  unlike in 2000.  mr bush s first task was to  rebuild a sense of domestic purpose  within the us  he said. mr kennedy said:  internationally  it is to be hoped that a second term will see a more sensitive approach to relations with long-standing allies  not least for the global efforts to combat terrorism.  lib dem foreign affairs spokesman menzies campbell said a win by mr kerry would have given mr blair the chance of a fresh start  adding it was almost as if there was an  umbilical cord  between mr bush and the uk premier.   europeans must hope that his administration will be much more multilateral in character  and that he will act swiftly to rebuild the atlantic partnership which is so vital to security.  iraq will remain an issue of potential division for some time to come.  even before the result became clear  mr blair was being urged to push for action on climate change at his first meeting with whichever candidate won.  liberal democrat environment spokesman norman baker underlined the issue of global warming during a commons debate on anglo-american relations on wednesday. environment secretary margaret beckett has said the us will act on global warming despite george bush s refusal to sign up to the kyoto protocol on carbon emissions. public opinion would force change  she told bbc news. but myron ebell  an adviser on climate change to president bush  has said there would be no change in the us stance and rejected the threat of climate change. he claimed the us was the only country with independent scientists.,politics
1125,uk s  useless  quangos under fire the uk has 529 quangos financed with billions of pounds of taxpayers  cash - many of which are useless or duplicate each other s efforts  a report claims.  essential guide to british quangos 2005 author dan lewis said at least 111 of the appointed bodies had been set up since labour won power in 1997. he urged a limit on the number of quangos that could be set up by any individual government department. tories and lib dems welcomed the report and called for a  slimming down .  conservative deregulation spokesman john redwood said:  the research endorses our policy of destroying unwanted and unnecessary quangos  and slimming down the rest.   a conservative government will axe 162 quangos  as part of its drive for more efficient and more accountable government.  lib dem spokesman ed davey meanwhile said instead of the  bonfire of quangos  new labour had promised  there had been an  explosion  of them.  for over two decades  under both tory and labour governments  these unaccountable agencies have mushroomed.  liberal democrats would abolish many  merge others  and make any that remain properly accountable.  labour representatives were unavailable for comment. the quango guide follows last year s government-commissioned gershon report which recommended significant cuts in bureaucracy across the public sector.  mr lewis wants a public inquiry into regional development agencies which cost £1.8bn a year - cash he says which  appears to be almost entirely wasted . as well as a departmental limit on quangos he also wants a statutory five-year limit on any such body with executive powers. he also listed what he dubbed the nine  most useless quangos . they were the british potato council  the milk development council  the energy savings trust  agricultural wages committees  the wine standards board  the westminster foundation for democracy  the football licensing authority  investors in people uk and the economic and social research council. mr lewis branded the existence of the 60-employee potato council  set up in 1997 to research and promote overseas potato markets   surprising . he said the £80m spent annually on the energy savings trust  which promotes renewable energy  would be better spent on eight million boiler jackets for british homes.  and he argued it was  absurd  to charge farmers for agricultural wages committees  which set working and wage standards in the industry  when many were prepared to take advantage of immigrant labour prepared to work for £1 an hour.  if a football team can afford to pay £27m for wayne rooney  why should the taxpayer - not all of whom like football - be forced to fund the football licensing authority to the tune of over £1.1m a year   mr lewis asked. the report is published by the efficiency in government unit - a joint effort by right of centre think tanks the economic research council and the centre for policy studies. it says before a new public body is set up  an assessment should be made whether its proposed role is already carried out by an existing charity or other private organisation.,politics
1144,visa row mandarin made sir john the top civil servant at the centre of the david blunkett visa affair has been knighted in the new year honours.  sir john gieve was home office permanent secretary during the saga which ended with mr blunkett quitting. he and other civil servants were criticised for failing to recall how the visa for mr blunkett s ex-lover s nanny came to be fast-tracked. the outgoing head of the troubled child support agency doug smith also earns an honour in the new year s list. mr smith  57  whose retirement was announced by work and pensions secretary alan smith in november  is made a commander of the order of bath.  both men were giving evidence to a commons committee on the computer difficulties facing the agency  which left thousands of single parents without any maintenance payments  when the announcement was made. the knighting of sir john  54  will be received with astonishment by opposition politicians.  the liberal democrats said it  beggared belief  he and fellow officials could not remember how leoncia casalme s application for indefinite leave to remain went from mr blunkett s office to the head of the immigration and nationality department. meanwhile  the conservatives accused officials of a  collective failure  of memory. but sir alan budd  who led an inquiry into the affair  said he had no reason to believe anyone involved had deliberately withheld information.  downing street defended the decision to honour both men  with a spokesperson saying:  you have to look at their whole career.  sir john was made permanent secretary in april 2001 following a civil service career which dates back to 1974. he has also worked in the treasury and the department of employment. a department for work and pensions spokeswoman said of mr smith s honour:  the award reflects all that he has achieved in a civil service career  principally in the inland revenue  spanning over 40 years - not just his role as chief executive of the child support agency.   in his career he has personally led a number of successful major change programmes.  mr smith is set to stay on at the csa until march. less controversial will be the knighthoods for derek wanless and mike tomlinson  who undertook major government reviews on health and education respectively. former natwest chief executive mr wanless  57  has delivered not one but two major reports on the nhs. ex-chief inspector of schools mr tomlinson  62  has recommended replacing a-levels and gcses with a new diploma system in a shake-up of the exams system.,politics
1149,council tax rise  reasonable  welsh councils should set their taxes at  reasonable levels  after being given an average funding increase of 6%  says the assembly government.  finance minister sue essex said it was a  good deal  for local government. the £3.2bn settlement includes the  full  £7.4m from the uk treasury announced by chancellor gordon brown. but opposition parties said rebanding of council taxes would mean steep rises. in addition  £13.4m will come from the business support grant - a scheme which enables local authorities to keep part of business rates. she said where spending rises were kept to around 5% she was  confident that councils will be able to set council taxes at reasonable levels.  the welsh local government association (wlga) had said on the eve of the announcement said that  significant  cuts to services may still be unavoidable. after the announcement wlga finance spokesman bob wellington  of torfaen  said it was vital that rises were minimsed.  a limited amount of money has come available but this is not the answer to our problems   said mr wellington.  it is vital that we start now to plan for future years and accept that resources will continue to reduce while pressures on services increase.  on monday  a delegation of north wales councils visited ms essex to lobby for increased funds. ms essex said:  i have listened to the views of local government and council tax payers and recognise the funding pressures and the concerns they have about council tax rises.  i have met a large number of local authorities in recent weeks and i am aware of the pressures on them to provide local services and keep down the level of council tax  particularly for those people to are moving up a band due to the revaluation of domestic properties.  she said council taxes could be kept at reasonable levels   even for those people who have moved up a band .  the settlement includes a rise in the grant to help councils with the most deprived communities and a 16.4% rise in capital expenditure support. ms essex said:  this is a good deal for local government  which will allow the well-managed councils of wales to develop their services and charge reasonable levels of council tax. it is now a matter for council leaders to manage their budgets at a local level.  plaid cymru s local government spokesman dai lloyd called the announcement  hugely disappointing . he said:  wales and its local authorities have been short changed yet again. this is not whinging as the labour assembly government so often claims - it is anger.   this will mean either a massive hike in council tax  massive cuts in services provided by councils  or both.  mike german  leader of the liberal democrats in the assembly  claimed that one in three homes were still likely to face council tax rises due to rebanding. mr german said:  i know from my discussions with welsh liberal democrat council leaders that they are doing their utmost to keep council tax to a minimum. but the random redistribution effect of rebanding...will create a great deal of difficulty.  conservative local government spokesman glyn davies said that for the minister to claim that the majority of council tax payers in wales should see very little change  is taking spin to the very verge of deception . he added:  around a third of welsh households have been re-valued upwards by at least one band and inevitably face increases into double figures.,politics
1155,chancellor rallies labour voters gordon brown has issued a rallying cry to supporters  warning the  stakes are too high  to stay at home or protest vote in the next general election.  the chancellor said the poll - expected to fall on 5 may - would give a  clear and fundamental  choice between labour investment and tory cuts. he told his party s spring conference the tories must not be allowed to win. the conservatives and lib dems insisted that voters faced higher taxes and means-testing under labour.  to a packed audience at gateshead s sage centre  mr brown accused shadow chancellor oliver letwin of plotting cuts that were the equivalent of sacking every teacher  gp and nurse in the country. laying into the conservative s record in government he said:  i give you this promise - with labour  britain will never return to the mistakes of erm and 10% inflation  15% interest rates  £3bn in lost reserves  250 000 repossessed  one million in negative equity and three million unemployed.  never again tory boom and bust.   this will be the central dividing line at the election  between a conservative party taking britain back and planning deep cuts of £35bn in our services  and a labour government taking britain forward  which on a platform of stability will reform and renew our hospitals  schools and public services and  i am proud to say  spend by 2008 £60bn more.  turning to the economy  the chancellor promised to continue economic stability and growth in a third term in power.  he also pledged to continue the fight against child and pensioner poverty. and he promised help to get young people on the property ladder.  my message to the thousands of young couples waiting to obtain their first home is that housing is rightly now at the centre of our coming manifesto   he said.  and the next labour government will match our low mortgage rates with a new first-time buyers  initiative.  in the speech  which prompted a standing ovation  he also promised to end teenage unemployment within the next five years.  he also highlighted plans for 100% debt relief for the world s poorest countries  a national minimum wage for 16 and 17-year-olds  the creation of a network of children s centres and flexibility in maternity leave. responding to the speech  shadow chief secretary to the treasury  george osborne  said:  this was more talk from gordon brown.  we ve heard it all before. instead of talking about the future he kept on talking about the past.  he completely failed to say which taxes he would put up to fill the black hole in his spending plans.  there will be a simple choice at the election - value for money and lower taxes with the conservatives  or more waste and higher taxes under tony blair and gordon brown.   liberal democrat shadow chancellor vince cable warned the picture was not as rosy as mr brown would like to portray it.  for all his trumpeting of labour s management of the economy  gordon brown s record is very mixed   he said.  gordon brown has created a system of massive centralisation and bureaucracy  a system which subjects millions of people to means testing  and a system of taxation which is extremely complex.  for all his positive words  gordon brown is faced with economic problems looming on the horizon  not least the unprecedented levels of personal debt facing the nation.  also in gateshead  the prime minister took questions sent in by e-mail  text message and telephone as part of labour s attempt to engage the public in their campaign. mr blair told the audience he believed the iraq war would have made britain a safer place if its emerging democracy succeeded and that he wanted to bring troops home as soon as possible  but not before the job was done. he also said he wanted to carry on as pm  because i still think that there are big changes our country needs .,politics
1156,bid to cut court witness stress new targets to reduce the stress to victims and witnesses giving evidence in courts in england and wales have been announced by the lord chancellor.  lord falconer wants all crown courts and 90% of magistrates  courts to have facilities to keep witnesses separate from defendants within four years. more video links will also be made available so that witnesses do not have to enter courtrooms. it is part of a five-year plan to help build confidence in the justice system.  ministers say the strategy is aimed at re-balancing the court system towards victims  and increasing the number of offenders brought to justice. launching the department for constitutional affairs  plan  lord falconer said:  one of the top priorities will be a better deal for victims.  the needs and safety of victims will be at the heart of the way trials are managed.   courts  judges  magistrates  prosecutors  police and victim support - all working together to ensure the rights of victims are put first  without compromising the rights of the defendant.  he went on:  giving evidence is a nerve-wracking experience  especially when you re a victim.  yet with a will and with support it can be done.  lord falconer told bbc radio 4 s today programme it was impossible for some elderly people to go to court to give evidence. other witnesses could be intimidated by sitting alongside defendants outside courts.  you are never going to get rid of some element of the trauma of giving evidence   he said.  but you can make people believe that the courts understand the problem  it s not some kind of alien place where they go where they are not thinking about them.   the plan comes as the lord chancellor also considers allowing cameras into courts for the first time since 1925  as long as they were used for cases that did not involve witnesses. another feature of the strategy is constitutional reform  with a government bill to set up a supreme court and a judicial appointments commission returning to the house of lords on tuesday. ministers had proposed getting rid of the title of lord chancellor  but the lords have over-ruled this. lord falconer said it was right for the highest court to be completely distinct from parliament. the person in charge of the court system should not also be speaker of the house of lords  he said  and should be the best person chosen from either house of parliament. what they did  not what they were called  was the critical issue  he added.,politics
