1605,kilroy launches  veritas  party ex-bbc chat show host and east midlands mep robert kilroy-silk said he wanted to  change the face of british politics  as he launched his new party. mr kilroy-silk  who recently quit the uk independence party  said  our country  was being  stolen from us  by mass immigration. he told a london news conference that veritas - latin for  truth  - would avoid the old parties   lies and spin . ukip leader roger knapman says he is glad to see the back of mr kilroy-silk.  mr kilroy-silk promised a  firm but fair  policy on immigration and said they hoped to contest most seats at the forthcoming general election. he said veritas would also announce detailed policies on crime  tax  pensions  health and defence over the next few weeks. labour campaign spokesman fraser kemp said veritas was joining  an already crowded field on the right of british politics . on thursday mr kilroy-silk is due to announce which constituency he will run in at the next general election - that will come amid speculation he has his sights set on defence secretary geoff hoon s ashfield seat. he was joined in the new venture by one of ukip s two london assembly members  damien hockney who is now veritas  deputy leader. ukip s chairman petrina holdsworth has said the group will just be a parody of the party the men have left.  mr kilroy-silk quit ukip last week after months of tension as he vied unsuccessfully for the leadership of that party. he said he was ashamed to be a member of a ukip whose leadership had  gone awol  after the great opportunity offered by its third place at last june s european elections.  while ukip has turned its back on the british people  i shall not   he said.  i will be standing at the next general election. i shall be leading a vigorous campaign for the causes i believe in.  and  unlike the old parties  we shall be honest  open and straight.   mr hockney also left ukip saying mr kilroy-silk would  deliver better  as the leader of a eurosceptic party. a spokesman for ukip called on mr hockney to quit the london assembly. the party asserts that mr hockney  has a moral obligation  if not a legal one  to stand down. its leader  roger knapman  has said he is glad to see the back of mr kilroy-silk.  he has remarkable ability to influence people but  sadly  after the [european] election it became clear that he was more interested in the robert kilroy-silk party than the uk independence party so it was nice knowing him  now  goodbye    he said. ukip officials also argue mr kilroy-silk has not been  straightforward  in attacking the party he once wanted to lead.  veritas  it s the bnp in an expensive suit!  it s all well and good robert kilroy-silk claiming  that  veritas  is a party that doesn t believe in  lies and spin   but the truth of the matter is  its completely useless  due to proportional representation  there is no chance that  veritas  will have any chance in claiming power  and change the two-horse race trend. in my opinion this is just a publicity stunt which has just been used as a smoke-screen for his anti-islamism slurs which got him sacked from the television.  i think that his views regarding immigration are shared by many. it really is time that the uk government ceased to be a paper tiger on this issue. in addition as an ashfield constituent i would be more than interested in kilroy -silk opposing geoff hoon!!  good to see the parties of the right splintering in the way the parties of the left have always done. let s hope kilroy-silk  ukip and the euro-sceptic wing of the tory party all fade further into obscurity so we can have some truth in the debate about europe. we benefit enormously from our membership of the eu  we need to be at the heart of europe  leading it and driving it to where we as a country want to go  not running away from it.  all mouth and trousers. a clown. trouble is  any votes he collects may just end up helping new labour into a third term.  whatever kilroy-silk and ukip do  none of their anti-european policies have any relevance outside middle england. this new party might gain support from right-wing england  but will have little impact in wales or scotland.  hopefully this all this fighting within euro-sceptic parties will allow them to slip out of the way and get people voting for real political parties which address more than one issue. england needs europe to survive and as soon as people realise this the better  we can t rely on the usa forever!  at last an impetus for increasing the likely 40% turn out for the election. the electorate is disillusioned with british politics. kilroy has one agenda - the uk - and i ll be voting for him.  both ukip and rk-s are representatives of small-mindedness and a lack of vision for the whole of humankind. the interests of humanity and the world lie so much beyond the scope of these people s bickering that who  in the overall scheme of things  really cares about their petty tiff   many people believe you kilroy. you may even believe yourself but switching horses midstream and then bad mouthing the steed that got you halfway seriously diminishes your credibility.  the very idea of political parties born out of such negative feelings as euroscepticism or british supremacy is nauseating. one can only hope the public recognise these extremists for what they are and shun them at the polls.  i ve always thought that kilroy-silk was a self-publicising  egotist and this news does absolutely nothing to alter my opinion.  brilliant  about time this country had a plausible party!  having seen the recent bbc 3 documentary and witnessed the thoroughly disgraceful chauvinistic behaviour of a number of senior ukip figures i can well understand why kilroy-silk feels embarrassed to be associated with such people. hopefully the ukip members who are interested in the political debate will support his action.  fantastic news. pro-europeans now have far less to worry about from the right. the conservatives are as confused as they have been since the mid-1990s  and the extreme anti-europeans are fracturing themselves into splinter groups that split any votes they might get in local  european and general elections. robert kilroy-silk s ego and vanity are his own (and his supporters ) worst enemy.  as a euro-enthusiast i could not be more delighted by kilroy-silk s behaviour. he took a party that was just building up a head of steam  and having exposed it to ridicule by attempting a coup-d etat  he is now setting about the serious business of dividing it in two. the closer to straight-down-the-middle the better  as far as i am concerned  but in any eventuality  the two sceptic parties will exhaust their energies fighting each other.  if every politician with ambitions to lead their party resorted to forming their own for that purpose  we d have ballot papers a mile long! you ve got to hand it to kilroy-silk for his sheer arrogance and supreme self-belief.  whilst not being a great fan of kilroy i do agree with his comments about the ukip leadership  and like him i am also leaving ukip. i believe countless opportunities have been lost to discredit the eu and to show our people what belonging to the eu really means. the eu s comments last week about michael howard s plans to reform immigration show how little we govern our own country when they can turn round and say immigration is a matter for the eu and not individual member states. the sooner we leave this corrupt super-state the better  does anyone else think that it is ironic that euro-sceptic kilroy-silk has used a latin name for his new party  rather than a  good old british  name  is this indicative of the man - contradictory  vain and pompous   i think mr kilroy-silk has got a very good point. british politics has become too pc and as a result has no straight talking honest strong politicians. they are all interested in their own careers and not the people who put them in power. as a result i feel our democracy is being abused and i want it stopped. if mr kilroy-silk lives up to half his promises he will get my vote.  honestly  who really cares  man with tan leaves party with no plan  to set up party with no idea.  as one of kilroy-silk s east midlands constituents i hope those who voted for him are proud to have been taken in by such charming vacuity. i feel insulted by having him represent me in the european parliament.  ukip tried hard to accommodate robert kilroy silk  but he made it clear that only control of it would satisfy him. someone so keen on complete control was bound to fall foul of ukip s democratic nature.  kilroy is an able communicator and a capable politician  in exactly the way those who lead ukip are not. he tried to make it work  but they didn t seem to want to grow up. he was left in the position of having to defend their gaffes to the media. this new party seems a logical next step for kilroy. good luck to the man  i say.  oh please! this is an amusing irrelevance. there is absolutely no chance of either of these parties communicating a sensible and constructive  eurosceptic  argument. they will play a key part in winning the country round to the idea of a reformed  more democratic  more dynamic europe union. future generations will thank him for his ridiculousness.  the refreshing thing about robert is that he is open  honest and straight. what other politician can claim this. i have a suspicion that he talks for a larger part of the electorate that his critics would like. i shall be voting for him.  the electorate of the east midlands voted not for kilroy-silk but for the ukip. kilroy-silk was made an mep because of his position on the ukip s party list. he has no mandate to represent the area and should resign from the european parliament.  i wouldn t write off kilroy-silk. while he s a clown and a one man band at the moment  he s a populist and that s always dangerous.the man clearly has an enormous ego and looking at our current political masters  that seems to be one of the factors in success.  good luck to kilroy though i think he is doing more harm than good for both his new party and ukip because their vote base is not strong enough for both parties to be successful and at the moment ukip have the upper hand while veritas are starting from square one and fighting a somewhat uphill battle.  the man i once found cringe worthy on day time tv  could well turn out to be my country s knight in shining armour. he expresses views which are now more than common amongst society today - but people are almost too scared to express them. kilroy silk has secured my vote  and many more like me. what s more  i look forward to the day when he claims victory  wrecks the eu  and rescues my great nation... without a hair out of place and his tan as perfect as ever!  great stuff. the longer the uk dithers over europe  the richer we in ireland become  as the only english-speaking country fully committed to europe. oh and send us over those hard-working immigrants - our economy needs them.  this is just what the europhiles pray for. as the main eurosceptic party  ukip should try to resolve its differences with kilroy to show a united front and give the uk public a serious political voice against europe. having multiple parties with the same view point just splits the vote further.  thank goodness that kilroy-silk has gone - now ukip at least has a chance in the election!  it is very sad to see the cause of britain regaining its proper relationship with europe damaged by this split within ukip. robert kilroy-silk could have a lot to offer. instead we have a split party and a damaged cause. under the present electoral system  people must work together  and small parties have no hope of representation. last summer  ukip achieved a major advance  partly and only partly due to kilroy-silk. it is a great shame this has been dissipated in in-fighting.  ukip has a wide platform of policies  not just withdrawal from the eu. this kilroy-silk conveniently ignores in the comments surrounding the launch of his own party. neither the english democrats nor the new party were interested in letting him join them and take over their leadership speaks volumes. veritas is the beginning of the end for kilroy-silk.  if he believes in truth and democracy then he and the two assembly members should resign and force a by-elections to stand on their own platform rather than this backdoor approach to politics of being elected for one party then defecting to another.  so ukip was good enough for him to lead  not good enough for him to follow!  interesting that a party committed to plain speaking should have a latin name!  every opinion poll points to an overwhelming anti-europe feeling in this country. kilroy-silk could be on the verge of something huge if he can broaden his appeal beyond this one issue. he is an extremely able communicator with years of political experience. we wants quality schools  top hospitals  clean and efficient public transport  punishments that fit the crime  limited asylum  a purge on bureaucracy and less taxes. it needs courage and honesty  two qualities sadly lacking in our politicians. kilroy-silk may just have those very qualities. recruit the right colleagues  robert  and your time may have come!  well if you cannot get enough limelight being an ordinary mp then go out and start up your own party. it s all flash and no real policy here  let s hope this is the start of both ukip and kilroy-silk slipping into obscurity.  veritas  the name will doom it. but perhaps i am wrong for surely all modern schoolchildren will understand it since they do still learn latin in the classroom do they not  the whole essence of what rks represents is euroscepticism  so explain to me how the too-twee label of veritas symbolises that,politics
1609,final hunts held as ban looms hunts in england and wales have begun on the last day that hunting with dogs is legal  with more due out later.  thousands of supporters are expected to turn out at more than 250 meets  many of which have altered their normal schedules to be out on a thursday. the ban on hunting with dogs comes into effect from 0001 gmt on friday. the countryside alliance had its latest legal bid to block the ban thwarted on wednesday when the appeal court ruled the hunting act was lawful.  but the group says hunting will continue in some form after the ban comes in  with hunts expected to test the new law to its limits. others are expected to defy the ban by continuing to hunt illegally.  anti-hunt organisations  for whom the ban is the culmination of years of campaigning  say they hope most will stay within the law. mike hobday  of the league against cruel sports  told bbc news:  we ve long urged them to go drag hunting - to follow an artificial scent - and that is what we hope they do.  but if they continue to chase foxes  to chase wild mammals around the countryside  that s against the law and we re confident they ll be brought to justice.  at the headquarters of quorn hunt in leicestershire  feelings were running high as hunt enthusiasts prepared for their final legal hunt. bbc correspondent sarah mukherjee said hunt supporters were in tears.  she said many people did not share the countryside alliance s optimism that hunting would be able to continue. farmer geoff brooks  a senior member of the quorn hunt  told bbc news people s lives  revolved around hunting . he described the ban as  ridiculous  and  badly thought out  but said it would be hard for most people to defy it as they would not want to risk their incomes by getting a criminal record.  at the court of appeal on wednesday  the countryside alliance failed in its attempt to have the hunting act ruled invalid. but it says the ban is unenforceable because the law is unclear and impossible to police.  the alliance says hunt supporters will go out and test this law to its limits on saturday. the league against cruel sports and the rspca say they will monitor hunts and assist police in bringing prosecutions. the association of chief police officers has issued guidance to forces on how to deal with the new rules. a spokesman said:  basically  it s not going to be police officers chasing about in cars across fields  it will be based on intelligence and information received as well.  the decision on how to police individual hunts will be left to local forces  with more officers sent to hunts where disruption is expected. he said police would consider evidence submitted by anti-hunt organisations on its merits.,politics
1613,blair rejects tory terror offer tony blair has rejected a conservative compromise offer that could have eased the passage of anti-terror legislation.  the tories wanted a sunset clause inserted in the anti-terrorism bill that would have forced ministers to revisit it in november. mr blair said the bill  which brings in house arrest for terror suspects  had time limiting safeguards already. the tories say they will vote against it unless changes they want are agreed. the lib dems also oppose the plans.  the government has already given way over the role of judges in house arrest cases.  mr blair s refusal to accept the tories  sunset clause proposals means that the government faces concerted opposition from all sides in the lords. peers begin three days of detailed deliberation on the bill on thursday. the bill proposes  control orders   which as well as placing terrorism suspects under house arrest could mean curfews  tagging or bans on telephone and internet use. these would replace current powers to detain foreign terror suspects without trial  which the law lords have ruled against as a breach of human rights.  the tories want judicial oversight of all control orders  not just house arrest. shadow home secretary david davis told bbc radio four s the world at one his primary concern was potential miscarriages of justice. he said if someone was wrongly given a control order it would act as a  recruiting sergeant  for terrorists. he went on to say:  if we don t get the amendments we regard as essential  including the sunset clause  we will vote against the bill.  in the commons  mr howard said it would be  far better if the whole of the legislation was subject to a sunset clause so parliament could consider it all in a proper way instead of it being ramrodded through . mr blair said the house arrest powers were already going to be subject to a sunset clause because it was annually renewable.  the second  less stringent  type of control orders would be subject to a court appeal within 14 days and there would be a three-monthly report on their use by  an eminent and independent person .  i believe (the new powers) are a proper balance between the civil liberties of the subject and the necessary national security of this country that i will not put at risk   said mr blair. the lib dems plan to oppose the bill in the lords on thursday. lib dem home affairs spokesman mark oaten said:  there s a lot of talking left. i would be uneasy about supporting a very bad bill even if it was just for eight months.  a spokeswoman for human rights watch said it was a  basic principle  that people should only be punished after a fair trial. she added:  having a judge impose those punishments without a trial does not sanitise them either.,politics
1651,brown s poll campaign move denied the government has denied reports that gordon brown is preparing to oust alan milburn as labour s election supremo.  work and pensions minister alan johnson said it was wrong to suggest the chancellor would usurp mr milburn  adding they would  work as a team . a report in the sunday business claimed mr brown has been asked to take charge of media strategy  while mr milburn would move to a behind-the-scenes role. labour has always maintained mr brown would have a central campaign role.  but many labour backbenchers are said to be dissatisfied with the way election campaigning has gone and have said they wanted to see the chancellor take a bigger role. some commentators say the tories have grasped the initiative  putting labour on the back foot  having to respond to conservative policy announcements. these claims follow various opinion polls which suggest the tories have been gaining on labour. party strategists are believed to want to bring mr brown to centre-stage having seen support rise  in private polling  after his budget last week. but another report in the sunday telegraph claims mr milburn is unwilling to allow any new role for the chancellor to come at his expense. mr johnson told bbc news:  gordon brown will play a central role in any election campaign.  they were wrong when they said milburn was ousting brown and they re wrong now if they are saying brown is ousting milburn. we work as a team.  mr milburn has repeatedly said the chancellor was key to the campaign and dismissed claims of a rift. neither downing street nor the labour party would comment directly on the reports.,politics
1661,debate needed  on donations cap a cap on donations to political parties should not be introduced yet  the elections watchdog has said.  fears that big donors can buy political favours have sparked calls for a limit. in a new report  the electoral commission says it is worth debating a £10 000 cap for the future but now is not the right time to introduce it. it also says there should be more state funding for political parties and candidates should be able to spend more on election campaigning.  there were almost £68m in reported donations to political parties in 2001  2002 and 2003  with nearly £12m of them from individual gifts worth more than £1m. the rules have already been changed so the public can see who gives how much to the parties but the report says there are still public suspicions. the commission says capping donations would mean taxpayers giving parties more cash - something which would first have to be acceptable to the public and shown to work.  while we are not in principle opposed to the introduction of a donation cap  we do not believe that such a major departure from the existing system now would be sensible   says its report. if there was to be a cap  it should be £10 000 - a small enough amount to make a difference but which would have banned £56m in donations between 2001 and 2003.  even without changes the commission does urge political parties to seek out more small-scale donations and suggests there should be income tax relief for gifts under £200. it also suggests increasing state funding for parties to £3m so help can be extended to all parties with at least two members in the house of commons  european parliament  scottish parliament  welsh assembly or northern ireland assembly. and it suggests new ways of boosting election campaigning  seen as a way of improving voter turnout. all local election candidates should be entitled to a free mailshot for campaign leaflets  says the watchdog. and there should be a shift in the amount of money allowed to be spent at elections from a national level to a local level to help politicians engage better with voters.  the report suggests doubling the money which can be spent by candidates  while cutting national spending limits from £20m to £15m. the commission also says the spending limits for general elections should cover the four months before the poll - as happens with other elections. electoral commission chairman sam younger said:  there is no doubt that political parties have a vital role to play in maintaining the health of our democracy and for this they need to be adequately resourced.  our research has shown that people want to be more informed about party politics and that they want politicians to be more visible and accessible.  the public are reluctant for the state to fund parties but at the same time are unhappy with large private donations.  he called for a wider public debate on party funding to find the consensus needed for radical changes to the current system.,politics
1670,mps issued with blackberry threat mps will be thrown out of the commons if they use blackberries in the chamber speaker michael martin has ruled.  the £200 handheld computers can be used as a phone  pager or to send e-mails. the devices gained new prominence this week after alastair campbell used his to accidentally send an expletive-laden message to a newsnight journalist. mr martin revealed some mps had been using their blackberries during debates and he also cautioned members against using hidden earpieces.  the use of electronic devices in the commons chamber has long been frowned on. the sound of a mobile phone or a pager can result in a strong rebuke from either the speaker or his deputies. the speaker chairs debates in the commons and is charged with ensuring order in the chamber and enforcing rules and conventions of the house. he or she is always an mp chosen by colleagues who  once nominated  gives up all party political allegiances.,politics
