614,student  fee factor  played down a rise has been recorded in the number of students from south of the border applying to universities in scotland.  however  lifelong learning minister jim wallace said that this would not result in scottish students missing out. applications from england and wales rose by 17% between january 2005 and the previous year  up 23 600 to 27 700. fears had been expressed that a flood of  fee refugees  would try to avoid top-up fees of up to £3 000 a year being introduced in england. in june last year  mr wallace announced proposals to increase tuition fees for english students studying in scotland by £2 000 in an attempt to prevent a cross-border flood  although no figure has yet been agreed. legislation to introduce the top-up fees in england is not due to take effect until autumn 2006 and students who start before then will not have to pay additional fees at all.  the figures were made public on thursday by admissions service ucas. universities scotland  which represents university principals  claimed that an increase in applications did not amount to scottish students being squeezed out. director  david caldwell  said some students could be applying in an attempt to avoid the possible increase in annual fees at english universities  but this was not a major factor. he told bbc radio scotland s good morning scotland programme:  the reason people are opting for scottish universities is that they are perceived as being of very high quality  they offer very attractive courses and scotland is seen as a very attractive place to study.   they know that when they take up their studies in 2006 they will be hit by top-up fees if they are going to a university in england and that may be part of the reason why the numbers coming to scotland are so inflated.  however  it does not mean that we will see thousands of additional students from england studying here.  mr wallace agreed and said the figures had to be looked at in context. he explained that when applications were translated into acceptances  the number was not huge - an additional figure of about 200.  also  the picture was further blurred by the fact that applications from wales  where there are no plans for top-up fees  have also risen  by 19%. mr wallace said:  accepting students from all parts of the world does show the high regard in which scottish higher education is held  not just in britain.  we want to make sure that when students are making their choice  they do so on the nature of the course and not because they are under some sort of financial pressure to go to scotland.  we do not want to have a situation where it becomes impossible for scottish students to get places at scottish universities because we are seen as the cheap option.  very often the quality of the university experience is enhanced by the fact there are students coming from a wide range of backgrounds so it would be wrong to go the other way and start excluding students.,politics
622,ministers  naive  over phone-taps the government is being naive by refusing to allow phone-tap evidence in court  a senior eu politician says.  javier solana  eu foreign policy chief  says phone-tap evidence works in the courts of other european countries. human rights groups  top police officers and many mps say allowing the evidence would remove the need to detain terror suspects without charge. but home secretary charles clarke says the evidence would not make much difference to these cases. mr solana told itv1 s jonathan dimbleby programme:  [phone-tap evidence in court] works  it is normal that it is done  it would be naive not to do it.  it would be naive not to use this technological thing that we have at our disposal.  mr solana s comments come the day after sir ian blair  the newly-appointed metropolitan police commissioner  said he was in favour of phone-tap evidence.  under the anti-terrorism crimes and security act 2001  foreign terror suspects can be detained in british jails without trial or charge. several suspects have been detained under these powers because evidence against them was deemed too sensitive to be heard in court.  some of this evidence is believed to be telephone intercepts. human rights group liberty has argued that if intercept evidence could be heard  these detainees could be brought to trial. but critics of phone-tap trials say the evidence is often weak and can expose the methods of the security services. the home secretary says intercepts would not make much difference because cases against terror suspects frequently rely on other kinds of surveillance. but mr clarke has been forced to change the regime of detention without trial after law lords ruled it illegal. he has opted for a system of  control orders  whereby suspects  both british and foreign  can be held under house arrest or surveillance. these orders will again involve a uk opt-out of parts of the european convention on human rights. while accepting that people  have to be prepared  for a possible terrorist attack  mr solana said he had  qualms  about the home secretary s new plans.  we have to fight terrorism with all our means  but not so far as to change our way of life   he said.,politics
623,voters  don t trust politicians  eight out of 10 voters do not trust politicians to tell the truth  a new poll conducted for the bbc suggests.  and 87% of the 1 000 adults quizzed by icm for bbc news 24 said politicians did not deliver what they promised. the poll comes after foreign secretary jack straw predicted trust would be  the key choice  at the next election. both the tories and the lib dems are keen to emphasise a perceived lack of trust in tony blair  following his claims over iraqi weapons.  but according to the bbc poll  61% said the issue of trust made no difference to whether or not they would vote at the next election  widely expected on 5 may. the poll also looked at what lay behind the lack of trust in politicians. some 87% said politicians did not keep the promises they made before elections  while 92% said they never gave  a straight answer . just under three-quarters of respondents (73%) said politicians had shown themselves to be dishonest too often.  mr straw told activists in blackburn on thursday that voters would have to decide at the next election which party  best deserves  their  future trust .  that in the end is the key choice at the next election.   he acknowledged that the public had lost faith in labour  but suggested it could persuade people to  reinvest their trust with us  if the party could overcome tory attempts to spread cynicism in politics. the conservatives are keen to highlight the trust issue. during his response to gordon brown s budget statement on tuesday  michael howard compared the chancellor s figures to the prime minister s claims about iraq s weapons of mass destruction.  the lib dems are also keen to highlight the trust issue  with charles kennedy has claiming voters had a  fundamental lack of trust in the prime minister . and the green party unveiled a billboard opposite the palace of westminster accusing the government of lying over the iraq war.  former education secretary estelle morris told bbc news 24 that there was a  real problem of trust  between the public and the politicians. she said she did not feel her own colleagues could be trusted  but suggested the  three-cornered relationship  between the press  politicians and the public had a hand in the issue. the public was often turned off by sitting on the sidelines in  the battle of words  between the politician and the journalist  she added. lib dem foreign affairs spokesman menzies campbell said the iraq war had hit trust in politicians hard.  issues of war and peace  life and death do have a very damaging effect on the credibility of politicians . martin bell  who won the tatton seat from tory neil hamilton on anti-corruption platform  said politicians often failed to see themselves as others did.  we need public figures we trust to tell the truth and who can see themselves as others see them.,politics
637,end bush  denial  blair tells eu tony blair is urging european leaders to wake up from their  state of denial  over president bush s re-election.   america has spoken. the rest of the world should listen   the prime minister said in an interview with the times newspaper  published on friday. mr blair is at a summit in brussels  where iraq and european justice and immigration plans are on the agenda. french president jacques chirac reacted to his warning by saying europe instead needed to reinforce its own unity. mr blair has probably been closer to president bush than any other european leader.  he said some people were in  a sort of state of denial  about the us election result but predicted a more  receptive mood  would emerge soon. america needed to listen to the world too  he said.  the fact is that president bush is there for four years. he is there because the american people have chosen him   he argued. he also made clear he intended to take seriously what he perceives as his role in bringing the two continents together.  britain was  uniquely placed  to make out the common ground because of its strong alliance with the us  he suggested. he admitted he had gone to bed at 2230gmt  well before the american polls closed  thinking mr kerry might have won. he woke up at 0530gmt to discover mr bush had won but declined to say if he was pleased with the eventual result. his words about president bush met a cool reception from jacques chirac. the french president told reporters:  europe today has more than ever the need  the necessity  to reinforce itself and its dynamism and unity.  that is the goal of the constitution in a world that is more multi-polar than ever.   mr chirac will miss an address to the summit from iraqi interim leader iyad allawi  who this week criticised nations which took a  spectator  role to iraq s reconstruction. mr chirac denied there was any snub - he is going to a memorial service for the united arab emirates  late leader and says he would be happy to meet mr allawi. he also signed a communiqu&#233; stressing the eu s commitment to securing a stable and unified iraq. the eu also confirmed a new $21m aid package. the communiqu&#233; congratulated president bush on his victory and stressed the importance of good transatlantic relations. the summit is also expected to agree changes to streamline european asylum and immigration decisions. mr blair recently said the uk would only participate in eu-wide measures where it was in uk interests but the tories say he is surrendering a key veto. the meeting will also assess progress on the economic reform plans agreed in lisbon in 2000 to make europe more competitive.,politics
639,could rivalry overshadow election  tony blair and gordon brown are desperately trying to stuff the genie of their rivalry back into the bottle.  along with any number of senior cabinet colleagues  they are insisting their only job is to win the next election and govern in the best interests of britain. it is a message they are aiming directly at their backbenchers who are becoming irritated and even unnerved by the continuing claims and counter claims surrounding this alleged rift. ian gibson  for example  urged the two men to stop squabbling  declaring:  for goodness sake  sometimes you have to rise above petulance and make sure that you do your job as effectively as you can.  those with slim majorities are particularly fearful that the rift could hit their own hopes of re-election. tony blair will seek to reassure labour mps on monday evening at their first meeting of the new year at westminster - a behind-closed doors meeting which gordon brown is thought likely to also attend to show unity.  meanwhile the likes of health secretary john reid and labour peer lord haskins are warning of the electoral dangers of allowing this soap opera to continue. and they have both warned the rival camps to stop spreading the poison. lord haskins even suggested mr blair should reinstate mr brown as the central figure in the election planning.  but this particular genie is unusually reluctant to return to captivity and many fear it is simply too late to repair the damage. they believe they will be fighting the next election with the sounds of open warfare between the two men ringing in their ears. and it matters little whether the rift is real or  as some try to suggest  simply the product of newspaper headlines and westminster gossip. few in westminster actually believe that  simply because the evidence appears to contradict it.  for example  the weekend s attempts by both men to play down the divisions failed to do the trick. even as they were both insisting on their unity of purpose and claiming they would not be swayed by newspaper stories  they still managed to stir the speculation with their comments.  mr blair talked about the  new  labour manifesto - a move which seemed calculated to irritate the chancellor  who has long rejected the label. and mr brown pointedly refused to deny claims the prime minister had reneged on a deal to hand him the premiership last year. that claim was repeated in robert peston s book  a book which amply demonstrates this corrosive downing street soap opera is nowhere near its final act.  for his part  mr brown insists his only motivation was to get labour re-elected.  the trouble is  both men have fallen short of offering simple  straightforward denials of the central claims. so they have both been accused of actually making matters worse by feeding the speculation with their own behaviour. the first thing to be said is that these suggestions have not come from nowhere. they started with and are sustained by  friends  of the two men. one only had to listen to the chancellor s friend and former spin chief charlie whelan last week to understand that there is a real anger from this camp at the prime minister s apparent attempts to confound mr brown s leadership ambitions. but it is not just public pronouncements from ex-aides.  there are whispered briefings to selected journalists from both sides. it is no secret in westminster  for example  that downing street believes the chancellor is indulging in a mammoth sulk and acting in a petty and deliberately provocative manner.  then there are the actions of the men themselves. gordon brown sets out what is seen as a rival manifesto then appears to embark on his own personal campaign. the prime minister responds by scheduling his monthly press conference to clash with a keynote speech by the chancellor. meanwhile large numbers of backbench mps insist voters are either entirely uninterested in the chatter  which they believe is a media-only obsession  or that they fear for the efficient running of a government beset by such rivalry. either way  there is universal agreement that if this goes on through the general election it can only do the labour party serious damage. there are signs that the two men appreciate the dangers and both want to put a lid on all the speculation. but with probably only four months to the next election  that looks like being a particularly difficult trick to pull off.,politics
641,conservative backing for id cards the tories are to back controversial government plans to introduce id cards.  the shadow cabinet revealed its support ahead of next week s commons vote on a bill to introduce compulsory id. the decision follows a  tough meeting  where some senior tories argued vociferously against the move  party sources told the bbc. the bill  which ministers claim will tackle crime  terrorism and illegal immigration  is expected to be opposed by the liberal democrats.  they have said the scheme is  deeply flawed  and a waste of money. sources within the conservative party told the bbc michael howard has always been in favour of id cards  and tried to introduce them when he was home secretary. the party has been  agnostic  on the issue until now but had now decided to come off the fence  the tory source said. despite giving their backing to id cards  the conservatives insisted they would hold ministers to account over the precise purpose of the scheme.  they said they would also press labour over whether objectives could be met and whether the home office would deliver them. and they pledged to assess the cost effectiveness of id cards and whether people s privacy would be properly protected.  it is important to remember that this bill will take a decade to come into full effect   a spokesman said.  it will do nothing to solve the immediate problems of rising crime and uncontrolled immigration.   lib dem home affairs spokesman mark oaten said:  this has all the signs of michael howard overruling colleagues  concerns over id cards.  the tories should have the courage to try and change public opinion not follow it.  the new chairman of the bar council  guy mansfield qc warned there was a real risk that people on the  margins of society  would be driven into the hands of extremists.  what is going to happen to young asian men when there has been a bomb gone off somewhere  they are going to be stopped. if they haven t [id cards] they are going to be detained.,politics
648,straw backs ending china embargo uk foreign secretary jack straw has defended plans to end the european union s arms embargo on china  despite opposition from the us and japan.  mr straw  visiting beijing  noted arms embargoes applied to china  burma and zimbabwe but not to north korea  which he said had a terrible rights record. the eu imposed its arms ban on china in 1989 after troops opened fire on protestors in tiananmen square. mr straw also signed a deal on china-uk tourism. it is expected this would increase the number of chinese tourists by 40 000 per year  providing $120m in revenue. china has in the past said it sees the weapons ban as politically driven  and does not want it lifted in order to buy more weapons. mr straw  speaking at a joint news conference with chinese foreign minister li zhaoxing  stressed this point.  the result of any decision [to lift the arms embargo] should not be an increase in arms exports from european union member states to china  either in quantitative or qualitative terms   mr straw said. earlier this week he said he expected the embargo to be lifted within six months.  but mr straw faces tough opposition to the move. tory foreign affairs spokesman michael ancram said lifting the arms embargo would be  irresponsible  and would damage britain s relations with the us. he said mr straw was  naive beyond belief  if he accepted china s claim it does not want the ban lifted in order to buy weapons. the french want the embargo lifted because they want to sell arms to china; the chinese want it lifted because they want to buy arms and battlefield technology from europe.  when he was in tokyo earlier this week  japanese foreign minister nobutaka machimura told the british minister that his plan to remove the embargo was   a worrying issue that concerns the security and environment of not only japan  but also east asia overall . washington argues that if the embargo is lifted  it could lead to a buying spree for arms that china could use to threaten its diplomatic rival taiwan. beijing says taiwan is part of chinese territory and wants to unite it with the mainland  by force if necessary. the us is bound by law to help taiwan defend itself. washington has also voiced concern that the human rights conditions in china have not improved enough to merit an end to the embargo. it is an issue raised by human rights groups too. brad adams  from the uk s human rights watch  said:  this is a huge political signal from europe that they are willing to forget about tiananmen square.  but mr straw insisted the eu s code of conduct on arms exports meant tough criteria on human rights still had to be met if the embargo was lifted.,politics
655,asylum children to face returns the uk government is planning to return asylum seeker children without parents to albania.  the trial scheme  which could start in weeks  may be extended to apply to children from other countries. children s charities have reacted with alarm  saying the policy amounts to forcible removal and may not guarantee the safety of those affected. but the home office says it may be in the children s best interests if it reunites them with their communities.  the pilot  included in the government s five-year immigration plan  aims to return unaccompanied asylum-seeking children from albania who have failed in their asylum claims.  since 2002  at least 9 000 under-18s have arrived in the uk to seek asylum without other family members. these children automatically become the responsibility of social services. up to now  ministers have held back from final removal orders against unaccompanied children until after they are legally adults at 18. at least a dozen albanian-born teenagers are thought to have been identified for return  according to sources  although there is no public confirmation of numbers. those selected could either be returned to their families  should they be traced  or placed in the care of other albanian authorities. separate negotiations to establish a family tracing and returns scheme are believed to be underway with another country.  under the 1989 children act  public bodies have a duty to act in the  best interest  of a child in their care. laura brownlees of save the children said there were grave concerns  not least because of the well-documented trafficking of children into crime and prostitution in albania.   if children are going to be returned then there should be proper assessments and decisions on a case by case basis   she said.  we do not think there are structures in place [to receive returning children in albania].  if these decisions are not in the best interests of the child  then that is a forced removal because the child will not have any choice in the final decision.  in its five-year immigration plan  announced on tuesday  the government said it was addressing  the difficult issue  of returning unaccompanied asylum seeking children. a spokesman for the home office said it was wholly wrong to suggest that the plan was to return children  and leave them to rot .  we are developing a returns programme for unaccompanied asylum-seeking children whose asylum and humanitarian protection claims have been refused   said the spokesman.  we have been exploring how we can establish reception and longer-term care arrangements in countries of origin and believe that it s possible to return children in a way that is in their best interests and is safe and sustainable.   we do not believe that it is right  or in keeping with children s legislation  that children who can return should remain in the uk indefinitely separated from their families and communities.  the spokesman stressed the uk would abide by its international human rights obligations. only those children who could be provided with a carefully planned reintegration package would be returned  he said. but andrew hogg  spokesman for the medical foundation for the care of victims of torture  said ministers had so far failed to reassure agencies.  from what is so far known  we strongly oppose the scheme because the welfare and best interests of the child will not properly be taken into account   said mr hogg.  in albania particularly there is no statutory child care or protection structure.  the medical foundation has many serious concerns  including the assessment process for suitability for return  the degrading of best interests of the child principles and of child welfare  and the lack of safeguards in the chosen countries.  a spokesman for the albanian embassy in london said it was the first it had heard of a scheme  but did not rule out that there had been an agreement between the two countries.,politics
