short_description,Y
Secretary of Education Betsy Devos says that students in the US attend schools that are a “mundane malaise that dampens dreams,1
"A few years ago, while in my late 40s, I was trying to impress upon my students the importance of “living in the moment.” In",1
"In conjunction with their 4th annual conference in Oakland, California on October 14-15, the Network for Public Education",1
It looks less like altruism and more like opportunism.,1
Her words struck a chord with me and made me realize my passion for my job.,1
"Good morning, children, and welcome to today’s classes in the Mr. Edbrand Fifth Grade Room, brought to you by Exxon here",1
Editorial internships often seem like the only logical job for an aspiring journalist to pick up in college ― or at least,1
"The mandated curriculum, we decided, would never be enough to encourage our students to love reading and writing.",1
There is a force out there that’s working to destroy our profession.,1
Donald Trump and Education Secretary Betsy DeVos champion the privatization of public education in the United States. They,1
"During his campaign for president, in September 2016, Donald Trump said that he planned to devote $20 billion toward an education",1
"BOOK REVIEW: Inside our Schools: Teachers on the failure and future of education reform, edited by Brett Murphy. Harvard",1
All sides of our education civil war need to see our internal battles within the context of the travesties recounted in this amazing special magazine issue.,1
"Many of our students have to get up every day and go to a place where all day long, they are required to do things that they are bad at.",1
"“Waiting for Superman” (2010) was a propaganda movie promoting charter schools. I call this blog “Waiting for Evidence,” because",1
There is very little evidence that wrongful accusation is even a problem.,1
I’m having a little trouble trying to figure out why you chose to go into education.,1
"By Carolyn Jones Undocumented immigrant students will remain welcome at California colleges and universities, regardless",1
"On August 31, 2017, Illinois Governor Bruce Rauner signed into law a bill that includes a $75-million provision for “tax",1
"It is the beginning of the school year. Periodically I am asked, somewhat suspiciously, “What would you do if educational",1
Ten points to Gryffindor.,1
"By Jane Greengold Stevens and Danielle Tarantolo, Co-Directors of Special Litigation Unit, New York Legal Assistance Group",1
Politically influential charter school operators in the State of New York are on the verge of pushing through an administrative,1
"By Theresa Harrington While California legislators debate a bill to ban secondary schools from starting before 8:30 a.m., a",1
"By Gil G. Noam, EdD Whether jumping through sprinklers at city parks, chasing soccer balls at camp, or kayaking with family",1
"On July 6, attorneys general from 18 states and Washington, D.C. filed suit against Education Secretary Besty DeVos. This",1
Starting UCLA QB Josh Rosen gave an interview to Bleacher Report where he claimed that football and school don’t go together.,1
"Today, my first friend turns 50 years old.  We were born only a few weeks apart, in the month of August 1967, and we grew",1
"As a child, I remember heading back to school and hearing whispered rumors about the teachers in my new grade, other kids",1
Success Academy charter school network CEO Eva Moskowitz called a press conference last week to claim success. According,1
"Summer is waning, and college students across America are gearing up for the new semester. While many will stress over course",1
"As teachers get ready to start the school year, I want to suggest that they start engaging their students in conversations",1
Teachers are alternately characterized in modern culture as “those who can’t do” and as indispensable key players in the,1
Netflix subscribers may have already heard the news ― Disney is going to pull their content from the online media empire,1
"In 2003, the Louisiana legislature created the state-run Recovery School District (RSD), which pre-Katrina was comprised",1
"We are all still reeling from the appalling events in Charlottesville last week, sparked by the white nationalist march that",1
"When Dwayne Betts was 16 years old, he was involved in a carjacking with a friend. He received three felony convictions and",1
"Oklahoma is so far from the mayhem in Charlottesville, and yet so close. The Oklahoma City Public School System has already",1
"“Support our troops,” read a leaflet my children brought home from school in their backpacks in January 1991. It was a message",1
"The white supremacist violence in Charlottesville was the tragic result of the Republican Party’s racist politics, which",1
"In 2003, the Louisiana legislature created a state-run Recovery School District (RSD) that allowed the Louisiana Board of",1
I still remember the excitement in our building when the district and the corporations first rolled them out.,1
Eva “New York City Charter Queen” Moskowitz likes to use the race card against opponents claiming charter school advocates,1
We own this man. He is our failure.,1
Do you know what time your bell tolls?,1
"By Carolyn Jones Since Donald Trump was elected president, more than 100 California school districts have declared themselves",1
"“The housing scarcity is not only real in general, it’s very real for families,” said Mitchell.",1
"By Jane Meredith Adams What Omar Quinitanilla, 12, liked best about summer school was the worrying. Not his own worrying",1
"The Partnership for Assessment of Readiness for College and Careers (PARCC) has a new website. On May 02, 2017, one could",1
"Over the past couple of days, I have witnessed almost universal praise for Dana Goldstein’s Why Kids Can’t Write*. Since",1
The rhetoric used by charter school advocates is often lacking in evidence or intentionally deceptive.,1
"By Sharisse Tracey Late in April, approximately 1,000 students in the Upward Bound Program at The University of Maine Presque",1
"By Richard Whitmire About a decade ago, 15 years into the public charter school movement, a few of the nation’s top charter",1
It’s always a thrill for this former inner city teacher to attend early education conferences. Conversations with early educators,1
"Ideally, every school should teach computer science as a staple subject, like English or math, from kindergarten through 12th grade, Partovi said.",1
The back-to-school advertisements are in full swing. Store displays portray envy-worthy dorm room setups. With August around,1
Imagine you’re settling in to enjoy an article on-line or in your favorite print newspaper and you come across this headline,1
"Sure, it's a free country and you can believe whatever dumb thing you want. But for the world of education policy, we're going to need a better answer than that.",1
"At the exact time I was giving a speech last week to 1,400 educators about ensuring that all children have access to a powerful",1
Two of my former students demonstrate the consequences of zero-tolerance discipline policies.,1
Five Keys was founded in 2003 through the San Francisco Sheriff’s Department to educate inmates in the county jail.,1
"The American Legislative Exchange Council (ALEC) is holding its 44th Annual Meeting in Denver, Colorado, from July 19-21",1
Experts say that hate crimes targeting the South Asian community are to blame.,1
Make it stop.,1
"As I’ve written, attacks on academia are bread and butter conservative discourse—even though Republicans at the highest levels",1
"U.S. Secretary of Education Betsy DeVos last week met with “college administrators, rape survivors and students accused of",1
"Between 2009 and 2014 the enrollment in teacher education programs dropped from 691,00 to 451,000, a 35% reduction. That’s",1
"No research has found that girls are less interested in competitive athletic teams than boys, according to the Women's Sports Foundation.",1
Landmark bill giving teens a shot at healthy sleep crosses another legislative hurdle.,1
Charter school advocates claim to support higher standards and provide better education than traditional public schools. But,1
"Charter school advocates are well-versed in their talking points, but those points are often devoid of fact.",1
"She didn’t mean anything combative by it, but when 2016 Oregon Superintendent of the Year Heidi Sipe wrapped up a discussion",1
"This week, the Department of Education is holding hearings (Monday in DC, Wednesday in Dallas) at which members of the public",1
Education Week published an abridged version of this piece as a letter to the editor on 7/18/2017. This is a response to,1
This is Part 2 of my July 4th Independence Day blog. Part 1 explored my approach to teaching American history and included,1
"Do you think that cyber-education is just kind of creepy, with students sitting alone in the glow of a computer screen, navigating",1
"“If you’re wondering what we should invest in, it’s women,” Chklovski said. “If you educate a woman, the whole community benefits.”",1
"Rising anti-Semitism, Holocaust distortion and continued misstatements prove we must transform and expand Holocaust education",1
Eight states actually have laws that restrict teachers from talking about LGBT issues at all.,1
Few families can afford to hire an outside specialist.,1
"By The 74 The bipartisan Every Student Succeeds Act (ESSA) was signed into law in December 2015, replacing No Child Left",1
"Today, the educational environment is plagued by teacher shortages and uncertainty; our top priority should be building a",1
"Education and testing mammoth Pearson has an established history in botchinghigh-stakes testing. Pearson did it again, in",1
"By Jane Meredith Adams Four minutes late to his first class of the day, an 11th-grade boy at Oakland’s Skyline High School",1
Students who need the most support are not well-served by choice policies.,1
"After Betsy DeVos’s last round of Congressional obfuscation testimony, many folks are asking the same question as EdWeek",1
"Our review of the PISA controversy also highlighted a problem of power in the use of evidence. With PISA, the OECD – an international",1
"James Sutter is a science teacher at Wellston High School, student population less than 500. Wellston, Ohio is a town of",1
The hope is that these maps will spark calls and conversations,1
"Previously published on Boston Globe. Trump University, it transpires, is more than a heartless joke. It is the canary in",1
"Randi Weingarten must be out of her damn mind! The president of the second largest teachers union in the country, The American",1
"By Jane Meredith Adams About 24 hours after a Clovis High School boy killed himself in early March, his cell phone buzzed",1
"As a female, I know how it feels to be told I don’t need education, or to be called intimidating because I have an education",1
"Preventing summer learning loss must be a priority, particularly for those teaching in low-income areas.",1
"When it comes to the state ed superintendent position, Louisiana is in an unprecedented spot. The state ed superintendent",1
"By Shaun M. Dougherty, University of Connecticut The Trump administration has some ambitious goals that include trillions",1
"With drastic cuts to education spending, the Trump administration will do irreversible damage to teacher quality nationwide.",1
"By Robert H. Scott III, Monmouth University and Steven Pressman, Colorado State University A college education is increasingly",1
"Sure, why not? Let’s just kill most innovation in education in the name of school choice.",1
Sexual harassment and assault are forms of sex discrimination and they occur at alarming rates in K-12 schools. Recent reports,1
"Ah, May! May is typically a busy month for most people. In May, we celebrate our mothers, kick off the summer holiday season",1
"Be timely, communicative, and focused.",1
"In the waning days of high school, I find that my graduating seniors are honest, brutally honest, in fact. For the past half",1
"On May 4, 2017, teachers, their assistants, and paraprofessionals at the Edgewater, Ill.-based Passages Charter School voted",1
At what point does a racial joke go too far?,1
Our democracy depends on those of us who teach kids.,1
"By Jane Meredith Adams Parents, teachers and students streamed into the library of Palo Alto’s Gunn High School on a warm",1
"BASIS makes advanced, immersive coursework a requirement for all students, from pre-K through high school",1
"I watched U.S. ed sec Betsy DeVos’s 23-minute speech to Bethune-Cookman grads on May 10, 2017. I do not envy DeVos the task",1
"There are more than 130 charter schools in Detroit. In 2013, the district put 79 abandoned schools up for sale. Today, more",1
The history of great teachers is filled with mothers who have dedicated their lives to education.,1
How do you know you’re ready?,1
"Earlier this week, I posted a story about ICS, the private Swiss school where my son with special needs, is now enrolled",1
The Trump administration hasn’t been shy about its contempt for public education. The president himself once said he’d close,1
"There’s a lot of banter about the substance and character of the 105th Congress. Perhaps because it’s led by one party, and",1
"In a Sirius Radio interview on Monday, May 01, 2017, Donald Trump offered journalist Salena Zito some (at best) puzzling",1
"On Friday, a large majority of Pearson shareholders, in a non-binding vote, rejected a report granting a large raise and",1
We have become accustomed to the scene of great high school athletes behind a table with multiple college hats in front of,1
"I have never been a huge fan of PISA data, the goulash of test results released internationally by the Organization for Economic",1
"A recent, comprehensive article in the New York Times titled, “The Broken Promises of Choice in New York City Schools,” was",1
"What if boosting a toddler’s brainpower was as easy as turning on a light switch? In fact, “Flip the Switch” is one of the",1
One of the great contradictions within corporate ed reform is the promoting of “parental choice” that stops short of the,1
"For most of my life, I’d always expected that I would do a PhD. As a child, my Nanna called me “Professor,” in part because",1
"As part of HuffPost’s annual “Take Your Child to Work Day” festivities, we welcomed a group of budding young bloggers to",1
"For Diane Ravitch, one of the leading advocates of traditional public education, President Trump’s first 100 days in office have been bleak.",1
University should be a place where all ideas can and should be vigorously debated.,1
My lesson has turned from an academic contemplation of Fitzgerald’s poetry and politics to a bitter reflection on the cruel realities of power.,1
"We already know what it looks like, and it does not deliver on its promises.",1
"Just google ""charter school closes unexpectedly"" and watch the stories pile up.",1
"By Mike Szymanski After passionate debate and pleas from both charter school administrators and parents, the Los Angeles",1
"By Christopher Zoukis Over the past two weeks, I have had the privilege of guest lecturing to a class of students at the",1
By Carolyn Phenicie State efforts to expand school choice — everything from charter schools to tax credit scholarships to,1
"Apparently, the wealthiest Cabinet in U.S. history considers Meals on Wheels for seniors and programs to alleviate child hunger to be wasteful.",1
"Asian Americans face discrimination in the highly selective college admissions process. Sure, highly selective colleges will",1
You can use this handy field guide to determine what variety exactly you're dealing with.,1
"Reality television has nothing on modern day school scams. In 2011, Daniel Hicks created a fake school, ostensibly a boarding",1
The Network for Public Education is leading the campaign challenging the Trump/DeVos anti-public school agenda. According,1
How will the technocrats who have driven school reform respond to this new environment?,1
"By Linda K. Wertheimer Dropping a handout with a photo on each student’s desk, the teacher Kathryn Leslie asked the teens",1
The criminal justice system is intertwined with discrimination that enables violence.,1
"A decade of teaching will produce more than good stories. It will produce insight, confidence, organization and high caliber teaching practices.",1
"When money is involved, big business gets mean. In Kenya, a multi-national for-profit private school company is using threats",1
A recent article in the New York Times discussed why children should be given opportunities for movement during class. I,1
"""After teaching about #climatechange all day, it was kind that the Heartland Institute, an organization funded by petroleum, sent me this.""",1
"According to Politico’s March 23, 2017, Morning Education, controversial New Mexico education commissioner Hannah Skandera",1
"In January, Pearson’s stock value dropped sharply when the company reported lower than expected profits, especially in its",1
A U.S. girls chorus also cited the executive order as the reason for aborting to visit Scotland.,1
"By Aria Bendix With university tuition and living costs on the rise, community colleges have become increasingly attractive",1
"On February 07, 2017, Andrea Reyes Ramirez, executive director of the Faith and Education Coalition – NHCLC, published an",1
Something has to change before it’s too late. Aren’t our children worth it?,1
"When it comes to the Big Standardized Tests, we know that one thing is important before all else― not the soundness of the",1
I know from personal experience how out of touch Betsy DeVos and the conservatives are with real poverty in America.,1
"Just as the Civil Rights Movement was not a matter of water fountain segregation, the fight for equal LGBTQ rights is not a matter of bathroom use.",1
"""We have no intention of backing down no matter what President Trump does to discriminate against the LGBTQ community.""",1
"In fact, there are some changes that I would love to see.",1
"Each year, the Gates Foundation issues an annual newsletter touting what it perceives as the gains made by its spending. In",1
President Trump has a new secretary of education and the headlines are overwhelmingly consumed with school choice issues,1
"This Presidents’ Day weekend, we’re offering up a challenge to fellow parents of young children.",1
"I would welcome additional education on religions in our schools, but actual instruction in religious studies would look very different than what the CNP is recommending",1
The average school day for middle and high school students in California starts at 8:07 a.m.,1
Regulations are strangling the charter sector. Panic struck the education establishment over the election of President Donald,1
"U.S. Secretary of Education Betsy DeVos has started visiting public schools. On Friday, February 10, 2017, she was met by",1
Seriously. What did teachers ever do to you?,1
"Around the country, from town hall to town hall, GOP officials are facing angry constituents. Why are they angry? Because",1
"On Monday, January 30, 2017, hundreds of patient protectors braved the bitter New York City cold to stand firmly in defiance against the impending appointment of billionaire school-choice crusader Betsy DeVos, 58, for Secretary of Education.",1
,1
Never before has the public gone to such great lengths to denounce a cabinet nominee. It didn't work.,1
"""DeVos’ views on public education are well outside the mainstream of either party.""",1
It should be considered an honor for American schools to provide shelter to the world's downtrodden youth.,1
"Try a thought experiment with me. Let’s say you’re a Dallas Cowboys fan ― I live in Texas, but please insert the name of",1
Donald Trump's claims that America's schools are over-resourced is both wrong and a harbinger of regression to come.,1
"In March 2015, U.S. secretary of education nominee gave this 9-page speech entitled, “Competition, Creativity and Choice",1
"Co-authored by Adam Kirk Edgerton, Lightning Jay, Elaine W. Leigh, and Katie Pak “Traditional public schools are not succeeding",1
"One year ago, Congress—urged on by parents and educators—reached a cease-fire in the education wars. After No Child Left",1
"This morning, I came upon a story that disturbed me and pushed me to reflect on the role of education in our current national",1
"This article was written by Kirah T., an Essex County, NJ Middle School Student. The following article is a part of a new",1
,1
,1
,1
Gov. Andrew Cuomo says his proposal would alleviate the student debt burden.,1
"As I have stated numerous times, a large part of our society only reads the headlines and reacts to these headlines as if",1
The nomination of Betsy DeVos to the post of Secretary of Education is such a bad choice that we don't even have to talk about actual policy ideas to understand how unsuited she is for the position,1
"Dear Teacher Colleagues, I hope that you are all enjoying a relaxing break before heading back to school next week. A little",1
,1
,1
,1
,1
,1
,1
"By Christine Gross-Loh As a young researcher, Carol Dweck was fascinated by how some children faced challenges and failures",1
By Hayley Glatter The superstitions for conjuring the snow-day cosmos on a blustery winter day are not to be taken lightly,1
International education programs and cultural understanding are as critical today as any time since Ike’s challenge to American higher education.,1
"On Dec. 5, 2016, retired D.C. teacher Erich Martel sent an investigation request to D.C.’s Attorney General Karl Racine. In",1
"Christopher Tienken (Seton Hall) has solved a mystery, and we can cancel the Big Standardized Test.",1
,1
Schools and disabled students are pitted against each other in a Supreme Court case that could require higher standards for,1
"On November 23, 2016, President-elect Donald Trump nominated Betsy DeVos for U.S. Secretary of Education. DeVos is zealous",1
The majority of those included on the Watchlist were classified as white males.,1
"When they fail, it's always personal.",1
The challenges of analyzing purchasing decisions against student achievement are many.,1
"Hell’s Kitchen, New York City. The night before Thanksgiving 2016. I am dining at a posh Italian restaurant just two blocks",1
"The Associated Press reported the following on November 26, 2016: RICHMOND, Va. (AP) — Liberty University President Jerry",1
,1
,1
"On Thursday November 10, I lectured my introductory history class about the election in a historical context. Many of my",1
"The American public knows little about President-elect Donald J. Trump’s plans for education. However, Trump has posted",1
"Jessica Lander, a teacher at a Boston-area high school and a good friend, published an essay in these pages the evening of",1
Critics of legal education might be chortling that Indiana Tech University has announced it will close its new law school,1
,1
"By imagining a post-apocalyptic world, kids build new skills!",1
,1
"Me, a high school dropout — who knew, right? It sounds comical, even now. Looking at me you would never assume this. But",1
This is part two in a series where I examine sexual assaults on university campuses across the country. I advocate strongly,1
,1
"We need to fix some problems associated with charter schools in Massachusetts before we raise the cap. So, no, I do not support raising the cap at this time. Let me explain why.",1
"The truth is that our education system won’t change anytime soon, but you have the choice to understand its shortcomings and work around it.",1
"A major problem with the charter school slogan, “charter schools are public schools,” is that charter schools are operated",1
,1
"I have clarity about what I will teach, how I will teach and what my students will learn.",1
"According to the September 09, 2016, filing of the Massachusetts ballot committee, Yes on 2, billionaire Arkansas resident",1
“I hate reading.” Ouch. I’d rather walk across burning coal than to hear these words from the mouth of a student in my classroom,1
"They just used the data to identify students whose numbers were probably going to be bad on the BS Test. Then they called those families and reminded them that they have the right to opt out of testing. Three dozen parents did so, helping the school skew its numbers a little higher.",1
,1
,1
"These steps do take work.  Effort.  From you both.  Try to keep these objectives on a low simmer in the back of your brain so you can use them as needed and often.  Do add some smiles and a sense of humor to the ways you know, and look at, and speak with one another.",1
I am a native New Yorkers so I have hated San Francisco sports teams since 1957 when the baseball Giants slinked away to the West Coast. But San Francisco 49er quarterback Colin Kaepernick is forcing me to reevaluate my fundamental sports fan nationalism.,1
,1
I’m a high school English teacher and the most important question I’m asked each year has nothing to do with reading or writing,1
"Dear Teacher, As you head back to school, I see you so fresh and eager, and I am so thankful for your energy.  Your profession",1
"Special education should be a service for children, not a place they are sent.",1
