short_description,Y
Read the whole Times report here. Now with The New York Times reporting that Apple is tinkering with such a smartwatch in,1
"Matt wanted to do his own designs, and so he took his vision for watches and launched Steel Cake, his very own watch brand.  Soon he was a small designer shipping his designs overseas to get them produced.  It wasn't fun.",1
"In the 21st century a personal digital library is available to all of us who own a smartphone, computer, and an Internet connection.What happens when Facebook, iCloud, Instagram, Flickr, Google Plus, LinkedIn, and Pinterest go away? Corporations are not people but they do have lifespans.",1
"Find out more in this week's episode of Freshwire's ""60 Seconds of Social Media"" below. Yep, the Grammy Awards have gone",1
"In addition to the hits and scores that will go viral after the Super Bowl on Sunday night, there will be, of course, the",1
"For the longest time, the promise was that software would provide an automated way to find, filter, and catagorize data and",1
"The program begins on February 25th with a series of events, including an opening reception, meetings with leading New York",1
"The latest generation of smart phones are all like Toy Story sequels: Same cast of great characters with minor upgrades to the 3D models and textures. It's time for a some real innovation, a ""big bang"" and not this incremental tweaking of last year's winning formula. It's time for someone to take some risk.",1
"Amazon makes it easy for writers to self-publish, promote, and distribute through Amazon's network. Goodreads provides a",1
"Twitter, the social network known for its 140-character messages, could not speculate on the origin of the attacks as its",1
"If you're looking to see the most popular YouTube videos of the week, look no further. Once again, we're bringing you the",1
"On one slide, managers are advised to give workers The Keeper Test: Would you fight to keep your worker? If the answer is",1
There is an immense opportunity for marketers as Google's services are further connected through the G+ social layer.,1
"A spokesperson for the company said the couple had chosen to resign from their jobs, even though no disciplinary action had",1
"I personally do not believe the U.S. Government is controlled by shadowy figures lurking behind a smoke smoke screen of faux democracy. If anything, the political and social events of the last few years are evidence that no one is ultimately ""in control"" and that every player is each equally frustrated.",1
"If you're looking to see the most popular YouTube videos of the week, look no further. Once again, we're bringing you the",1
"Read the full statement from Rabois on Tumblr. He wrote that the lawsuit accused him ""of some pretty horrible things,"" but",1
"Hello, ladies and gentlemen, and welcome to This Week In Apple Rumors, our regular look back at all of the week's unconfirmed",1
"I understand why Lance Armstrong felt he needed to dope. I don't understand why he needed to lie (and tweet) with such conviction that I believed in him. I understand why Manti Te'o needed to build a great ""brand."" I don't understand why he needed a fake social media girlfriend to do it.",1
Aaron Swartz is someone who is renowned for acts of altruistic and brilliant creation. More in his short life than most of us will manage. He helped build the commons that enables you to read this. I say this not only in sad farewell but because it's relevant to the discussion that follows.,1
"If you're looking to see the most popular YouTube videos of the week, look no further. Once again, we're bringing you the",1
Dotcom was coy about the details of the launch party as builders put the finishing touches to a festival-sized concert stage,1
"If you're looking to see the most popular YouTube videos of the week, look no further. Once again, we're bringing you the",1
"Women in the game industry are underrepresented in software engineering and top-level management, reflecting a similar trend",1
Links scraped from Twitter posts featuring the hastag are being aggregated at Pdftribute.net. Many of the links appear to,1
"Next up - a potentially game changing view of the medical world... then, a new way to buy on-line bandwidth - Karma. 10gen",1
"The billions of snippets of sadness and bewilderment spinning across the Net confirm who this amazing boy Aaron Swartz was to all of us. It angers me that he did what he did. But if we're going to learn from this, we can't let slide what brought him here.",1
I ran around the house this morning making sure the Java plugin was turned off in all our web browsers on all our computers. Why was I so panicked? Because the Department of Homeland Security issued a warning late this week about Java.,1
"It was beginning to feel like the good old days were coming back. Finally, publishers could stop giving away content for free and start making money again. Certainly they were not going to make that same mistake they had made on the Web.",1
A lot of people have been coming to Wayne Dobson's house lately -- but he's not happy about it. Las Vegas-based local news,1
"In a blog post last fall, the Center for Copyright Information -- which is coordinating the program between the movie and",1
Aaron accomplished some incredible things in his life. He was one of the early builders of Reddit (someone always turns up,1
"That drop in stock price, too, has cut some of HP's executive pay in the form of restricted stock awards from earlier years",1
Members of Anonymous set up a petition on the White House official website Jan. 7 that asks the government to recognize DDoS,1
"Hello, ladies and gentlemen, and welcome to This Week In Apple Rumors, our regular look back at all of the week's unconfirmed",1
"By Andrew Longstreth ""We know in today's world, defendants are getting more aggressive,"" said Matthew Woods, an antitrust",1
Google has backtracked. It now admits it's been blocking Windows Phone 8 users from accessing Google Maps. Read more on Business,1
"Maybe, but now the bug has gone viral, showing up on the Hacker News site, as well as Gizmodo. Probably not, according to",1
"KUWAIT, Jan 6 (Reuters) - A Kuwaiti court sentenced a man to two years in prison for insulting the country's ruler on Twitter",1
How do I discover music online that's relevant to me when most sites have 15 to 30 million tracks? That's the challenge most consumers face today as they search for new music.,1
"First Amendment considerations should have stopped the FTC's investigation at the outset. That freedom-of-speech is never mentioned in the agency's statement is, well, bizarre.",1
"While retailers prowl for products to fill their shelves, Wall Street investors look for products that are the next hit. Intel",1
"Traveling outside of the U.S., you quickly get a sense of just how much the Internet has changed how we gather and validate information. Our access to information,  and how we use crowd knowledge has changed dramatically in a few short years.",1
"""We have taken note of the FTC (Federal Trade Commission) decision, but we don't see that it has any direct implications",1
"If you're looking to see the most popular YouTube videos of the week, look no further. Once again, we're bringing you the",1
"Catch up on last week's episode, on Instagram's almost perfect year, here. In 2012, smart brands went bold with content marketing",1
"I'm told the spectacle that is CES is something that has to be seen to be believed. A technical extravaganza of epic proportions. So what on earth, you may ask, may excite a self-professed techno inept enough to venture forth into the wilds of the world's largest electronic mosh pit?",1
"After years of hammering away at Apple's share of the smartphone market with cheap-to-free Android phones, Google has lately",1
"After years of hammering away at Apple's share of the smartphone market with cheap-to-free Android phones, Google has lately",1
"Despite efforts to exert control, the Internet, in most parts of the world, remains pretty free and open and a lot of people, -- myself included -- want to keep it that way.",1
Can we use social media to play a role in mobilizing consumers and achieving energy savings?,1
"TCI is the parent company of MCI. ""In order to keep serving (MCI) with high quality, we provide this expansion proposal to",1
"The company at first defended its work. “We are continuously improving it,"" a spokesperson argued, ""and as Maps is a cloud",1
"Over the past year copyright holders have asked Google to remove 51,395,353 links to infringing webpages, a dramatic surge",1
Pinterest has arrived at that special milestone for any successful start-up: The day you get sued by someone who says the,1
"If you're looking to see the most popular YouTube videos of the week, look no further. Once again, we're bringing you the",1
"Let's own up to it: Social media is an addictive part of our everyday lives. In fact, habits like flipping through Facebook",1
"What one may find surprising is the fact that the hottest products in the toy industry right now aren't technically toys -- yup, that's right, they're tablets.",1
"Google made good on its promise to weed out views inflated by artificial means last week, according to Daily Dot. Record",1
"The company is called Leap Motion, and if you want to get an idea of how much everyone in San Francisco is buzzing about",1
China appears to be gearing up for a crackdown on its domestic Internet after a series of online exposés of corruption underscored,1
"""We are investigating exactly what happened and how it could have been prevented,"" Evers said. An outage at Amazon Web Services",1
"Seriously, though: In addition to not constantly getting lost or disoriented, you can find a bunch of great features in Google",1
"Kurt Opsahl, a senior staff attorney with the Electronic Frontier Foundation who had criticized Instagram, said he was pleased",1
"Take a look at some highlights on YouTube from Santa's first stops this Christmas Eve: Google's rival Santa tracker. ""NORAD",1
"""There are a lot of healthy people out there who unknowingly buy products that have an inordinate amount of salt in them",1
"It was the same Swingline stapler, on the same Staples.com SPLS -2.04% website. But for Kim Wamble, the price was $15.79",1
"As you celebrate this holiday season, be sure to save your digital memories by printing them out or backing them up. And beyond that, do everything you can to speak out for internet freedom.",1
"We've seen a lot of innovation in technology this year: 3D printing's gone from bones to guns, single-channel EEG's making",1
The Journal quoted the people saying that Motorola is working on two fronts: devices that will be sold by carrier partner,1
"Relations between Twitter, Instagram and Facebook have soured since Facebook successfully swooped for the photo service. Earlier",1
"The holiday season of 2011 was a hive of activity for me. One week in early December, I managed to attend a party at the",1
Twitter CEO Dick Costolo has promised in recent months that an option for users to download an archive of all the tweets,1
"Step 1: Go Through Their Game Collection If you have access, look through their game collection. See what titles they own",1
"If you're looking to see the most popular YouTube videos of the week, look no further. Once again, we're bringing you the",1
The details concern terms of Motorola's licenses with third parties and Microsoft's business and marketing plans for future,1
If your brand isn't taking advantage of the video revolution - 800 million YouTube users watch 4 billion hours of videos,1
"Of course, that's only a sampling. The anger is evident on Facebook, too, as the Daily Dot notes. There, the website reported",1
"Hello, ladies and gentlemen, and welcome to This Week In Apple Rumors, our regular look back at all of the week's unconfirmed",1
We've already presented the best holiday light displays of 2012 and now we're serving up the most popular Hanukkah videos ever to hit YouTube!,1
"Bing thinks that Google is ""scroogling"" you by giving you a bunch of paid ads disguised as search results. But as long as other search experiences are sub-optimal to Google, it does not have any evolutionary pressure to do any better than it already does.",1
"For the United States Air Force, installing a new software system has certainly proved to be a wicked problem. Last month",1
The company is being tweaked for its relatively measly investment in U.S. manufacturing. But the impact of $100 million on,1
"This week,  NYCEDC had an 'eat our own dog food' moment.  We decided to have a 'virtual'  office hours event for the Entrepreneur at Large community.  We learned a lot,  both about the tech and the city -- and most importantly we learned that we'll do it again.",1
"These and several dozen other recipes can be found in a new cookbook, The Startup Chef, available exclusively as an ebook",1
"Regardless of what you think of methodology, the Visible Measures list provides a handy look back at some of the larger and",1
"If you're looking to see the most popular YouTube videos of the week, look no further. Once again, we're bringing you the",1
"Singing from the same songbook as Web juggernaut Google, the U.S. government is strongly opposed to any changes to the International Telecommunication Regulations, arguing the Internet has nothing to do with 'traditional' telecommunications -- and that freedom is at stake.",1
"On his blog, for example, McAfee has described the elaborate steps he has taken to evade capture. McAfee has ""disputed any",1
"(Click here for original article.) Watch The World's Cheapest Tablet In Action, DataWind's $40 Ubislate 7ci via FastCompany",1
Let's get the NY vs. San Fransisco Reality TV Debate out of the way.,1
"In my 25 years of working I've only really seen one kind of business: the high-risk and entrepreneurial kind. Being an entrepreneur is everybody's business, no matter whether you are on the bottom of the totem pole or at the top of heap.",1
A member of the in-theater camcording gang known as the IMAGiNE Group was handed a 40-month prison term Thursday in what,1
The fears aren't coming out of nowhere. Members of the U.S. Congress have at times raised the idea of giving the president,1
"We really wanted the Microsoft Surface to succeed, if for nothing else but to light a fire under Apple to step its game up",1
"""We're getting close to figuring out the formula,"" he said. By Gerry Shih Aoun's app pits his company against the likes of",1
"The Syrian Observatory for Human Rights, an opposition-linked violence monitoring organisation, said connectivity had returned",1
"If you're looking to see the most popular YouTube videos of the week, look no further. Once again, we're bringing you the",1
"Oh, it's on! Black Friday is in full swing -- but do you really even need to leave the house anymore? Only 23 percent of Black Friday shopping took place online in 2006. Last year? 40 percent. Hey, why brave the crowds when you can shop in your PJs?",1
Thanksgiving is a time for looking back -- and thinking about the year ahead. So with that in mind -- I wanted to take this time to share some things I'm thankful for in this growing tech city.,1
HP lost $8.8 billion on acquisition gone bad. Are high-priced consultants and accountants like KPMG and Deloitte to blame,1
The past week's violence in Gaza has rekindled calls for Twitter to shutter the accounts of U.S.-labeled terror groups such,1
"If you're looking to see the most popular YouTube videos of the week, look no further. Once again, we're bringing you the",1
Consumers who are willing to give brands a peek into their private lives by following them on Twitter or becoming their Facebook fan should be able to use their data in their favor.,1
"""We just made a phone call and I talked to him and said 'Hey, so many people asked did you meet Justin Bieber?'"" Psy said",1
HELSINKI (Reuters) - Nokia's long-time imaging chief Damian Dinning has decided to leave the loss-making cellphone maker,1
Officials dealing with the destruction in the U.S. Northeast say one of their biggest headaches is debris-removal fraud committed,1
"This is because software companies often bundle products and services such as licenses, installation, training and maintenance",1
"""That's what retailers want you to do,"" says Dan Olds, who runs Gabriel Consulting Group, a retail trend watching firm. MAXIMISE",1
The letter was a response to a request from the U.S. Securities and Exchange Commission's Office of Global Security Risk,1
"The RIAA and MPAA, though, have kept a clause in the initiative that lets them demand personal information about copyright",1
"One of Apple's biggest bargains is on laptops, which, while it won't win any doorbuster prizes, is still a sizable discount",1
Are there people you absolutely can't stand to follow on this digital platform? Sound off in the comments section or tweet,1
"Now those who are really serious about food have QOOQ, conveniently pronounced ""cook."" QOOQ founder Jean-Yves Hepp, who made",1
"After an impressive career at Stanford and Hotwired, June Cohen from TED sat down with Chris Anderson to discuss the start of an incredible journey towards nearly one billion video views and to talk about how the TED Conference began opening itself ""up to the world.""",1
"Finance Minister Yuval Steinitz said just one hacking attempt was successful on a site he did not want to name, but it was",1
"As punishment, the FCC required the cable provider to offer the service a year longer than the original requirement, conduct",1
"""...[When] the government of Israel publicly threatened to sever all Internet and other telecommunications into and out of",1
"We could all use a little help with our gift lists on the go. Instead of asking Siri, look to these apps to navigate your",1
"By Ben Blanchard ""This could only happen because China's intellectual property rights environment sets foreign investors",1
"Late last year, the U.S. International Trade Commission ruled that HTC had infringed upon one of four patents Apple had disputed",1
(Reporting by Himank Sharma in Bangalore) (Reuters) - Spotify is in the middle of a $100 million financing round that could,1
"A few days before the presidential election, Mitt Romney's campaign announced what it hoped would be its secret weapon at",1
It was a perfect storm of technical issues and a confusing training program that rendered ORCA unusable and completely unhelpful,1
"Far from being a settled matter, the appropriateness of public displays of grief is now being debated in the context of social media. Some applaud live-tweeting a funeral for extending the circle of participation. Others don't see things this way.",1
"If you're looking to see the most popular YouTube videos of the week, look no further. Once again, we're bringing you the",1
"If you're looking to see the most popular YouTube videos of the week, look no further. Once again, we're bringing you the",1
"After my New York City apartment lost power around 8 p.m., my smartphone's data plan suddenly became my only connection with the outside world. Tweets from the community are helpful to get a distributed feel of the situation but they have to be taken with a grain (a byte?) of salt.",1
"STARTING in February, Jeffrey G. Katz grew increasingly anxious as he watched the steady decline of online traffic to his",1
Social-media companies Facebook Inc. FB -0.14% and Twitter Inc. are trying to turn political advertising into a big business,1
"The IGF is a United Nations forum to discuss a wide variety of issues regarding Internet governance. Unlike many U.N. forums, IGF is attended not just by government officials but also by corporations, non-profit groups and scholars interested in how to handle content management on the global Internet.",1
"Call me a reductionist, but I believe the consumer is most wanting a desktop experience and a tablet experience, independent of the other.",1
"“It was churning like crazy. You can see the line here,” Chris Levendos, Verizon’s executive director of national operations",1
"Olivia Cieri spent most of the work week after Hurricane Sandy volunteering at ABC No Rio, an artists’ collective on Rivington",1
"In the coming months, Twitter plans to update its mobile applications to introduce filters for photos that will allow people",1
"The link takes you to a straightforward, if legalese heavy, description of the ruling in favor of Samsung on Oct. 18: At",1
"Both of her family's cars were destroyed in the flood, and without electricity, her phone is her only connection to the world",1
"Courtesy of What's Trending, YouTube's famous Keyboard Cat pays a chill, musical tribute to Marty the cat -- the inspiration",1
Were you on the internet more because of Hurricane Sandy? Did you use services like Skype or Twitter to stay updated? Let,1
Stock markets are supposed to be efficient. Rational actors continually process data in a methodical way and spit out the,1
"""I don't see any significant improvements in the technology in the past few years,"" says Calvin Shao of Fubon Securities",1
"In the meantime, find out how to track Hurricane Sandy online (here) with our handy Twitter and Facebook page rundowns. You",1
"Windows 8, Microsoft's attempt to be more Apple than Apple, is about to shake up my world and the world of serious gamers everywhere.",1
"Quickness -- (We cheated on 'Q', sue us.) Microsoft has drastically improved the time it takes to boot up a Windows 8 machine",1
"If you're looking to see the most popular YouTube videos of the week, look no further. Once again, we're bringing you the",1
The Olympic silver medalist is getting hitched to sweetheart Wong Mew Choo on November 9 and the chosen few will be able,1
"The updated document (seen here) states the following: The U.S. Copyright Office published a document on Oct. 26, specifying",1
Need an easy-to-assemble Halloween costume that'll surely be the talk of the party? There's an app for that!,1
TALENT HUNT The new strategy is not without risks: it positions Yahoo squarely against Facebook Inc and Google. It also risks,1
"Tech used to mean software, but that's changing rapidly.",1
"(anjuli.davies@thomsonreuters.com; +44 207 542 6670) Her departure will be a blow to Facebook, the world's biggest social",1
"Hello, ladies and gentlemen, and welcome to This Week In Apple Rumors, our regular look back at all of the week's unconfirmed",1
"The current workforce at Foxconn's Longhua site is around 220,000, of whom about one-quarter stay on-site in dormitories",1
"Here is one obvious fact that was lost on Michael Brutsch, even though he is a computer programmer who should have known better: The Internet knows you are dog, a cat, or a creep.",1
(Reuters) - Google Inc is considering a settlement with the Federal Trade Commission over potential claims it broke antitrust,1
"Airbnb and a spokesman for Thiel both declined comment Friday afternoon. Details of the investment round, which has not yet",1
"YouTube and its roughly 200 or so networks may be the new ""new media,"" but their way of doing business is very ""old Hollywood",1
"If you're looking to see the most popular YouTube videos of the week, look no further. Once again, we're bringing you the",1
"Most people have a lot of questions when deciding what smart phone to buy, especially when you're choosing between two competing",1
"It's just the beginning, guys. Every breath you take. Every move you make. Every bond you break, every step you take, Apple will be watching you. Unless you find the well-hidden option, that is.",1
"[Torvalds] says he only uses desktops and laptops that store data and applications on flash memory, the same stuff that holds",1
,1
Bobbi Duncan desperately wanted her father not to know she is lesbian. Facebook told him anyway. Read more on WSJ.com,1
A set of leaked internal AT&T training documents obtained by TorrentFreak reveal that the Internet provider will start sending,1
"Now that YouTube has revealed that curation is core to their strategy of contextualizing video content, and curators will be paid, leaders in the Fair Use and Remix community are taking notice.",1
"The show's recent ""Tech Talk"" skit assembles a mock talk show where vocal tech bloggers air their grievances about the device",1
"Take a look at our live blog from the event for photos, videos, tweets and more from the exciting ascent and skydive as they",1
"Hello, ladies and gentlemen, and welcome to This Week In Apple Rumors, our regular look back at all of the week's unconfirmed",1
"""How awesome would it be if there could be an environment that would be dedicated to helping entrepreneurs...grow and scale",1
The bug is the result of an IOS 6 problem that connects the phone to the cellular data network whenever the phone is connected to a WiFi signal.,1
"If you're looking to see the most popular YouTube videos of the week, look no further. Once again, we're bringing you the",1
I have three flat touch devices on my desk right now. All three pretty much do the same thing. I feel having three of these things should be an extravagance but it's not.,1
"If the court approves the settlements, the publishers will pay for e-book refunds that will be applied automatically to the",1
"Apple CEO Tim Cook recently published a public apology for the company's half-baked Maps app, which was developed to replace",1
"""Halo 4: Forward Unto Dawn"" series is the largest-scale live-action event EVER set in the Halo universe! The show also provides the perfect segue into the the new Halo 4, which will launch just as this series ends on November 6.",1
