short_description,Y
A failed startup suggested that Facebook mounted what could be described as mass surveillance.,1
The NTSB published a preliminary report on the incident Thursday.,1
And no one will know when you use it.,1
The firm at the center of the Facebook data hack made the decision after suffering a sharp drop in business.,1
Two women decided it was time to have one.,1
"Facebook's first community standards enforcement report shows the company is ""trying to be as open as we can,” an executive said.",1
Tesla CEO Elon Musk tweeted that it's amazing the driver wasn't more seriously injured.,1
The investigation was launched in response to the Cambridge Analytica scandal.,1
Drivers have succumbed to carbon monoxide poisoning after forgetting to turn off a vehicle in their garage.,1
It's not yet known if the autopilot was engaged. The car's driver suffered a broken ankle.,1
"Super cool, or bone chilling?",1
"If you’re on a time crunch to find a perfect Mother’s Day gift that’ll still arrive on time, it’s your lucky day. Amazon",1
The first-of-its-kind accident killed a pedestrian in Arizona earlier this year.,1
"An “internal defect” led users’ account passwords to be stored in an internal log, the company said.",1
"Last week at a conference in France, Amazon announced a new Alexa feature that makes it possible to use the smart assistant",1
The device alerted him to an alarmingly fast heart rate.,1
You'll be able to stop Facebook from linking browsing data with your account.,1
"A Facebook engineer was fired after allegedly self-identifying as a ""professional stalker"" and telling a woman on Tinder that she was ""hard to find.""",1
"Facebook (FB) wants to help get you … into a long-term relationship. That’s according to CEO Mark Zuckerberg, who announced",1
A glitch on Tuesday morning led Facebook to question everything posted on the site.,1
Jan Koum reportedly differed with WhatsApp's corporate parent over encryption and user privacy.,1
"For years, Facebook had “community standards” for what people can post, but only a relatively brief and general version was publicly available.",1
"Aleksandr Kogan said he assumed people were aware that their data was being taken, but just didn't care.",1
"CEO Mark Zuckerberg said that, for security reasons, the company collects “data of people who have not signed up for Facebook.”",1
A London judge says Google must scrub search results related to one man’s prior criminal conviction — but not for another man.,1
The app company also says it will run more background checks on its drivers.,1
The new feature works on some Android devices and on Apple phones back to the iPhone 6s.,1
The social media giant admitted that up to 87 million users may have been affected.,1
"The incident happened on or after Sept. 26, 2017 and was found and resolved on Oct. 12.",1
The company acknowledged last month that a privacy mishap had affected 50 million users.,1
"“We connect people. Period. That’s why all the work we do in growth is justified,"" an executive wrote in 2016.",1
The company's reaction to a leaked internal memo shows a shocking lack of self-awareness.,1
"Landlords using the platform's ad technology can exclude women and families with children from viewing rental ads, according to the complaint.",1
He also deleted his personal profile.,1
Facebook bought WhatsApp for $19 billion in 2014.,1
Why it might be time for some digital spring cleaning.,1
The company's shares were down 2 percent on Thursday.,1
"The ad-free, privacy-oriented Instagram competitor exploded in popularity this week.",1
One story. Many perspectives.,1
But she's not the only one getting snippy at Snapchat.,1
"This is Insta-tattling, plain and simple.",1
All competitions are running as planned as officials continue to investigate a disruption of non-critical systems.,1
Who knew dogs could ski-jump?,1
Selected users now have the option to flag posts to Facebook.,1
“World’s safest flamethrower!”,1
"""People who know what’s happening around them are more likely to get involved and help make a difference,"" said CEO Mark Zuckerberg.",1
"A confidential U.S. Secret Service alert sent to banks said the hackers targeted stand-alone ATMs typically located in pharmacies, big box retailers and drive-thru ATMs.",1
"If you like chucking your phone across the room, this is the game for you.",1
"""We can't wait for folks in Washington to come to their senses,"" says Montana Gov. Steve Bullock.",1
"""Never before has a drone fitted with a flotation device been used to rescue swimmers like this.""",1
YouTube didn't address what penalties Paul might face for his controversial video showing a dead body.,1
The writer of a controversial Google memo is accusing the company of silencing conservative viewpoints.,1
"""There is no good reason why you should not address this issue proactively,"" the shareholders wrote.",1
"With Safari and virtually all other popular browsers not patched, hundreds of millions of iPhone and iPad users may not have secure means of web browsing until Apple issues its patch.",1
"""You’re damned if you do, damned if you don’t,"" one woman said of attending these secret gatherings.",1
"Remembering Equifax, Uber and all the other data breaches of the last year.",1
The sale starts Dec. 29.,1
We should hardly be surprised that Bitcoin is on a wild speculative ride—that’s the essence of privatized credit creation.,1
But only in certain circumstances.,1
The tech giant has proven time and again that it doesn’t deserve our trust.,1
A heartwarming video perfectly captures the spirit of the season.,1
"That's why everyone has to start posting, the company argues in a blog post.",1
The divide just got a LOT bigger.,1
"It could also be cheeky passcode training, an Apple spokesman says.",1
Apple says the rumors aren't true.,1
In 2016 LinkNYC began deploying free public Wi-Fi kiosks throughout the city. The kiosks made news when people began using,1
"If you’re still looking for gift inspiration, these 12 days have got you covered",1
The former employee who had shut down The Donald for 11 minutes says he loves Twitter and America.,1
And it's working with other companies to scrub the internet of recruitment propaganda.,1
📺📺📺,1
"""In a few years, that bot will move so fast you’ll need a strobe light to see it. Sweet dreams…""",1
"Scrapping current regulations “does not make sense,"" the Canadian prime minister said Wednesday.",1
Amazon Web Services Secret Region expands after some troubling cloud security screwups.,1
The wait is over.,1
"Move over, Amazon 👋",1
"For hobbyist gamers, the Xbox One S is a wallet-friendly choice 🎮",1
🔍👀,1
There’s something on sale for every type of user 💻,1
"The outrage over Russian manipulation of social media platforms like Facebook, Google and Twitter during the 2016 election",1
Vibrator app wasn't directed to eavesdrop.,1
"In response to the backlash, Twitter paused its verification process, saying it needs to reconsider a broken system.",1
"This post first appeared at BillMoyers.com. Beginning in 2004, Mark Zuckerberg and his companions made a historic contribution",1
The company is making quick work of its promise to help restore power to the hurricane-ravaged island.,1
The move signals Amazon’s ambitions in the growing market for home security devices.,1
"“We have more and more concentrated power and wealth,"" Sam Altman said.",1
"Callisto has already empowered survivors on college campuses, but people want to see it expand to Hollywood and tech.",1
"Fortunately, you can take action in the face of digital vandalism.",1
"Facebook owes America an apology, she said.",1
"I was an archetypical progressive educator, respecting the autonomy of students and empowering them to follow their passions",1
"TTY never, AIM :'(",1
It is time to build an intelligent tech and trade initiative.,1
"We are addicted to our phones not because we rely on them, but to the extent that we recruit them to a harmful project of self-avoidance.",1
Investing in global infrastructure should include fast and secure digital connectivity The idea of economic planning dominated,1
The social network is responding to criticism that it is too simple for providers of fake news and sensational headlines to cash in.,1
"The phone features wireless charging, an infrared camera and special hardware for facial recognition.",1
"I was able to sit down with Wendy Lea, CEO of Cintrifuse, and talk about her career, and the question how tech can be more",1
"You’ll help weaken its business model, which is the most impact you can have.",1
Social media provided stranded people with a digital megaphone that could be carried far beyond Harvey’s path.,1
Dara Khosrowshahi faces a daunting task.,1
The company-wide meeting was slated to discuss the controversy over a memo opposing diversity policies.,1
"James Damore's Wall Street Journal essay decries ""public shaming.""",1
"For a man who’s claimed he values “diversity and inclusion,” these are some very odd bedfellows.",1
The memo stoked the heated debate over treatment of women in the male-dominated Silicon Valley.,1
Computer science is a world where women are disproportionately represented. This leads to a gender bias in the way our technology,1
"The stats on remote working are hard to ignore. From increasing productivity to using less “sick time”, remote working has",1
"Take a deep breath. Ten years ― that’s how long it’s been since the first iPhone arrived. It launched a new era, a juggernaut",1
You won't know how your phone lived without it for so long.,1
What if I told you we haven’t seen a genuine innovation to commercial flight in over 60 years? The Boeing 707 of the 1950s,1
"The feature that sets Venmo apart is the social feed, which brings transparency to a class of transactions that used to be entirely private.",1
"Microsoft declared its beloved graphics program ""deprecated"" and said updates will cease this year.",1
"As I moved into my late 20s, my Facebook feeds started to morph. One by one, my friends posted their exciting pregnancy announcements",1
"By Ingrid Lunden Amazon has made no secret of its ambitions to expand into more fresh food services, from its own, homegrown",1
"The actor-investor posted a tone-deaf list of questions about women and investing. The first one: What are the rules for flirting at work, exactly?",1
Crystal clear.,1
What happens when we abandon the century-old five borough partitioning of New York City and remap the city to reflect the realities of 2017?,1
The action came after a seven-year long investigation prompted by scores of complaints from rivals.,1
When company CEOs make big statements about change in mission my skeptical journalistic brain kicks in. Is this a PR move,1
The social networking giant has indicated that it was willing to commit to production budgets as high as $3 million per episode.,1
"Western technology companies, including Cisco, IBM and SAP, are acceding to Moscow's demands for access to closely guarded product security secrets.",1
Who doesn’t want to spend their day looking at emoji?,1
The company will take a tougher position on videos containing supremacist or inflammatory religious content.,1
Alt-right mascot doesn't make the cut for the Apple store.,1
The 67-year-old sustained serious injuries after flipping over an open access door.,1
Coded messages on her site were tied to the Turla hacker control server.,1
"As former FBI Director James Comey prepares to testify before Congress this week, it is worth reflecting about how poor cybersecurity",1
Apple's announcement drew a cheer from the crowd at a conference Monday.,1
Anthony Levandowski is at the center of a legal battle between Uber and Waymo.,1
The CEO’s father was being treated at an area hospital for what was described as moderate injuries.,1
The attacks are among the fastest-spreading extortion campaigns on record.,1
The personal health data of 30 million Americans has been compromised since 2009.,1
"Schools and hospitals were among those targeted, and attacks ramped up this week.",1
"While we can’t guarantee your safety, these precautions will certainly minimize your risk.",1
"As is often the case, the technology has developed far faster than policies and regulations.",1
"Stealth sweeper says he'll use 40,000 photos for female and male facial recognition training for artificial intelligence.",1
Facebook acknowledged that it has become a battleground for governments seeking to manipulate public opinion in other countries.,1
"Testing on the fitness tracker found that it sustained external damage, the company said in a statement.",1
"By Lily Hay Newman for WIRED. As end-to-end encrypted messaging apps have exploded in popularity, several well-known services",1
"By Cade Metz for WIRED. Last week, Mark Zuckerberg unveiled what he calls the world’s first augmented reality platform, a",1
"By Adrienne LaFrance Like “big data” and “social media” before it, the term “artificial intelligence” has become so buzzworthy",1
"By Klint Finley for WIRED. The Coalition for Better Ads, a consortium of ad, publishing, and tech companies, wants to save",1
"LOL @ this IRL episode of ""Silicon Valley.""",1
The accused killer's shocking video stayed online for about two hours.,1
"Non-consensual pornography or ""revenge porn"" can be eliminated right now.",1
The social media company is taking out full-page newspaper ads with tips for spotting untrustworthy sites.,1
"Online searches for ""going to war"" are also spiking.",1
"""If true, these allegations are very concerning,"" Lyft said.",1
Uber's head of communications leaves as the bad publicity piles up.,1
"People want to see accurate information on Facebook and across the web. As a response, Facebook just launched a new educational",1
"""It’s wrong, it’s hurtful, and if you report it to us, we will now use AI and image recognition to prevent it from being shared across all of our platforms.""",1
"It's cool because with reusable rockets, space flight could get cheaper.",1
"Will technological revolution result in a safer and better world, or a more dangerous one?",1
"By Kaveh Waddell Last February, a Somali man boarded a Daallo Airlines flight in Mogadishu, Somalia’s capital. Twenty minutes",1
By Tim Moynihan for WIRED. Lithium-ion batteries have been making headlines for all the wrong reasons. The latest marquee,1
A U.S. intelligence official said employing criminal hackers helps “complement Kremlin intentions and provide plausible deniability for the Russian state.”,1
"Amnesty International, Duke University and Forbes were among the verified accounts affected by the hack.",1
The 3-year-old girl is the first fatality in the U.S. linked to the notorious battery problem.,1
Welcome to TechBargains Weekly deals where they find the best deals of the week to save you time and money. Act fast as stock,1
"Well, that didn't take long.",1
"""Someone should tell Snapchat that Marie Curie didn't have a smoky eye. But she did win a Nobel Prize twice.""",1
Computers are infected with ransomware and attackers seek Bitcoin payoffs. Signs again point to Russia.,1
Internet service providers hailed the decision. Consumer advocates objected.,1
"We know, we know, Elon Musk is basically the brilliant Bruce Wayne like billionaire the world needs right now. He is a",1
Sometimes Twitter eggs hatch into monsters.,1
Think before you react.,1
"If you have been watching political tectonics on both sides of the Atlantic, you may have noticed that analysts are increasingly",1
This is exactly how we hope it happened.,1
The future is here.,1
"On July 5th, 2016, Rashain Carriere-Williams woke up to the news that Alton Sterling, a father-of-five, was fatally shot",1
Aging spans cover the nation as delayed maintenance may threaten drivers.,1
This device enables you to donate to the ACLU with the push of a button.,1
"""Consumers didn’t know that while they were watching their TVs, Vizio was watching them.""",1
"""There is no single solution to these issues and we are actively engaging with the Reddit community to improve everyone’s experience.""",1
Because we could all use some good vibes right about now. 😊,1
His life is a reminder that what is legal isn't always the same as what's right.,1
"It’s a great time to break free from the tyranny of your mobile operating system. But which one? For Seshu Kiran, it meant",1
It's the second such attack in the space of a few days.,1
The voice-activated device got a little too helpful this time.,1
What if the abuse isn’t streamed live on social media?,1
"Introducing the ""Trump trigger.""",1
President-elect Donald Trump’s economic growth plan has sparked debate from economists on the left and the right. Both sides,1
"Even amid a year of disheartening political news, 2016 brought a number of advancements that are changing the global tech terrain",1
Is Apple near the end of their run? Apple has become the number one trusted brand for computers and cell phones. People buy,1
"Before it starts building airships, it's fighting just to get U.S. drone delivery off the ground.",1
"Unfortunately there isn’t a recipe for creating happiness, that is up to you.",1
"Worried about the state of the world? Yeah. Me, too. I have an idea. I guarantee that if enough of us do this one thing, our",1
Dashcam footage shows the Tesla braking just moments before the car ahead is rammed into a guardrail.,1
"The top search result for ""did the Holocaust happen"" is no longer a neo-Nazi propaganda site.",1
I thought we would grow old and die together.,1
"Apple said a ""hidden Safari setting"" caused Consumer Reports to produce inconsistent battery life test results.",1
Dell XPS 8900 Intel Core i7 Quad-Core Desktop with Windows 7/10 Pro for $599.99 (List price $799.99) Use code: 599XPS. This,1
Uber says the California DMV doesn't understand its own rules about driverless cars.,1
"On December 1st, the President’s Commission on Enhancing National Cybersecurity (PCENC) released their final report. The",1
Yahoo probably let attackers read your password.,1
Calling all news junkies!,1
"One of the single most important skills for a young coder to grasp is logic. Computer code works through ruthless logic, so",1
The app's new function allows you to save individual posts to a page that only you can see.,1
The company believes this massive attack in 2013 is separate from the hack of 500 million accounts in 2014.,1
Cheers to this!,1
"In under 36 hours, the students achieved something Facebook really needed to do.",1
You're welcome.,1
"""It was a robot, no hard feelings.""",1
The justices sent the case back to a lower court to reassess the proper amount of damages.,1
"By Tim Moynihan for WIRED. If you got an Amazon Echo or Google Home voice assistant, welcome to a life of luxurious convenience",1
"Last weekend, I was preparing to submit a book manuscript to a publisher. I had met an interested editor this summer. Let’s",1
"I'm trying to find my place in the place I love, and I'm constantly failing.",1
She's focused on female empowerment and helping people cope with grief.,1
Black Friday and Cyber Monday may be over but the deals are still going strong during Cyber Week. Retailers have extended,1
Home & Kitchen Electrics: Instant Pot 5-Quart Electric Pressure Cooker (Highly Rated) $49 (Orig $89.95) Hoover Spotless Portable,1
The president-elect's home was listed that way for several hours Saturday.,1
Probably not a good move.,1
The social network was banned in China in 2009 as the government sought to tamp down unrest.,1
iRobot Rooma 650 Vacuum Robot for $274.99 (Orig: $375) You can't beat a vacuum that does the work for you! Schedule the Roomba,1
"A week ago, Zuckerberg was dismissing the scourge of fake news on Facebook.",1
"Some are logging off, others turn to activism.",1
The messaging app could go public as soon as March and be valued at $20 billion to $25 billion.,1
The new service will provide another means for people to communicate without fear of eavesdropping.,1
"This week’s election has been a deeply controversial, emotional roller coaster. It got me thinking about how we ended up",1
"Don't worry, we're fine now.",1
"His ""You've got mail!"" brightened your day (unless you, um, didn't have any new mail).",1
"Leslie Woz' Dell laptop is a lemon, and now it's out of warranty. Should the company honor an implied warranty? Question",1
"Human traffickers worldwide use technology to recruit, exploit, and monitor their victims. They lure victims in Internet",1
"Nevertheless, investors remain bullish on the tech juggernaut",1
"Scroll, stop and spend!",1
The service is looking into offering offline streaming.,1
The same group is suspected of the attacks on U.S. political groups.,1
"Say it ain't so, Apple!",1
"Don't just ""like"" your friend's engagement photo. Send a cackling witch!",1
"“This is horrifying. This is massively illegal.""",1
The internet just became a much sadder place.,1
It was in late August 2015 when I found out that Visualise had won the Doctors Without Borders (MSF) Forced From Home project,1
"Devices were infected to carry out a ""sophisticated, highly distributed attack"" to wreak online havoc.",1
"Hackers co-opted web cameras and home routers in a massive attack that disrupted access to Twitter, Spotify and Netflix.",1
Now's a great time to get a head start on shopping!,1
"From ""How to stop Trump?"" to ""How to sell your soul?""",1
The top smartphone maker had to recall millions of the Note 7s after reports of some exploding in flame.,1
"By Steven Levy for Backchannel. On June 17, 1972, Washington, D.C. police caught five men breaking into the Democratic National",1
Still waiting.,1
Exploding phones don't mix well with air travel.,1
The company has taken a $2.3 billion hit over the smartphone debacle.,1
The justices may allow a jury to recalculate how much the iPhone maker is really owed.,1
"“Consumers with either an original Galaxy Note7 or replacement Galaxy Note7 device should power down and stop using the device,” Samsung said.",1
"Dennis Tucker's Yahoo mail is acting up again. This time, messages are missing. What's more, no one seems to care. What can",1
No one was injured in the incident.,1
Humanity is moving from evolution by natural selection to evolution by intelligent direction at an accelerating pace.,1
"William Fee is dead but an impostor just started a Facebook account for him. Why won’t Facebook remove the bogus, and hurtful",1
It all started 15 years ago.,1
"Jeff Dougherty snapped 98,366 photographs for the stunning clip.",1
Snap the world from your perspective. 👻,1
'Gram your drafts (seriously).,1
Yahoo said it was working with law enforcement on the matter.,1
"""It charred every single thing, melted every single thing that I had in the bag.""",1
"Supplies of the larger size of Apple’s new phone have been exhausted in all shades, and the smaller iPhone 7 has also sold out in the new jet black color.",1
The agency said that owners of the smartphones should stop using the devices and turn them off because of the threat of a battery fire.,1
We'd double-tap this.,1
The company issued a massive recall after reports of the phones' batteries igniting in flame.,1
"By Davey Alba for WIRED. Google calls it Project Sand Hill. Since 2012, Suman Prasad and his team have worked with various",1
"The Galaxy Note 7 was recently recalled for an exploding battery, something this SUV's owner said he didn't know.",1
A devastating blow for what had been a revival in the firm’s mobile business,1
"The recall is unprecedented, and comes just weeks after the highly-anticipated phone's debut.",1
"European Competition Commissioner Margrethe Vestager dismissed Cook’s broadside, saying the demand for a 13 billion euro ($14.5 billion) back tax payment was based on the facts.",1
The explosion took place during a test firing of the Falcon 9 rocket.,1
Apple and Ireland were accused of dodging tax rules by letting Apple shelter profits in exchange for jobs.,1
The massive sum was 40 times bigger than the previous known demand by the European Commission to a company in such a case.,1
Bitcoin as a currency is simply one application.,1
The hunted becomes the hunter.,1
The change comes after the social network was accused of suppressing conservative viewpoints.,1
Telling the public to cool it on the memes apparently backfired.,1
It's the end of the world as we know it.,1
"Incredibly, there are fewer women in tech now than in 1990.",1
Social media companies are trying to balance curbing terrorist propaganda and protecting free speech.,1
Moon Express plans to fly a suitcase-sized lander to the moon for a two-week mission in 2017.,1
"""It was pretty freaking painful.""",1
Officials fear that the game could be used to lure victims.,1
"The latest layoffs take the company's total planned job cuts up to 4,700.",1
Apollo astronauts who ventured to the moon are at five times greater risk of dying from heart disease than shuttle astronauts,1
Facebook hit 1.71 billion users and record high share price.,1
A new petition is demanding change.,1
Surveillance technology like StingRay can sweep up data from any cell phone in its range.,1
"As a string of gun rampages continues in America and beyond, more evidence is emerging that copycat mass shooters are on",1
But there's a catch. 👀,1
The goal is to offer people a unique way to experience the game.,1
The app actually won't make the Japanese game company much money.,1
Can you spot the difference?,1
Let's break it down.,1
"Well, this is different.",1
